Authors,Author(s) ID,Title,Year,Source title,Volume,Issue,Art. No.,Page start,Page end,Page count,Cited by,DOI,Link,Document Type,Publication Stage,Access Type,Source,EID
"Schreieck, M., Hakes, C., Wiesche, M., Krcmar, H.","57189630979;57197726093;42962873700;6603243872;","Governing platforms in the internet of things",2017,"Lecture Notes in Business Information Processing","304",,,"32","46",,2,"10.1007/978-3-319-69191-6_3","https://www.scopus.com/inward/record.uri?eid=2-s2.0-85031896479&doi=10.1007%2f978-3-319-69191-6_3&partnerID=40&md5=ee5b680d78d30543ac4dc9315ff74b0b",Conference Paper,"Final",,Scopus,2-s2.0-85031896479
"Khambete, P., Sabnis, G., Jain, A.","55538687700;57193507713;57193511123;","Blending rapid ethnography and grounded theory for service experience design in organizational setting: Design of a peer to peer social micro-lending service",2017,"Smart Innovation, Systems and Technologies","65",,,"117","131",,,"10.1007/978-981-10-3518-0_11","https://www.scopus.com/inward/record.uri?eid=2-s2.0-85014437695&doi=10.1007%2f978-981-10-3518-0_11&partnerID=40&md5=d36f8e68a72187c0f047429df04150a0",Conference Paper,"Final",,Scopus,2-s2.0-85014437695
"Altman, E.J., Tushman, M.L.","57195716286;6602681606;","Platforms, open/user innovation, and ecosystems: A strategic leadership perspective",2017,"Advances in Strategic Management","37",,,"177","207",,4,"10.1108/S0742-332220170000037007","https://www.scopus.com/inward/record.uri?eid=2-s2.0-85029595670&doi=10.1108%2fS0742-332220170000037007&partnerID=40&md5=27134c3f3b58729faf21a7ddac3f79db",Article,"Final",,Scopus,2-s2.0-85029595670
"Wan, X., Cenamor, J., Parker, G., Van Alstyne, M.","57197110504;55934409000;8858334600;8960223000;","Unraveling platform strategies: A review from an organizational ambidexterity perspective",2017,"Sustainability (Switzerland)","9","5", 734,"","",,12,"10.3390/su9050734","https://www.scopus.com/inward/record.uri?eid=2-s2.0-85019069241&doi=10.3390%2fsu9050734&partnerID=40&md5=8cf0f20d073c6327a1b45d557238a246",Review,"Final",Open Access,Scopus,2-s2.0-85019069241
"Onnée, S., Renault, S.","35746774200;36712304500;","Crowdfunding: Principles, trends and issues",2016,"Research Handbooks on Digital Transformations",,,,"313","334",,1,"10.4337/9781784717766","https://www.scopus.com/inward/record.uri?eid=2-s2.0-85016849960&doi=10.4337%2f9781784717766&partnerID=40&md5=64b655438da35cce9b4e1ea32a6541fd",Book Chapter,"Final",Open Access,Scopus,2-s2.0-85016849960
"Koulayev, S., Rysman, M., Schuh, S., Stavins, J.","55872532800;7801555346;7005338873;6602138635;","Explaining adoption and use of payment instruments by US consumers",2016,"RAND Journal of Economics","47","2",,"293","325",,16,"10.1111/1756-2171.12129","https://www.scopus.com/inward/record.uri?eid=2-s2.0-84963801126&doi=10.1111%2f1756-2171.12129&partnerID=40&md5=c45d7bbfffa5ee85ccd0dc053c6e48b8",Article,"Final",,Scopus,2-s2.0-84963801126
"Imran, M.K., Ilyas, M., Aslam, U., Ubaid-Ur-Rahman","57188973925;56697931800;57076566400;57190280598;","Organizational learning through transformational leadership",2016,"Learning Organization","23","4",,"232","248",,16,"10.1108/TLO-09-2015-0053","https://www.scopus.com/inward/record.uri?eid=2-s2.0-84978829375&doi=10.1108%2fTLO-09-2015-0053&partnerID=40&md5=eff8dbd3d05c5641004cd37ab0e5379d",Article,"Final",,Scopus,2-s2.0-84978829375
"Wu, H.-H., Chen, J.H.","57190380384;35236069000;","Multisided platforms strategy in social entrepreneurship: A case study of Taiwan's Duofu",2016,"Social Entrepreneurship in the Greater China Region: Policy and Cases",,,,"173","187",,,"10.4324/9781315670065","https://www.scopus.com/inward/record.uri?eid=2-s2.0-84979516850&doi=10.4324%2f9781315670065&partnerID=40&md5=9ae222ed7da131aa4f6761f914cbeac0",Book Chapter,"Final",,Scopus,2-s2.0-84979516850
"Davidovici-Nora, M.","55413923200;","Typology and strategies of online distribution platforms of video games: Overview and competitive [Typologie et stratégies des plateformes de distribution en ligne des jeux vidéo: Panorama et enjeux concurrentiels]",2016,"Revue d'Economie Industrielle","156","4",,"91","121",,,,"https://www.scopus.com/inward/record.uri?eid=2-s2.0-85062506155&partnerID=40&md5=67874c239ee48041a1ced4670ce5a69d",Review,"Final",,Scopus,2-s2.0-85062506155
"Novales, A., Mocker, M., Simonovich, D.","57191162558;26424764800;15137232100;","IT-enriched ""digitized"" products: Building blocks and challenges",2016,"AMCIS 2016: Surfing the IT Innovation Wave - 22nd Americas Conference on Information Systems",,,,"","",,7,,"https://www.scopus.com/inward/record.uri?eid=2-s2.0-84987668921&partnerID=40&md5=15d6bdace815d4d7f0efbe052fcc2c8f",Conference Paper,"Final",,Scopus,2-s2.0-84987668921
"Mack, O., Veil, P.","55993472100;57193988985;","Platform business models and internet of things as complementary concepts for digital disruption",2016,"Phantom Ex Machina: Digital Disruption's Role in Business Model Transformation",,,,"71","85",,1,"10.1007/978-3-319-44468-0_5","https://www.scopus.com/inward/record.uri?eid=2-s2.0-85018041112&doi=10.1007%2f978-3-319-44468-0_5&partnerID=40&md5=4236740235ff5a64f842c8c387785f46",Book Chapter,"Final",,Scopus,2-s2.0-85018041112
"Monteiro, J., Mulgund, P., Sharman, R.","56178531000;56177557100;8129878200;","A framework for next generation iCBT applications for SAD patients",2016,"AMCIS 2016: Surfing the IT Innovation Wave - 22nd Americas Conference on Information Systems",,,,"","",,,,"https://www.scopus.com/inward/record.uri?eid=2-s2.0-84987680541&partnerID=40&md5=86a71589478e5c0bc1f17ca531b22fbb",Conference Paper,"Final",,Scopus,2-s2.0-84987680541
"Russo, F., Stasi, M.L.","35099545500;57164557900;","Defining the relevant market in the sharing economy",2016,"Internet Policy Review","5","2",,"","",,4,"10.14763/2016.2.418","https://www.scopus.com/inward/record.uri?eid=2-s2.0-85018793087&doi=10.14763%2f2016.2.418&partnerID=40&md5=d23f8ab278f6159f62af4d4364fee01c",Article,"Final",,Scopus,2-s2.0-85018793087
"Adner, R.","55904381100;","Ecosystem as Structure: An Actionable Construct for Strategy",2016,"Journal of Management","43","1",,"39","58",,121,"10.1177/0149206316678451","https://www.scopus.com/inward/record.uri?eid=2-s2.0-85004107267&doi=10.1177%2f0149206316678451&partnerID=40&md5=1443ada2212d383397ff83607aeeb4b4",Article,"Final",,Scopus,2-s2.0-85004107267
"Hein, A., Schreieck, M., Wiesche, M., Krcmar, H.","57189636786;57189630979;42962873700;6603243872;","Multiple-case analysis on governance mechanism of multi-sided platforms",2016,"Multikonferenz Wirtschaftsinformatik, MKWI 2016","3",,,"1613","1624",,12,,"https://www.scopus.com/inward/record.uri?eid=2-s2.0-84973558792&partnerID=40&md5=3ae81cd99a53709cb4aa5d940446b97b",Conference Paper,"Final",,Scopus,2-s2.0-84973558792
"Reimers, K., Guo, X., Li, M.","6701645096;8262290000;7405263135;","An institutional perspective on two-sided networks",2016,"2016 International Conference on Information Systems, ICIS 2016",,,,"","",,1,,"https://www.scopus.com/inward/record.uri?eid=2-s2.0-85019501549&partnerID=40&md5=7ea1a106353f6e14ea824594cbb087d5",Conference Paper,"Final",,Scopus,2-s2.0-85019501549
"Yablonsky, S.","55865353300;","Crowdfunding innovations",2016,"International Journal of Services, Economics and Management","7","2-4",,"246","264",,3,"10.1504/IJSEM.2016.081870","https://www.scopus.com/inward/record.uri?eid=2-s2.0-85017380513&doi=10.1504%2fIJSEM.2016.081870&partnerID=40&md5=1d849a44133e531c6db3127a39af8a45",Article,"Final",,Scopus,2-s2.0-85017380513
"Tan, F.T.C., Pan, S.L., Liu, J.Y.","52365026300;7402713205;57194239047;","Towards a self-organizing digital business ecosystem: Examining it-enabled boundary spanning practice of China's leeco",2016,"2016 International Conference on Information Systems, ICIS 2016",,,,"","",,2,,"https://www.scopus.com/inward/record.uri?eid=2-s2.0-85019476025&partnerID=40&md5=70e0b43bec294ffdaee479d2d1b1d3cb",Conference Paper,"Final",,Scopus,2-s2.0-85019476025
"Tesch, J.F.","57191993915;","Discovering the role of scenario planning as an evaluation methodology for business models in the era of the Internet of Things (IOT)",2016,"24th European Conference on Information Systems, ECIS 2016",,,,"","",,8,,"https://www.scopus.com/inward/record.uri?eid=2-s2.0-84995769208&partnerID=40&md5=9e65ec95a8c5171eb64eee0e8e83143b",Conference Paper,"Final",,Scopus,2-s2.0-84995769208
"Peitz, M., Valletti, T.","6701667179;7004496911;","Reassessing competition concerns in electronic communications markets",2015,"Telecommunications Policy","39","10",,"896","912",,12,"10.1016/j.telpol.2015.07.012","https://www.scopus.com/inward/record.uri?eid=2-s2.0-84947287273&doi=10.1016%2fj.telpol.2015.07.012&partnerID=40&md5=972cb17140ca24f7dd61eab6cc9c4676",Article,"Final",,Scopus,2-s2.0-84947287273
