Authors,Author(s) ID,Title,Year,Source title,Volume,Issue,Art. No.,Page start,Page end,Page count,Cited by,DOI,Link,Document Type,Publication Stage,Access Type,Source,EID
"Zaheer, H., Breyer, Y., Dumay, J.","57201073988;35172695700;16237803000;","Digital entrepreneurship: An interdisciplinary structured literature review and research agenda",2019,"Technological Forecasting and Social Change","148",, 119735,"","",,,"10.1016/j.techfore.2019.119735","https://www.scopus.com/inward/record.uri?eid=2-s2.0-85071977984&doi=10.1016%2fj.techfore.2019.119735&partnerID=40&md5=1ab13c388cc4203d0846c93a9140fb6f",Article,"Final",,Scopus,2-s2.0-85071977984
"Nambisan, S., Wright, M., Feldman, M.","55946896600;7401558861;7402261132;","The digital transformation of innovation and entrepreneurship: Progress, challenges and key themes",2019,"Research Policy","48","8", 103773,"","",,4,"10.1016/j.respol.2019.03.018","https://www.scopus.com/inward/record.uri?eid=2-s2.0-85063761859&doi=10.1016%2fj.respol.2019.03.018&partnerID=40&md5=94e961cd579f1e8690352d7e7f66646f",Article,"Final",,Scopus,2-s2.0-85063761859
"Nzembayie, K.F., Buckley, A.P., Cooney, T.","57200552117;57188928272;8643477300;","Researching Pure Digital Entrepreneurship – A Multimethod Insider Action Research approach",2019,"Journal of Business Venturing Insights","11",, e00103,"","",,2,"10.1016/j.jbvi.2018.e00103","https://www.scopus.com/inward/record.uri?eid=2-s2.0-85057469760&doi=10.1016%2fj.jbvi.2018.e00103&partnerID=40&md5=ca3416acd4b5333ffd80aa51e3b5a9b5",Article,"Final",,Scopus,2-s2.0-85057469760
"Chalmers, D., Matthews, R., Hyslop, A.","55561264600;57193568213;57210946544;","Blockchain as an external enabler of new venture ideas: Digital entrepreneurs and the disintermediation of the global music industry",2019,"Journal of Business Research",,,,"","",,,"10.1016/j.jbusres.2019.09.002","https://www.scopus.com/inward/record.uri?eid=2-s2.0-85071964647&doi=10.1016%2fj.jbusres.2019.09.002&partnerID=40&md5=2b38afa453c95664d26c8af06245334c",Article,"Article in Press",,Scopus,2-s2.0-85071964647
"Nambisan, S., Baron, R.A.","55946896600;7202712750;","On the costs of digital entrepreneurship: Role conflict, stress, and venture performance in digital platform-based ecosystems",2019,"Journal of Business Research",,,,"","",,1,"10.1016/j.jbusres.2019.06.037","https://www.scopus.com/inward/record.uri?eid=2-s2.0-85068218504&doi=10.1016%2fj.jbusres.2019.06.037&partnerID=40&md5=9785cdae0960a8fd2f78f8675acabcb1",Article,"Article in Press",,Scopus,2-s2.0-85068218504
"Martinez Dy, A.","56610218100;","Levelling the playing field? Towards a critical-social perspective on digital entrepreneurship",2019,"Futures",,, 102438,"","",,,"10.1016/j.futures.2019.102438","https://www.scopus.com/inward/record.uri?eid=2-s2.0-85070541335&doi=10.1016%2fj.futures.2019.102438&partnerID=40&md5=3af447aba6aec5f8f91a7e872d003b2b",Article,"Article in Press",,Scopus,2-s2.0-85070541335
"Sun, W., Zhao, Y., Sun, L.","57205141652;57094276700;57205143985;","Big Data Analytics for Venture Capital Application：Towards Innovation Performance Improvement",2018,"International Journal of Information Management",,,,"","",,3,"10.1016/j.ijinfomgt.2018.11.017","https://www.scopus.com/inward/record.uri?eid=2-s2.0-85058824882&doi=10.1016%2fj.ijinfomgt.2018.11.017&partnerID=40&md5=935c6cfbe2381f091a567d5bca769014",,"Article in Press",,Scopus,2-s2.0-85058824882
