Authors,Author(s) ID,Title,Year,Source title,Volume,Issue,Art. No.,Page start,Page end,Page count,Cited by,DOI,Link,Document Type,Publication Stage,Access Type,Source,EID
"Pütz, F., Murphy, F., Mullins, M., O'Malley, L.","57204764330;56363662600;23670699800;6601993071;","Connected automated vehicles and insurance: Analysing future market-structure from a business ecosystem perspective",2019,"Technology in Society","59",, 101182,"","",,,"10.1016/j.techsoc.2019.101182","https://www.scopus.com/inward/record.uri?eid=2-s2.0-85070678029&doi=10.1016%2fj.techsoc.2019.101182&partnerID=40&md5=c96dd5de71a8764c725064c85fa70de6",Article,"Final",,Scopus,2-s2.0-85070678029
"Inoue, Y., Takenaka, T., Kurumatani, K.","57077468300;8636962500;6701513256;","Sustainability of service intermediary platform ecosystems: Analysis and simulation of Japanese hotel booking platform-based markets",2019,"Sustainability (Switzerland)","11","17", 4563,"","",,,"10.3390/su11174563","https://www.scopus.com/inward/record.uri?eid=2-s2.0-85071964708&doi=10.3390%2fsu11174563&partnerID=40&md5=e736e77e94eddeb924c607b98eb11640",Article,"Final",Open Access,Scopus,2-s2.0-85071964708
"Roesch, M., Bauer, D., Haupt, L., Keller, R., Bauernhansl, T., Fridgen, G., Reinhart, G., Sauer, A.","57195938845;57191091551;57211048665;57195540506;7801647580;54083028500;7101858932;55862727700;","Harnessing the full potential of industrial demand-side flexibility: An end-to-end approach connecting machines with markets through service-oriented IT platforms",2019,"Applied Sciences (Switzerland)","9","18", 3796,"","",,,"10.3390/app9183796","https://www.scopus.com/inward/record.uri?eid=2-s2.0-85072387960&doi=10.3390%2fapp9183796&partnerID=40&md5=cdb6c8e0063b78b3cd29ea87a8a0ba53",Article,"Final",Open Access,Scopus,2-s2.0-85072387960
"Inoue, Y.","57077468300;","Winner-takes-all or co-evolution among platform ecosystems: A look at the competitive and symbiotic actions of complementors",2019,"Sustainability (Switzerland)","11","3", 726,"","",,2,"10.3390/su11030726","https://www.scopus.com/inward/record.uri?eid=2-s2.0-85060917289&doi=10.3390%2fsu11030726&partnerID=40&md5=46f1bfdb635603f3062d67204d138895",Article,"Final",Open Access,Scopus,2-s2.0-85060917289
"Rong, K., Patton, D., Chen, W.","35318749700;7101646723;55716103600;","Business models dynamics and business ecosystems in the emerging 3D printing industry",2018,"Technological Forecasting and Social Change","134",,,"234","245",,1,"10.1016/j.techfore.2018.06.015","https://www.scopus.com/inward/record.uri?eid=2-s2.0-85048471034&doi=10.1016%2fj.techfore.2018.06.015&partnerID=40&md5=55c4e493b9d04a92ae9db83acc82a73f",Article,"Final",,Scopus,2-s2.0-85048471034
"Rong, K., Ren, Q., Shi, X.","35318749700;57202107410;57202847716;","The determinants of network effects: Evidence from online games business ecosystems",2018,"Technological Forecasting and Social Change","134",,,"45","60",,1,"10.1016/j.techfore.2018.05.007","https://www.scopus.com/inward/record.uri?eid=2-s2.0-85047206142&doi=10.1016%2fj.techfore.2018.05.007&partnerID=40&md5=04815c1c1f28945ab3af65243debf5ba",Article,"Final",,Scopus,2-s2.0-85047206142
