Authors,Author(s) ID,Title,Year,Source title,Volume,Issue,Art. No.,Page start,Page end,Page count,Cited by,DOI,Link,Document Type,Publication Stage,Access Type,Source,EID
"Spanjol, J., Xiao, Y., Welzenbach, L.","8301263900;57208728262;57208316027;","Successive innovation in digital and physical products: Synthesis, conceptual framework, and research directions",2018,"Review of Marketing Research","15",,,"31","62",,,"10.1108/S1548-643520180000015004","https://www.scopus.com/inward/record.uri?eid=2-s2.0-85064463329&doi=10.1108%2fS1548-643520180000015004&partnerID=40&md5=aebc7caf2015fdd95696b3aa43f9d367",Book Chapter,"Final",,Scopus,2-s2.0-85064463329
"Ramón-Jerónimo, M.A., Herrero, I.","40462322700;7003953826;","Capturing firms' heterogeneity through marketing and IT capabilities in SMEs",2017,"Sustainability (Switzerland)","9","12", 2180,"","",,2,"10.3390/su9122180","https://www.scopus.com/inward/record.uri?eid=2-s2.0-85034984061&doi=10.3390%2fsu9122180&partnerID=40&md5=54598b0d2c12899a357c797ec1a41894",Article,"Final",Open Access,Scopus,2-s2.0-85034984061
"Pagoropoulos, A., Maier, A., McAloone, T.C.","55637854900;10040829600;6508239327;","Assessing transformational change from institutionalising digital capabilities on implementation and development of Product-Service Systems: Learnings from the maritime industry",2017,"Journal of Cleaner Production","166",,,"369","380",,8,"10.1016/j.jclepro.2017.08.019","https://www.scopus.com/inward/record.uri?eid=2-s2.0-85029182339&doi=10.1016%2fj.jclepro.2017.08.019&partnerID=40&md5=c38eecc60dec55bd0565d24ed8a803d4",Article,"Final",,Scopus,2-s2.0-85029182339
"Batista, L., Davis-Poynter, S., Ng, I., Maull, R.","22333510800;57192709172;9842568500;6603525864;","Servitization through outcome-based contract – A systems perspective from the defence industry",2017,"International Journal of Production Economics","192",,,"133","143",,14,"10.1016/j.ijpe.2016.12.005","https://www.scopus.com/inward/record.uri?eid=2-s2.0-85007605395&doi=10.1016%2fj.ijpe.2016.12.005&partnerID=40&md5=65c82e9b7e99a66bd572d81e31624725",Article,"Final",,Scopus,2-s2.0-85007605395
"Visnjic, I., Jovanovic, M., Neely, A., Engwall, M.","57191681099;57189042769;7005262436;7004227692;","What brings the value to outcome-based contract providers? Value drivers in outcome business models",2017,"International Journal of Production Economics","192",,,"169","181",,21,"10.1016/j.ijpe.2016.12.008","https://www.scopus.com/inward/record.uri?eid=2-s2.0-85008237829&doi=10.1016%2fj.ijpe.2016.12.008&partnerID=40&md5=e2a4477f5252b4455ade2ccbab67ea2c",Article,"Final",,Scopus,2-s2.0-85008237829
"Cenamor, J., Rönnberg Sjödin, D., Parida, V.","55934409000;57192933915;14065252500;","Adopting a platform approach in servitization: Leveraging the value of digitalization",2017,"International Journal of Production Economics","192",,,"54","65",,35,"10.1016/j.ijpe.2016.12.033","https://www.scopus.com/inward/record.uri?eid=2-s2.0-85009170711&doi=10.1016%2fj.ijpe.2016.12.033&partnerID=40&md5=8efc4bd3ed86a7991a0cc8c8563c0379",Article,"Final",,Scopus,2-s2.0-85009170711
"Kamp, B., Parry, G.","56933503300;56204862100;","Servitization and advanced business services as levers for competitiveness",2017,"Industrial Marketing Management","60",,,"11","16",,20,"10.1016/j.indmarman.2016.12.008","https://www.scopus.com/inward/record.uri?eid=2-s2.0-85009784076&doi=10.1016%2fj.indmarman.2016.12.008&partnerID=40&md5=5fbc15839e9e1199d78d860a2b621a3c",Article,"Final",,Scopus,2-s2.0-85009784076
