Authors,Author(s) ID,Title,Year,Source title,Volume,Issue,Art. No.,Page start,Page end,Page count,Cited by,DOI,Link,Document Type,Publication Stage,Access Type,Source,EID
"Ge, C., Huang, K.-W., Kankanhalli, A.","54894916200;28367654100;6508127144;","Platform skills and the value of new hires in the software industry",2020,"Research Policy","49","1", 103864,"","",,,"10.1016/j.respol.2019.103864","https://www.scopus.com/inward/record.uri?eid=2-s2.0-85072762393&doi=10.1016%2fj.respol.2019.103864&partnerID=40&md5=bacfc197fe841c4bd8b54b96b045d7c6",Article,"Final",,Scopus,2-s2.0-85072762393
"Zhang, H., Yuan, Y.","57206783604;57196345805;","Hotspot and trend visualization analysis of enterprise dynamic capability research: A quantitative study of citespace patterns based on 1998–2018 top four international leading strategic management journal",2020,"Advances in Intelligent Systems and Computing","1001",,,"54","69",,,"10.1007/978-3-030-21248-3_5","https://www.scopus.com/inward/record.uri?eid=2-s2.0-85068237453&doi=10.1007%2f978-3-030-21248-3_5&partnerID=40&md5=a0ada8e5f57a3e46f9bcfc81d0843923",Conference Paper,"Final",,Scopus,2-s2.0-85068237453
"Shaikh, M., Levina, N.","56363145000;8779298100;","Selecting an open innovation community as an alliance partner: Looking for healthy communities and ecosystems",2019,"Research Policy","48","8", 103766,"","",,2,"10.1016/j.respol.2019.03.011","https://www.scopus.com/inward/record.uri?eid=2-s2.0-85063741188&doi=10.1016%2fj.respol.2019.03.011&partnerID=40&md5=81a0b3402d2ad8e5592cf026a8ba3a54",Article,"Final",,Scopus,2-s2.0-85063741188
"Kamariotou, M., Kitsios, F.","57190493992;57200228911;","Strategic planning and information systems success: Evaluation in greek SMEs",2019,"Proceedings - 21st IEEE Conference on Business Informatics, CBI 2019","1",, 8808050,"204","211",,,"10.1109/CBI.2019.00030","https://www.scopus.com/inward/record.uri?eid=2-s2.0-85072015782&doi=10.1109%2fCBI.2019.00030&partnerID=40&md5=9a3ac3ecc14e3f508fe09ce01e8857ef",Conference Paper,"Final",,Scopus,2-s2.0-85072015782
"Cenamor, J., Parida, V., Wincent, J.","55934409000;14065252500;8662364900;","How entrepreneurial SMEs compete through digital platforms: The roles of digital platform capability, network capability and ambidexterity",2019,"Journal of Business Research","100",,,"196","206",,,"10.1016/j.jbusres.2019.03.035","https://www.scopus.com/inward/record.uri?eid=2-s2.0-85063688194&doi=10.1016%2fj.jbusres.2019.03.035&partnerID=40&md5=8f34aa8d0eb7d95c1a75bf3265b44138",Article,"Final",Open Access,Scopus,2-s2.0-85063688194
"Warner, K.S.R., Wäger, M.","57209399924;57209397859;","Building dynamic capabilities for digital transformation: An ongoing process of strategic renewal",2019,"Long Range Planning","52","3",,"326","349",,1,"10.1016/j.lrp.2018.12.001","https://www.scopus.com/inward/record.uri?eid=2-s2.0-85067622891&doi=10.1016%2fj.lrp.2018.12.001&partnerID=40&md5=fb728b98ee7e954972941da77dad165b",Article,"Final",,Scopus,2-s2.0-85067622891
"Vial, G.","56950697900;","Understanding digital transformation: A review and a research agenda",2019,"Journal of Strategic Information Systems","28","2",,"118","144",,1,"10.1016/j.jsis.2019.01.003","https://www.scopus.com/inward/record.uri?eid=2-s2.0-85061119991&doi=10.1016%2fj.jsis.2019.01.003&partnerID=40&md5=7963eac62fc61e0861af7849a43bc68e",Review,"Final",,Scopus,2-s2.0-85061119991
"Salim, N., Ab Rahman, M.N., Abd Wahab, D.","57204725622;57208115067;35270424900;","A systematic literature review of internal capabilities for enhancing eco-innovation performance of manufacturing firms",2019,"Journal of Cleaner Production","209",,,"1445","1460",,4,"10.1016/j.jclepro.2018.11.105","https://www.scopus.com/inward/record.uri?eid=2-s2.0-85056884607&doi=10.1016%2fj.jclepro.2018.11.105&partnerID=40&md5=43c840257869719698e3a631ccf221c2",Review,"Final",,Scopus,2-s2.0-85056884607
"Čirjevskis, A.","56904289300;","The role of dynamic capabilities as drivers of business model innovation in mergers and acquisitions of technology-advanced firms",2019,"Journal of Open Innovation: Technology, Market, and Complexity","5","1", 12,"","",,2,"10.3390/joitmc5010012","https://www.scopus.com/inward/record.uri?eid=2-s2.0-85063544343&doi=10.3390%2fjoitmc5010012&partnerID=40&md5=44f4667aa882b68559019eb43634fa60",Article,"Final",Open Access,Scopus,2-s2.0-85063544343
"Kattel, R., Lember, V., Tõnurist, P.","24166963100;6507246912;55359607700;","Collaborative innovation and human-machine networks",2019,"Public Management Review",,,,"","",,,"10.1080/14719037.2019.1645873","https://www.scopus.com/inward/record.uri?eid=2-s2.0-85070805106&doi=10.1080%2f14719037.2019.1645873&partnerID=40&md5=f0c91a80b853246b4dd06e4dadd7ac0b",Article,"Article in Press",,Scopus,2-s2.0-85070805106
"Loux, P., Aubry, M., Tran, S., Baudoin, E.","57191989057;55316838800;13807205700;57191996030;","Multi-sided platforms in B2B contexts: The role of affiliation costs and interdependencies in adoption decisions",2019,"Industrial Marketing Management",,,,"","",,,"10.1016/j.indmarman.2019.07.001","https://www.scopus.com/inward/record.uri?eid=2-s2.0-85069211230&doi=10.1016%2fj.indmarman.2019.07.001&partnerID=40&md5=150259f21f03c7bfed1cd61b5833634e",Article,"Article in Press",,Scopus,2-s2.0-85069211230
"Conboy, K., Mikalef, P., Dennehy, D., Krogstie, J.","18633741000;42761793700;55787347300;6602196721;","Using business analytics to enhance dynamic capabilities in operations research: A case analysis and research agenda",2019,"European Journal of Operational Research",,,,"","",,,"10.1016/j.ejor.2019.06.051","https://www.scopus.com/inward/record.uri?eid=2-s2.0-85068994472&doi=10.1016%2fj.ejor.2019.06.051&partnerID=40&md5=1e2cc8d2bbefe86f6570bbec60d2da94",Article,"Article in Press",,Scopus,2-s2.0-85068994472
"Marku, E., Castriotta, M., Di Guardo, M.C., Loi, M.","57192112872;55806681800;26434694900;57090109700;","Mapping innovation in the digital transformation era: The role of technology convergence",2019,"Advances in E-Business Research Series",,"January",,"160","178",,,"10.4018/978-1-5225-7262-6.ch010","https://www.scopus.com/inward/record.uri?eid=2-s2.0-85065777336&doi=10.4018%2f978-1-5225-7262-6.ch010&partnerID=40&md5=4c75c83398887a7005639b5b97c0a404",Book Chapter,"Final",,Scopus,2-s2.0-85065777336
"Henike, T., Kamprath, M., Hölzle, K.","57211139385;56154698900;8979632900;","Effecting, but effective? How business model visualisations unfold cognitive impacts",2019,"Long Range Planning",,, 101925,"","",,,"10.1016/j.lrp.2019.101925","https://www.scopus.com/inward/record.uri?eid=2-s2.0-85072783310&doi=10.1016%2fj.lrp.2019.101925&partnerID=40&md5=33f0c060e224de6680dd5e705a5b2cd0",Review,"Article in Press",,Scopus,2-s2.0-85072783310
"Li, J., Chen, L., Yi, J., Mao, J., Liao, J.","8955324400;57188718478;25028966000;7402727779;57210564824;","Ecosystem-specific advantages in international digital commerce",2019,"Journal of International Business Studies",,,,"","",,,"10.1057/s41267-019-00263-3","https://www.scopus.com/inward/record.uri?eid=2-s2.0-85070901301&doi=10.1057%2fs41267-019-00263-3&partnerID=40&md5=f16bc3184935866014b5a1dce8673253",Article,"Article in Press",,Scopus,2-s2.0-85070901301
"Zhao, Y., von Delft, S., Morgan-Thomas, A., Buck, T.","57201373437;55014523000;8118148100;57207799641;","The evolution of platform business models: Exploring competitive battles in the world of platforms",2019,"Long Range Planning",,, 101892,"","",,,"10.1016/j.lrp.2019.101892","https://www.scopus.com/inward/record.uri?eid=2-s2.0-85070740250&doi=10.1016%2fj.lrp.2019.101892&partnerID=40&md5=3c529a6101dfc9aa18ae33ec018d198b",Article,"Article in Press",Open Access,Scopus,2-s2.0-85070740250
"Chen, M., Kaul, A., Wu, B.","57210552225;35754477700;55114020000;","Adaptation across multiple landscapes: Relatedness, complexity, and the long run effects of coordination in diversified firms",2019,"Strategic Management Journal",,,,"","",,,"10.1002/smj.3060","https://www.scopus.com/inward/record.uri?eid=2-s2.0-85070857018&doi=10.1002%2fsmj.3060&partnerID=40&md5=dd5289384a8f9b431ddcdf7e6a0c5bd7",Article,"Article in Press",,Scopus,2-s2.0-85070857018
"Nambisan, S., Zahra, S.A., Luo, Y.","55946896600;7003264340;57210600881;","Global platforms and ecosystems: Implications for international business theories",2019,"Journal of International Business Studies",,,,"","",,2,"10.1057/s41267-019-00262-4","https://www.scopus.com/inward/record.uri?eid=2-s2.0-85063762340&doi=10.1057%2fs41267-019-00262-4&partnerID=40&md5=462c16e8c6ae8f6bc70e1637cd21fb65",Article,"Article in Press",,Scopus,2-s2.0-85063762340
"Brenner, B.","57206357713;","Transformative sustainable business models in the light of the digital imperative-a global business economics perspective",2018,"Sustainability (Switzerland)","10","12", 4428,"","",,2,"10.3390/su10124428","https://www.scopus.com/inward/record.uri?eid=2-s2.0-85057307501&doi=10.3390%2fsu10124428&partnerID=40&md5=132946795fff6b0013bfd9e84b611fc2",Review,"Final",Open Access,Scopus,2-s2.0-85057307501
"Lichtenthaler, U.","23393211300;","The world’s most innovative companies: a meta-ranking",2018,"Journal of Strategy and Management","11","4",,"497","511",,,"10.1108/JSMA-07-2018-0065","https://www.scopus.com/inward/record.uri?eid=2-s2.0-85055314153&doi=10.1108%2fJSMA-07-2018-0065&partnerID=40&md5=6cd15a44bccfa0969b2f598e962ee77d",Article,"Final",,Scopus,2-s2.0-85055314153
