Authors,Author(s) ID,Title,Year,Source title,Volume,Issue,Art. No.,Page start,Page end,Page count,Cited by,DOI,EID
"Andreessen M.","","The three kinds of platforms you meet on the internet",2007,"Pmarca Blog",,,,"","",,2,,2-s2.0-84954251821
"Audretsch D.B., Feldman M.P.","7006423146;7402261132;","R&D Spillovers and the Geography of Innovation and Production",1996,"American Economic Review","86","3",,"630","640",,2432,,2-s2.0-0008482329
"Bakos Y., Brynjolfsson E.","6603422899;6603955274;","Bundling information goods: pricing, profits, and efficiency",1999,"Management Science","45","12",,"1613","1630",,510,"10.1287/mnsc.45.12.1613",2-s2.0-0033338075
"Baldwin C.Y., Woodard C.J.","7201893924;35114158500;","The architecture of platforms: A unified view",2009,"Platforms, Markets and Innovation",,,,"19","44",,202,,2-s2.0-71949126345
"Benkler Y.","6602418669;","Coase's penguin, or, linux and the nature of the firm",2002,"Yale Law Journal","112","3",,"369","446",,711,,2-s2.0-0242685828
"Bessen J., Maskin E.","6603471959;6602103851;","Sequential innovation, patents, and imitation",2009,"RAND Journal of Economics","40","4",,"611","635",,191,"10.1111/j.1756-2171.2009.00081.x",2-s2.0-70450177630
"Boudreau K.","36439037700;","Open platform strategies and innovation: Granting access vs. devolving control",2010,"Management Science","56","10",,"1849","1872",,259,"10.1287/mnsc.1100.1215",2-s2.0-77958033399
"Ceccagnoli M., Forman C., Huang P., Wu D.J.","12763523200;6603788047;55189357100;7404297774;","Cocreation of valueina platform ecosystem : the case of enterprise software",2012,"MIS Quarterly: Management Information Systems","36","1",,"263","290",,266,,2-s2.0-84859832893
"Cerf V.","","""Internet speculations: Remarks at the digital broadband migration: The dynamics of disruptive innovation",2012,"Journal on Telecommunications & High Technology Law","10",,,"21","31",,3,,2-s2.0-84894489578
"Chang H.F.","","Patent scope, antitrust policy, and cumulative innovation",1995,"RAND Journal of Economics","26","1",,"34","57",,132,,2-s2.0-21844490020
"Chesbrough H.","",[No title available],2003,"Open Innovation: The New Imperative for Creating and Profiting from Technology",,,,"","",,6304,,2-s2.0-0038210300
"Edwards S.","7401520265;","Openness, productivity and growth: What do we really know?",1998,"Economic Journal","108","447",,"383","398",,770,"10.1111/1468-0297.00293",2-s2.0-0031778347
"Eisenberg M.A.","","Private ordering through negotiation: Dispute-settlement and rulemaking",1976,"Harvard Law Review","89","4",,"637","681",,54,,2-s2.0-84925900735
"Eisenmann T.R., Parker G., Van Alstyne M.","6603030219;8858334600;8960223000;","Opening platforms: How, when and why?",2009,"Platforms, Markets and Innovation",,,,"131","162",,113,,2-s2.0-77958042047
"Eisenmann T., Parker G., Van Alstyne M.","6603030219;8858334600;8960223000;","Platform envelopment",2011,"Strategic Management Journal","32","12",,"1270","1285",,204,"10.1002/smj.935",2-s2.0-80053564187
"Enkel E., Gassmann O., Chesbrough H.","8373660100;6602442967;6603859674;","Open R&D and open innovation: Exploring the phenomenon",2009,"R and D Management","39","4",,"311","316",,788,"10.1111/j.1467-9310.2009.00570.x",2-s2.0-68849091746
"Evans D.S., Hagiu A., Schmalensee R.","",[No title available],2006,"Invisible Engines: How Software Platforms Drive Innovation and Transform Industries",,,,"","",,243,,2-s2.0-34248371447
"Fine C.H.","",[No title available],1998,"Clockspeed: Winning Industry Control in the Age of Temporary Advantage",,,,"","",,884,,2-s2.0-0003612644
"Garvin J.","",[No title available],2016,"Platform Wars: The Battle for Developers",,,,"","",,1,,2-s2.0-85049389769
"Gawer A., Cusumano M.A.","","Platform leadership: How intel, microsoft and cisco drive industry innovation",2002,"Platform Leadership: How Intel, Microsoft, and Cisco Drive Industry Innovation",,,,"","",,633,,2-s2.0-0013207517
"Gawer A., Cusumano M.A.","6506170616;7003834648;","How companies become platform leaders",2008,"MIT Sloan Management Review","49","2",,"28","35",,261,,2-s2.0-59649085930
"Gawer A., Henderson R.","6506170616;7402183437;","Platform owner entry and innovation in complementary markets: Evidence from Intel",2007,"Journal of Economics and Management Strategy","16","1",,"1","34",,197,"10.1111/j.1530-9134.2007.00130.x",2-s2.0-33846291902
"Gilbert R., Shapiro C.","","Optimal patent length and breadth",1990,"RAND Journal of Economics","21","1",,"106","112",,359,,2-s2.0-0001125142
"Gillette F.","","The rise and inglorious fall of myspace",2011,"Bloomberg Businessweek",,,,"54","57",,33,,2-s2.0-84883301067
"Green J.R., Scotchmer S.","","On the division of profit in sequential innovation",1995,"RAND Journal of Economics","26","1",,"20","33",,328,,2-s2.0-0011573603
"Gurley B.","","A rake too far: Optimal platform pricing strategy",2013,"Above the Crowd",,,,"","",,1,,2-s2.0-85049388796
"Hagiu A., Wright J.","23008463100;7601528615;","Multi-sided platforms",2015,"International Journal of Industrial Organization","43",,,"162","174",,133,"10.1016/j.ijindorg.2015.03.003",2-s2.0-84948578575
"Hargadon A.","","How breakthroughs happen",2003,"How Breakthroughs Happen: The Surprising Truth about How Companies Innovate",,,,"","",,447,,2-s2.0-4043129268
"Heller M.A., Eisenberg R.S.","7202415599;7203006568;","Can patents deter innovation? The anticommons in biomedical research",1998,"Science","280","5364",,"698","701",,1425,"10.1126/science.280.5364.698",2-s2.0-0032076909
"Hof R.","","IPO filing: Twitter still losing big money even as 2012 revenues tripled",2013,"Forbes",,,,"","",,1,,2-s2.0-85049385220
"Husney J.","","Crowd tough",2014,"Contagious",,,,"","",,1,,2-s2.0-85049410244
"Jackson T.","",[No title available],1999,"United States of America, Plaintiff, Vs. Microsoft Corporation, Defendant: Findings of Fact",,,,"","",,1,,2-s2.0-85049411512
"Kent S.L.","",[No title available],2001,"The Ultimate History of Video Games",,,,"","",,266,,2-s2.0-0742295144
"Klemperer P.","","How broad should the scope of patent protection be?",1990,"RAND Journal of Economics","21","1",,"113","130",,284,,2-s2.0-0001222606
"Laffan L.","","A new way of measuring openness, from Android to WebKit: The Open Governance Index",2011,"Vision Mobile",,,,"","",,1,,2-s2.0-85049390988
"Landes W.M., Posner R.A.","6602803360;7006845893;","Indefinitely renewable copyright",2003,"University of Chicago Law Review","70","2",,"471","518",,74,,2-s2.0-0037872065
"Laursen K., Salter A.","7004965066;7005775452;","Open for innovation: The role of openness in explaining innovation performance among U.K. manufacturing firms",2006,"Strategic Management Journal","27","2",,"131","150",,2420,"10.1002/smj.507",2-s2.0-31944450165
"Lawler R.","","Uber opens its API with 11 launch partners, including OpenTable, TripAdvisor, and United Airlines",2014,"TechCrunch",,,,"","",,1,,2-s2.0-85049413907
"Manjoo F.","","Pokey: Is its new chat app a sign that Facebook's falling behind?",2012,"Slate",,,,"","",,1,,2-s2.0-85049414986
"McAfee R.P., McMillan J., Whinston M.D.","7006842300;7102040604;6603457527;","Multiproduct monopoly, commodity bundling, and correlation of values",1989,"Quarterly Journal of Economics","104","2",,"371","383",,361,"10.2307/2937852",2-s2.0-84959823718
"Nalebuff B.","35272743600;","Bundling as an entry barrier",2004,"Quarterly Journal of Economics","119","1",,"159","187",,211,"10.1162/003355304772839551",2-s2.0-1642317899
"Noe T., Parker G.","7003876584;8858334600;","Winner take all: Competition, strategy, and the structure of returns in the internet economy",2005,"Journal of Economics and Management Strategy","14","1",,"141","164",,37,"10.1111/j.1430-9134.2005.00037.x",2-s2.0-14544300472
"Parker G., Van Alstyne M.","","Information complements, substitutes, and strategic product design",2000,"Information Complements, Substitutes, and Strategic Product Design",,,,"13","15",,40,,2-s2.0-14544270256
"Parker G.G., van Alstyne M.W.","","""Internetwork externalities and free information goods""",2000,"Proc. ACM Conf. Electronic Commerce",,,,"107","116",,9,,2-s2.0-33750585579
"Parker G.G., Van Alstyne M.W.","8858334600;8960223000;","Two-sided network effects: A theory of information product design",2005,"Management Science","51","10",,"1494","1504",,507,"10.1287/mnsc.1050.0400",2-s2.0-27544481423
"Parker G., Van Alstyne M.","","Six challenges in platform licensing and open innovation",2009,"Communications and Strategies","74","74",,"17","36",,6,,2-s2.0-84866181276
"Partha D., David P.A.","24295725400;7201509523;","Toward a new economics of science",1994,"Research Policy","23","5",,"487","521",,1231,"10.1016/0048-7333(94)01002-1",2-s2.0-43949159014
"Piskorski M.J., Eisenmann T.R., Chen D., Feinstein B.","",[No title available],2010,"Facebook's Platform",,,,"808","128",,3,,2-s2.0-84885606822
"Rochet J.-C., Tirole J.","7003964548;13805189500;","Platform competition in two-sided markets",2003,"Journal of the European Economic Association","1","4",,"990","1029",,1335,"10.1162/154247603322493212",2-s2.0-1942479042
"Rusli E., Macmillan D.","","Uber gets an uber-valuation",2014,"Wall Street Journal",,,,"","",,3,,2-s2.0-84975855436
"Salinger M.A.","","A graphical analysis of bundling",1995,"Journal of Business","68","1",,"85","98",,120,,2-s2.0-21844494272
"Schrage M.","","Archaic patent laws need to be rewritten",1991,"Los Angeles Times",,,,"","",,2,,2-s2.0-85042980229
"Singh J., Fleming L.","57209916861;57203215454;","Lone inventors as sources of breakthroughs: Myth or reality?",2010,"Management Science","56","1",,"41","56",,236,"10.1287/mnsc.1090.1072",2-s2.0-74849099784
"Tadelis S.","57203059758;","Game theory: An introduction",2013,"Game Theory: An Introduction",,,,"","",396,119,,2-s2.0-84884097623
"Tee R., Woodard J.","","Architectural control and value migration in layered ecosystems: The case of open-source cloud management platforms",2013,"Vienna Conference on Strategy, Organizational Design, and Innovation",,,,"","",,1,,2-s2.0-85049401381
"Teece D.J.","","Capturing value from technological innovation: Integration, strategic partnering, and licensing decisions",1988,"Interfaces","18","3",,"46","61",,149,,2-s2.0-0003351079
"Tirole J.","",[No title available],1988,"The Theory of Industrial Organization",,,,"","",,5290,,2-s2.0-0004217626
"Valloppillil V., Cohen J., Raymond E.S.","",[No title available],1998,"Halloween Documents",,,,"","",,2,,2-s2.0-77958038566
"Wacksman B., Stutzman C.","",[No title available],2014,"Connected by Design",,,,"","",,1,,2-s2.0-85049414226
"Weitzman M.L.","7005644463;","Recombinant growth",1998,"Quarterly Journal of Economics","113","2",,"X","360",,373,"10.1162/003355398555595",2-s2.0-0039573715
"West J.","7402743481;","How open is open enough? Melding proprietary and open source platform strategies",2003,"Research Policy","32","7",,"1259","1285",,424,"10.1016/S0048-7333(03)00052-0",2-s2.0-0038785540
"Chesbrough H., Vanhaverbeke W., West J.","",[No title available],2006,"Open Innovation: Researching a New Paradigm",,,,"","",,1602,,2-s2.0-33744769195
"Weyl E.G.","26421550200;","A price theory of multi-sided platforms",2010,"American Economic Review","100","4",,"1642","1672",,199,"10.1257/aer.100.4.1642",2-s2.0-77957015298
"Williamson O.E.","7004261204;","The Lens of Contract: Private Ordering",2002,"American Economic Review","92","2",,"438","443",,85,"10.1257/000282802320191769",2-s2.0-0042262376
"Yoo Y., Henfridsson O., Lyytinen K.","7201926488;7801578626;7004068826;","The new organizing logic of digital innovation: An agenda for information systems research",2010,"Information Systems Research","21","4",,"724","735",,577,"10.1287/isre.1100.0322",2-s2.0-78650630327
