Authors,Author(s) ID,Title,Year,Source title,Volume,Issue,Art. No.,Page start,Page end,Page count,Cited by,DOI,EID
"Ardito L., D'Adda D., Messeni Petruzzelli A.","","Mapping Innovation Dynamics in the Internet of Things Domain: Evidence from Patent Analysis",2017,"Technol. Forecast. Soc. Chang",,,,"","",,6,,2-s2.0-85033460811
"Baines T.S., Lightfoot H.W., Evans S., Neely A., Greenough R., Peppard J., Roy R., Shehab E., Braganza A., Tiwari A., Alcock J.R., Angus J.P., Basti M., Cousens A., Irving P., Johnson M., Kingston J., Lockett H., Martinez V., Michele P., Tranfield D., Walton I.M., Wilson H.","7004171985;23397401400;8697805000;7005262436;7006913424;7003312778;7402945388;6507037138;6701735121;57203775028;7004533872;57197604431;23396054500;57208953793;57197270799;55723923900;57197086947;6508341321;57190660272;56604891300;6603902035;14057191300;14055277500;","State-of-the-art in product-service systems",2007,"Proceedings of the Institution of Mechanical Engineers, Part B: Journal of Engineering Manufacture","221","10",,"1543","1552",,1017,"10.1243/09544054JEM858",2-s2.0-38149134544
"Bialasiewicz J.T.","6701864244;","Interaction of concurrent processes in cyber-physical systems",2017,"IEEE International Conference on Industrial Informatics (INDIN)",,, 7819216,"516","521",,2,"10.1109/INDIN.2016.7819216",2-s2.0-85012931300
"Boer H.","",[No title available],1991,"Organising Innovative Manufacturing Systems",,,,"","",,19,,2-s2.0-0004142395
"Boer H., During W.E.","7006203883;7801678689;","Innovation, what innovation? a comparison between product, process and organizational innovation",2001,"International Journal of Technology Management","22","1-3",,"83","107",,158,,2-s2.0-0035019817
"Broy M.","7004977848;","Automotive software and systems engineering",2005,"Proceedings - Third ACM and IEEE International Conference on Formal Methods and Models for Co-Design, MEMOCODE'05","2005",, 1487905,"143","149",,32,"10.1109/MEMCOD.2005.1487905",2-s2.0-33745169383
"Caniato F., Doran D., Sousa R., Boer H.","6508004519;8842266400;7102960038;7006203883;","Designing and developing OM research – from concept to publication",2018,"International Journal of Operations and Production Management","38","9",,"1836","1856",,5,"10.1108/IJOPM-01-2017-0038",2-s2.0-85043457609
"Christensen C.M.","7201582837;","The ongoing process of building a theory of disruption",2006,"Journal of Product Innovation Management","23","1",,"39","55",,347,"10.1111/j.1540-5885.2005.00180.x",2-s2.0-33645151410
"Cohn M.","",[No title available],2009,"Succeeding with Agile: Software Development Using Scrum",,,,"","",,243,,2-s2.0-77953965656
"Cooper R.G.","55452931100;","Stage-gate systems: A new tool for managing new products",1990,"Business Horizons","33","3",,"44","54",,736,"10.1016/0007-6813(90)90040-I",2-s2.0-0003107957
"Cooper R.G.","55452931100;","Agile-stage-gate hybrids",2016,"Research Technology Management","59","1",,"21","29",,39,"10.1080/08956308.2016.1117317",2-s2.0-84964907983
"Cordeiro L., Barreto R., Barcelos R., Oliveira M., Lucena V., Maciel P.","24328704500;35962062000;56417588900;55666011900;16480651800;26643185100;","Agile development methodology for embedded systems: A platform-based design approach",2007,"Proceedings of the International Symposium and Workshop on Engineering of Computer Based Systems",,, 4148934,"195","202",,9,"10.1109/ECBS.2007.16",2-s2.0-34250161323
"Diegel O., Singamneni S., Withell A.","12807072600;23398739600;26322894400;","A mechatronics approach to rapid product development: A case study",2008,"15th International Conference on Mechatronics and Machine Vision in Practice, M2VIP'08",,, 4749596,"588","592",,3,"10.1109/MMVIP.2008.4749596",2-s2.0-61949481816
"Eklund U., Bosch J.","6603706816;56675290800;","Introducing software ecosystems for mass-produced embedded systems",2012,"Lecture Notes in Business Information Processing","114 LNBIP",,,"248","254",,10,"10.1007/978-3-642-30746-1_20",2-s2.0-84864238880
"Eklund U., Berger C.","6603706816;16067915300;","Scaling agile development in mechatronic organizations - A comparative case study",2017,"Proceedings - 2017 IEEE/ACM 39th International Conference on Software Engineering: Software Engineering in Practice Track, ICSE-SEIP 2017",,, 7965441,"173","182",,4,"10.1109/ICSE-SEIP.2017.25",2-s2.0-85026809253
"Eklund U., Olsson H.H., Strøm N.J.","6603706816;24335916300;56446869600;","Industrial challenges of scaling agile in mass-produced embedded systems",2014,"Lecture Notes in Business Information Processing","199",,,"30","42",,17,,2-s2.0-84917731134
"Evans R.","","Make functionality, not hardware",2009,"Military & Aerospace Electronics","20","9",,"16","17",,2,,2-s2.0-85061876700
"Haghighatkhah A., Banijamali A., Pakanen O.-P., Oivo M., Kuvaja P.","56319178400;57189384189;55841817900;6603040928;56202183100;","Automotive software engineering: A systematic mapping study",2017,"Journal of Systems and Software","128",,,"25","55",,17,"10.1016/j.jss.2017.03.005",2-s2.0-85015261358
"Hendler S., Boer H.","","Digital-physical product developments: a review and research agenda",0000,"International Journal of Technology Management",,,,"","",,1,,2-s2.0-85061876986
"Holmström J.","15769216600;","Recombination in digital innovation: Challenges, opportunities, and the importance of a theoretical framework",2018,"Information and Organization","28","2",,"107","110",,3,"10.1016/j.infoandorg.2018.04.002",2-s2.0-85047019202
"Huang P.M., Darrin A.G., Knuth A.A.","55220905000;6507276623;55220569200;","Agile hardware and software system engineering for innovation",2012,"IEEE Aerospace Conference Proceedings",,, 6187425,"","",,19,"10.1109/AERO.2012.6187425",2-s2.0-84861136221
"Joglekar N.R., Rosenthal S.R.","10046162800;7202208708;","Coordination of Design Supply Chains for Bundling Physical and Software Products",2003,"Journal of Product Innovation Management","20","5",,"374","390",,32,"10.1111/1540-5885.00035",2-s2.0-1542397907
"Karlsson C., Loven E.","","Managing new technology integration: Integrating software in manufactured products",2005,"International Journal of Innovation Management","9","3",,"343","370",,13,,2-s2.0-33749405350
"Karlström D., Runeson P.","8582908200;57202664772;","Integrating agile software development into stage-gate managed product development",2006,"Empirical Software Engineering","11","2",,"203","225",,69,"10.1007/s10664-006-6402-8",2-s2.0-33644928045
"Könnölä K., Suomi S., Mäkilä T., Jokela T., Rantala V., Lehtonen T.","57189320393;57189328833;15124971800;57197188930;26422590900;16646091500;","Agile methods in embedded system development: Multiple-case study of three industrial cases",2016,"Journal of Systems and Software","118",,,"134","150",,10,"10.1016/j.jss.2016.05.001",2-s2.0-84969262130
"Kuwashima K., Fujimoto T.","","Performance measurement in product development research: A literature review",2013,"Annals of Business Administrative Science","12","4",,"213","223",,2,,2-s2.0-85061882640
"Lee J., Berente N.","24484800700;23666390000;","Digital innovation and the division of innovative labor: Digital controls in the automotive industry",2012,"Organization Science","23","5",,"1428","1447",,38,"10.1287/orsc.1110.0707",2-s2.0-84872552260
"Lwakatare L.E., Karvonen T., Sauvola T., Kuvaja P., Olsson H.H., Bosch J., Oivo M.","56728797500;56843496200;56728576000;56202183100;24335916300;56675290800;6603040928;","Towards DevOps in the embedded systems domain: Why is it so hard?",2016,"Proceedings of the Annual Hawaii International Conference on System Sciences","2016-March",, 7427859,"5437","5446",,22,"10.1109/HICSS.2016.671",2-s2.0-84975460866
"Maleki E., Belkadi F., Bernard A.","57194241454;10040586200;56517572500;","Systems Engineering as a Foundation for PSS Development Project: Motivations and Perspectives",2017,"Procedia CIRP","64",,,"205","210",,4,"10.1016/j.procir.2017.03.031",2-s2.0-85021792088
"Nambisan S., Lyytinen K., Majchrzak A., Song M.","","Digital innovation management: Reinventing innovation management research in a digital world",2017,"MIS Quarterly","41","1",,"223","238",,160,,2-s2.0-85016248484
"Porter M.E., Heppelmann J.E.","7201468200;23394953500;","How smart, connected products are transforming companies",2015,"Harvard Business Review","2015","October",,"","",19,259,,2-s2.0-85004073474
"Siggelkow N.","6602903062;","Persuasion with case studies",2007,"Academy of Management Journal","50","1",,"20","24",,1555,"10.5465/AMJ.2007.24160882",2-s2.0-34047201155
"Svahn F., Henfridsson O.","55822201000;7801578626;","The dual regimes of digital innovation management",2012,"Proceedings of the Annual Hawaii International Conference on System Sciences",,, 6149229,"3347","3356",,23,"10.1109/HICSS.2012.560",2-s2.0-84857938075
"Wacker J.G.","7007168696;","A definition of theory: Research guidelines for different theory-building research methods in operations management",1998,"Journal of Operations Management","16","4",,"361","385",,391,,2-s2.0-0032119613
"Wolfenstetter T., Böhm M., Krcmar H., Bründl S.","36836008700;7202480967;6603243872;57189092617;","Why product service systems development is special",2016,"Proceedings of 2015 International Conference on Industrial Engineering and Systems Management, IEEE IESM 2015",,, 7380308,"1221","1228",,4,"10.1109/IESM.2015.7380308",2-s2.0-84965156859
"Woodward M.V., Mosterman P.J.","24778786700;6603740665;","Challenges for embedded software development",2007,"Midwest Symposium on Circuits and Systems",,, 4488660,"630","633",,7,"10.1109/MWSCAS.2007.4488660",2-s2.0-51449124054
"Yin R.K.","",[No title available],1994,"Case Study Research: Design and Methods",,,,"","",,58377,,2-s2.0-0003673547
"Yoo Y., Henfridsson O., Lyytinen K.","7201926488;7801578626;7004068826;","The new organizing logic of digital innovation: An agenda for information systems research",2010,"Information Systems Research","21","4",,"724","735",,577,"10.1287/isre.1100.0322",2-s2.0-78650630327
"Yoo Y., Boland R.J., Lyytinen K., Majchrzak A.","7201926488;7101987066;7004068826;7004097019;","Organizing for innovation in the digitized world",2012,"Organization Science","23","5",,"1398","1408",,448,"10.1287/orsc.1120.0771",2-s2.0-84872555968
