Authors,Author(s) ID,Title,Year,Source title,Volume,Issue,Art. No.,Page start,Page end,Page count,Cited by,DOI,EID
"Adner R.","55904381100;","Ecosystem as Structure: An Actionable Construct for Strategy",2016,"Journal of Management","43","1",,"39","58",,121,"10.1177/0149206316678451",2-s2.0-85004107267
"Adner R., Kapoor R.","55904381100;23027335500;","Value creation in innovation ecosystems: How the structure of technological interdependence affects firm performance in new technology generations",2010,"Strategic Management Journal","31","3",,"306","333",,658,"10.1002/smj.821",2-s2.0-77449110302
"Afuah A., Tucci C.L.","","Internet business models and strategies",2001,"Internet Business Models and Strategies: Text and Cases",,,,"","",,770,,2-s2.0-0003661493
"Amit R., Zott C.","7004998175;6508196211;","Value creation in e-business",2001,"Strategic Management Journal","22","6-7",,"493","520",,2118,"10.1002/smj.187",2-s2.0-0000355662
"Amit R., Zott C.","7004998175;6508196211;","Creating value through business model innovation",2012,"MIT Sloan Management Review","53","3",,"41","49",,354,,2-s2.0-84860491094
"Zott C., Amit R.","","Business Model Innovation: Toward a Process Perspective",2015,"The Oxford Handbook of Creativity, Innovation, and Entrepreneurship",,,,"395","406",,12,,2-s2.0-85018428780
"Andries P., Debackere K., van Looy B.","6508217231;35511547600;55970066300;","Simultaneous experimentation as a learning strategy: Business model development under uncertainty",2013,"Strategic Entrepreneurship Journal","7","4",,"288","310",,65,"10.1002/sej.1170",2-s2.0-84889676215
"Armstrong M., Wright J.","7202399733;7601528615;","Two-sided markets, competitive bottlenecks and exclusive contracts",2007,"Economic Theory","32","2",,"353","380",,156,"10.1007/s00199-006-0114-6",2-s2.0-34249697043
"Baden-Fuller C., Haefliger S.","6602083936;16175030200;","Business Models and Technological Innovation",2013,"Long Range Planning","46","6",,"419","426",,285,"10.1016/j.lrp.2013.08.023",2-s2.0-84887196803
"Baden-Fuller C., Mangematin V.","6602083936;55904008400;","Business models: A challenging agenda",2013,"Strategic Organization","11","4",,"418","427",,153,"10.1177/1476127013510112",2-s2.0-84887478063
"Bettis R.A., Weeks D.","6602732030;7202751808;","Financial returns and strategic interaction: The case of instant photography",1987,"Strategic Management Journal","8","6",,"549","563",,37,"10.1002/smj.4250080605",2-s2.0-84989026860
"Boudreau K.","36439037700;","Open platform strategies and innovation: Granting access vs. devolving control",2010,"Management Science","56","10",,"1849","1872",,259,"10.1287/mnsc.1100.1215",2-s2.0-77958033399
"Boudreau K.J., Jeppesen L.B.","36439037700;8627383700;","Unpaid crowd complementors: The platform network effect mirage",2015,"Strategic Management Journal","36","12",,"1761","1777",,60,"10.1002/smj.2324",2-s2.0-84945450520
"Casadesus-Masanell R., Ricart J.E.","6507426720;7005761244;","From strategy to business models and onto tactics",2010,"Long Range Planning","43","2-3",,"195","215",,671,"10.1016/j.lrp.2010.01.004",2-s2.0-77952561844
"Casadesus-Masanell R., Zhu F.","6507426720;35749187800;","Business model innovation and competitive imitation: The case of sponsor-based business models",2013,"Strategic Management Journal","34","4",,"464","482",,190,"10.1002/smj.2022",2-s2.0-84874476136
"Ceccagnoli M., Forman C., Huang P., Wu D.J.","12763523200;6603788047;55189357100;7404297774;","Cocreation of valueina platform ecosystem : the case of enterprise software",2012,"MIS Quarterly: Management Information Systems","36","1",,"263","290",,266,,2-s2.0-84859832893
"Cennamo C., Santalo J.","25924860300;23996084500;","Platform competition: Strategic trade-offs in platform markets",2013,"Strategic Management Journal","34","11",,"1331","1350",,84,"10.1002/smj.2066",2-s2.0-84884284115
"Cennamo C., Santaló J.","25924860300;23996084500;","How to avoid platform traps",2015,"MIT Sloan Management Review","57","1",,"12","15",,7,,2-s2.0-84944077693
"Chakravarty A., Kumar A., Grewal R.","25228501000;55770317100;7101680834;","Customer orientation structure for Internet-based business-to-business platform firms",2014,"Journal of Marketing","78","5",,"1","23",,28,"10.1509/jm.12.0442",2-s2.0-84921365677
"Chandler G.N., Hanks S.H.","7102583531;36956664400;","Measuring the performance of emerging businesses: A validation study",1993,"Journal of Business Venturing","8","5",,"391","408",,344,"10.1016/0883-9026(93)90021-V",2-s2.0-0001114573
"Chen M.-J., Miller D.","55733236400;7407279089;","Reconceptualizing competitive dynamics: A multidimensional framework",2015,"Strategic Management Journal","36","5",,"758","775",,78,"10.1002/smj.2245",2-s2.0-84926420487
"Chesbrough H.","6603859674;","Business model innovation: It's not just about technology anymore",2007,"Strategy and Leadership","35","6",,"12","17",,476,"10.1108/10878570710833714",2-s2.0-35548989276
"Chesbrough H., Rosenbloom R.S.","6603859674;6602248851;","The role of the business model in capturing value from innovation: Evidence from Xerox Corporation's technology spin-off companies",2002,"Industrial and Corporate Change","11","3",,"529","555",,1591,,2-s2.0-0036299320
"Christensen C.M., Bartman T., Van Bever D.","7201582837;57191202656;23981464400;","The hard truth about business model innovation",2016,"MIT Sloan Management Review","58","1",,"31","40",,41,,2-s2.0-84987876614
"Chu J., Manchanda P.","16232698600;6602349914;","Quantifying cross and direct network effects in online consumer-to-consumer platforms",2016,"Marketing Science","35","6",,"870","893",,18,"10.1287/mksc.2016.0976",2-s2.0-84995684962
"Church J., Gandal N., Krause D.","","Indirect network effects and adoption externalities",2008,"Review of Network Economics","7","3",,"337","358",,21,,2-s2.0-78549288115
"Clements M.T., Ohashl H.","57193852890;36015346600;","Indirect network effects and the product cycle: Video games in the U.S., 1994-2002",2005,"Journal of Industrial Economics","53","4",,"515","542",,160,"10.1111/j.1467-6451.2005.00268.x",2-s2.0-29744470589
"Cusumano M.A., Gawer A., Yoffie D.B.","","The Business of Platforms: Strategy in the Age of Digital Competition, Innovation, and Power",2019,,,,,"","",,1,,2-s2.0-85070756459
"Demir R., Wennberg K., McKelvie A.","16303591500;16647676600;24278668200;","The Strategic Management of High-Growth Firms: A Review and Theoretical Conceptualization",2017,"Long Range Planning","50","4",,"431","456",,27,"10.1016/j.lrp.2016.09.004",2-s2.0-84994430667
"Eckhardt J.T., Ciuchta M.P., Carpenter M.","7003433493;36552100800;7201447610;","Open innovation, information, and entrepreneurship within platform ecosystems",2018,"Strategic Entrepreneurship Journal","12","3",,"369","391",,5,"10.1002/sej.1298",2-s2.0-85052538453
"Eisenhardt K.M.","","Building theories from case study research",1989,"Academy of Management Review","14","4",,"532","550",,18655,,2-s2.0-0001073758
"Eisenhardt K.M., Graebner M.E.","6701924601;8212284600;","Theory building from cases: Opportunities and challenges",2007,"Academy of Management Journal","50","1",,"25","32",,5522,"10.5465/AMJ.2007.24160888",2-s2.0-34047207566
"Eisenmann T., Parker G., Van Alstyne M.W.","6603030219;8858334600;8960223000;","Strategies for two-sided markets",2006,"Harvard Business Review","84","10",,"92","101+149",,528,,2-s2.0-33749685216
"Eisenmann T., Parker G., Van Alstyne M.","6603030219;8858334600;8960223000;","Platform envelopment",2011,"Strategic Management Journal","32","12",,"1270","1285",,204,"10.1002/smj.935",2-s2.0-80053564187
"Evans D.S.","","Some empirical aspects of multi-sided platform industries",2003,"Review of Network Economics","2","3",,"191","209",,176,,2-s2.0-27844482233
"Evans D.S., Schmalensee R.","55478758900;6701638299;","Failure to launch: Critical mass in platform businesses",2010,"Review of Network Economics","9","4", 1,"","",,70,"10.2202/1446-9022.1256",2-s2.0-80051992769
"Frankenberger K., Stam W.","","Entrepreneurial copycats: a resource orchestration perspective on the link between extra-industry business model imitation and new venture growth",2019,"Long. Range Plan.",,,,"","",,1,,2-s2.0-85070746560
"Foss N.J., Saebi T.","7005282199;23486657600;","Fifteen Years of Research on Business Model Innovation: How Far Have We Come, and Where Should We Go?",2016,"Journal of Management","43","1",,"200","227",,169,"10.1177/0149206316675927",2-s2.0-85004045215
"Foss N.J., Saebi T.","7005282199;23486657600;","Business models and business model innovation: Between wicked and paradigmatic problems",2018,"Long Range Planning","51","1",,"9","21",,30,"10.1016/j.lrp.2017.07.006",2-s2.0-85026736206
"Gawer A.","6506170616;","Bridging differing perspectives on technological platforms: Toward an integrative framework",2014,"Research Policy","43","7",,"1239","1249",,270,"10.1016/j.respol.2014.03.006",2-s2.0-84902550958
"Gawer A., Cusumano M.A.","6506170616;7003834648;","How companies become platform leaders",2008,"MIT Sloan Management Review","49","2",,"28","35",,261,,2-s2.0-59649085930
"Gawer A., Cusumano M.A.","6506170616;7003834648;","Industry platforms and ecosystem innovation",2014,"Journal of Product Innovation Management","31","3",,"417","433",,336,"10.1111/jpim.12105",2-s2.0-84898004011
"Hacklin F., Björkdahl J., Wallin M.W.","8845110300;8667183700;12782736400;","Strategies for business model innovation: How firms reel in migrating value",2018,"Long Range Planning","51","1",,"82","110",,18,"10.1016/j.lrp.2017.06.009",2-s2.0-85044280835
"Hagiu A.","","Merchant or two-sided platform?",2007,"Review of Network Economics","6","2",,"115","133",,80,,2-s2.0-67849123216
"Hagiu A.","23008463100;","Two-sided platforms: Product variety and pricing structures",2009,"Journal of Economics and Management Strategy","18","4",,"1011","1043",,103,"10.1111/j.1530-9134.2009.00236.x",2-s2.0-70350278738
"Hagiu A.","23008463100;","Strategic decisions for multisided platforms",2014,"MIT Sloan Management Review","55","2",,"71","80",,94,,2-s2.0-84893116312
"Hagiu A., Wright J.","23008463100;7601528615;","Marketplace or reseller?",2015,"Management Science","61","1",,"184","203",,66,"10.1287/mnsc.2014.2042",2-s2.0-84921061647
"Hagiu A., Yoffie D.B.","23008463100;56312797800;","What's your google strategy?",2009,"Harvard Business Review","87","4",,"","",,23,,2-s2.0-66249111862
"Helfat C.E., Raubitschek R.S.","6701800744;6505884600;","Dynamic and integrative capabilities for profiting from innovation in digital platform-based ecosystems",2018,"Research Policy","47","8",,"1391","1399",,20,"10.1016/j.respol.2018.01.019",2-s2.0-85044998163
"Iansiti M., Lakhani K.R.","","Managing our hub economy",2017,"Harvard Business Review","95","5",,"84","92",,3,,2-s2.0-85063100645
"Johnson M.W., Christensen C.M., Kagermann H.","26643304800;7201582837;24522220900;","Reinventing your business model",2008,"Harvard Business Review","86","12",,"50","59+129",,855,,2-s2.0-57549107662
"Kapoor R., Agarwal S.","23027335500;57194517510;","Sustaining superior performance in business ecosystems: Evidence from application software developers in the iOS and android smartphone ecosystems",2017,"Organization Science","28","3",,"531","551",,23,"10.1287/orsc.2017.1122",2-s2.0-85020549357
"Kapoor R., Lee J.M.","23027335500;55286647100;","Coordinating and competing in ecosystems: How organizational forms shape new technology investments",2013,"Strategic Management Journal","34","3",,"274","296",,99,"10.1002/smj.2010",2-s2.0-84872807999
"Katz M.L., Shapiro C.","55684356800;7102469640;","Network externalities, competition, and compatibility",1985,"American Economic Review","75","3",,"424","440",,2934,,2-s2.0-85020616309
"Katz M.L., Shapiro C.","","Systems competition and network effects",1994,"Journal of Economic Perspectives","8","2",,"93","115",,1102,,2-s2.0-0002981164
"Krishnan V., Gupta S.","7103255666;57196883332;","Appropriateness and impact of platform-based product development",2001,"Management Science","47","1",,"52","68",,257,"10.1287/mnsc.47.1.52.10665",2-s2.0-0035239284
"Lamberg J.-A., Tikkanen H., Nokelainen T., Suur-Inkeroinen H.","6602491912;7004053576;25960952000;8353839500;","Competitive dynamics, strategic consistency, and organizational survival",2009,"Strategic Management Journal","30","1",,"45","60",,55,"10.1002/smj.726",2-s2.0-58449123572
"Levinthal D.A.","7003966546;","Adaptation on rugged landscapes",1997,"Management Science","43","7",,"934","950",,962,"10.1287/mnsc.43.7.934",2-s2.0-0031176451
"Li Z., Agarwal A.","57206872091;57207109539;","Platform integration and demand spillovers in complementary markets: Evidence from facebook’s integration of instagram",2017,"Management Science","63","10",,"3438","3458",,8,"10.1287/mnsc.2016.2502",2-s2.0-85031321552
"Mansfield E., Schwartz M., Wagner S.","","Imitation costs and patents: An empirical study",1981,"Economic Journal","91","364",,"907","918",,476,,2-s2.0-0001037934
"Massa L., Tucci C.L.","","Business model innovation",2014,"The Oxford Handbook of Innovation Management",,,,"420","441",,138,,2-s2.0-84905967331
"Maurer C., Tiwana A.","56538929500;6701805181;","Control in app platforms: The integrationdifferentiation Paradox",2012,"International Conference on Information Systems, ICIS 2012","5",,,"3936","3945",,9,,2-s2.0-84886455380
"McGrath R.G., MacMillan I.C.","","The Entrepreneurial Mindset",2000,"The Entrepreneurial Mindset",,,,"","",,367,,2-s2.0-0009919493
"McIntyre D.P., Srinivasan A.","35220026800;36599441500;","Networks, platforms, and strategy: Emerging views and next steps",2017,"Strategic Management Journal","38","1",,"141","160",,74,"10.1002/smj.2596",2-s2.0-85002952938
"Miles M.B., Huberman A.M., Saldana J.","",[No title available],2014,"Qualitative Data Analysis: A Methods Sourcebook",,,,"","",,4043,,2-s2.0-84890804101
"Noe T., Parker G.","7003876584;8858334600;","Winner take all: Competition, strategy, and the structure of returns in the internet economy",2005,"Journal of Economics and Management Strategy","14","1",,"141","164",,37,"10.1111/j.1430-9134.2005.00037.x",2-s2.0-14544300472
"Parker G.G., Van Alstyne M.W.","8858334600;8960223000;","Two-sided network effects: A theory of information product design",2005,"Management Science","51","10",,"1494","1504",,507,"10.1287/mnsc.1050.0400",2-s2.0-27544481423
"Parker G., Van Alstyne M.","57202439385;8960223000;","Innovation, openness, and platform control",2018,"Management Science","64","7",,"3015","3032",,24,"10.1287/mnsc.2017.2757",2-s2.0-85047951547
"Parker G.G., Alstyne M.W.V., Choudary S.P.","","Platform Revolution: How Networked Markets Are Transforming the Economy - and How to Make Them Work for You",2016,"Platform Revolution: How Networked Markets are Transforming the Economy and How to Make Them Work for You",,,,"","",,281,,2-s2.0-84984662709
"Parker G., Van Alstyne M.W.","","Innovation, openness, and platform control",2017,"Manag. Sci","64",,,"1","18",,8,,2-s2.0-85016285843
"Priem R.L., Wenzel M., Koch J.","6701845960;55370592100;34870129300;","Demand-side strategy and business models: Putting value creation for consumers center stage",2018,"Long Range Planning","51","1",,"22","31",,20,"10.1016/j.lrp.2017.07.007",2-s2.0-85026765861
"Rietveld J., Eggers J.P.","55568001200;35104704000;","Demand heterogeneity in platform markets: Implications for complementors",2018,"Organization Science","29","2",,"304","322",,9,"10.1287/orsc.2017.1183",2-s2.0-85045955741
"Ritter T., Lettl C.","56249695200;55948260300;","The wider implications of business-model research",2018,"Long Range Planning","51","1",,"1","8",,18,"10.1016/j.lrp.2017.07.005",2-s2.0-85027245615
"Rivkin J.W.","6602506505;","Imitation of complex strategies",2000,"Management Science","46","6",,"824","844",,561,"10.1287/mnsc.46.6.824.11940",2-s2.0-0034207532
"Rochet J.-C., Tirole J.","7003964548;13805189500;","Platform competition in two-sided markets",2003,"Journal of the European Economic Association","1","4",,"990","1029",,1335,"10.1162/154247603322493212",2-s2.0-1942479042
"Schoonhoven C.B., Eisenhardt K.M., Lyman K.","","Speeding products to market: Waiting time to first product introduction in new firms",1990,"Administrative Science Quarterly","35","1",,"177","207",,419,,2-s2.0-36949015479
"Seamans R., Zhu F.","55206493900;35749187800;","Responses to entry in multi-sided markets: The impact of craigslist on local newspapers",2014,"Management Science","60","2",,"476","493",,73,"10.1287/mnsc.2013.1785",2-s2.0-84894303268
"Seamans R., Zhu F.","","Repositioning and Cost-Cutting: The Impact of Competition on Platform Strategies",2017,"Strategy Science","2","2",,"83","99",,9,,2-s2.0-85041715774
"Short J.C., McKelvie A., Ketchen D.J., Chandler G.N.","","Firm and industry effects on firm performance: A generalization and extension for new ventures",2009,"Strategic Entrepreneurship Journal","3","1",,"47","65",,70,,2-s2.0-77949545424
"Siggelkow N.","6602903062;","Change in the presence of fit: The rise, the fall, and the renaissance of Liz Claiborne",2001,"Academy of Management Journal","44","4",,"838","857",,299,"10.2307/3069418",2-s2.0-0035536264
