Authors,Author(s) ID,Title,Year,Source title,Volume,Issue,Art. No.,Page start,Page end,Page count,Cited by,DOI,EID
"Banyai M., Glover T.D.","54402260400;36817648800;","Evaluating research methods on travel blogs",2012,"Journal of Travel Research","51","3",,"267","277",,96,"10.1177/0047287511410323",2-s2.0-84859032805
"Barker C.","",[No title available],2000,"Cultural Studies: Theory and Practice",,,,"","",,575,,2-s2.0-63149133723
"Berbary L.A., Richmond L.P.","36715909600;35488924800;","The dangerous deconstruction of gender: Narrative inquiry of masculinities in a popular children's book",2011,"Annals of Leisure Research","14","2-3",,"194","208",,8,"10.1080/11745398.2011.615715",2-s2.0-84864393545
"Berdychevsky L., Nimrod G.","55317907400;14013217400;","""Let's talk about sex"": Discussions in seniors' online communities",2015,"Journal of Leisure Research","47","4",,"467","484",,12,,2-s2.0-84929618754
"Boyd D.M., Ellison N.B.","7202871309;12240085000;","Social network sites: Definition, history, and scholarship",2007,"Journal of Computer-Mediated Communication","13","1",,"210","230",,6575,"10.1111/j.1083-6101.2007.00393.x",2-s2.0-37249053884
"Brock A.","28067524000;","From the Blackhand Side: Twitter as a Cultural Conversation",2012,"Journal of Broadcasting and Electronic Media","56","4",,"529","549",,135,"10.1080/08838151.2012.732147",2-s2.0-84871246951
"Buckels E.E., Trapnell P.D., Paulhus D.L.","55888364900;57204703263;7004092434;","Trolls just want to have fun",2014,"Personality and Individual Differences","67",,,"97","102",,246,"10.1016/j.paid.2014.01.016",2-s2.0-84901285979
"Chandralal L., Rindfleish J., Valenzuela F.","56215675100;56215336700;7005452962;","An Application of Travel Blog Narratives to Explore Memorable Tourism Experiences",2015,"Asia Pacific Journal of Tourism Research","20","6",,"680","693",,23,"10.1080/10941665.2014.925944",2-s2.0-84930570887
"Chen G.M.","36611283200;","Tweet this: A uses and gratifications perspective on how active Twitter use gratifies a need to connect with others",2011,"Computers in Human Behavior","27","2",,"755","762",,296,"10.1016/j.chb.2010.10.023",2-s2.0-79551504670
"Citron D.K.","",[No title available],2014,"Hate Crimes in Cyberspace",,,,"","",,135,,2-s2.0-84922177982
"Cole K.K.","56519244900;","""It's like she's eager to be verbally abused"": Twitter, trolls, and (en)gendering disciplinary rhetoric",2015,"Feminist Media Studies","15","2",,"356","358",,33,"10.1080/14680777.2015.1008750",2-s2.0-84924657365
"Coles B.A., West M.","57146934900;57146296600;","Trolling the trolls: Online forum users constructions of the nature and properties of trolling",2016,"Computers in Human Behavior","60",,,"233","244",,29,"10.1016/j.chb.2016.02.070",2-s2.0-84959354081
"Consalvo M.","","Cyberfeminism",2002,"Encyclopedia of New Media",,,,"109","110",,2,,2-s2.0-85049214750
"Cross M.","",[No title available],2011,"Bloggerati, Twitterati: How Blogs and Twitter are Transforming Popular Culture",,,,"","",,11,,2-s2.0-84880491505
"Daniels J.","","Rethinking cyberfeminism(s): Race, gender, and embodiment",2009,"Women's Studies Quarterly","37","1-2",,"101","124",,67,,2-s2.0-85052558367
"Delamere F.M., Shaw S.M.","57194910090;8661134700;","“They see it as a guy's game”: The politics of gender in digital games",2008,"Leisure/ Loisir","32","2",,"279","302",,17,"10.1080/14927713.2008.9651411",2-s2.0-85002367048
"Drüeke R., Zobl E.","57194704337;36714653100;","Online feminist protest against sexism: The German-language hashtag #aufschrei",2016,"Feminist Media Studies","16","1",,"35","54",,16,"10.1080/14680777.2015.1093071",2-s2.0-84954403639
"Evans K.","14010323400;","A guide to feminist advocacy",2005,"Gender and Development","13","3",,"10","20",,5,"10.1080/13552070512331332293",2-s2.0-33744989902
"Fichman P., Sanfilippo M.","",[No title available],2016,"Online trolling and its perpetrators: Under the cyberbridge",,,,"","",,19,,2-s2.0-85018760462
"Filep S., Cao D., Jiang M., DeLacy T.","16309648400;55883343500;43861281700;23073072700;","Savouring tourist experiences after a holiday",2013,"Leisure/ Loisir","37","3",,"191","203",,8,"10.1080/14927713.2013.842731",2-s2.0-84890439311
"Finfgeld-Connett D.","9244570700;","Twitter and Health Science Research",2015,"Western Journal of Nursing Research","37","10",,"1269","1283",,16,"10.1177/0193945914565056",2-s2.0-84941308477
"Frost A.","","Twitter feminism and the next wave: An interview with Mikki Kendall",2014,"Democratic Left","41","4",,"12","13",,,,2-s2.0-85067268078
"Gajjala R.","6507707858;","South Asia digital diasporas and cyberfeminist webs: Negotiating globalization, nation, gender and information technology design",2003,"Contemporary South Asia","12","1",,"41","56",,21,"10.1080/0958493032000123362",2-s2.0-0345393243
"Genoe M.R., Liechty T., Marston H.R., Sutherland V.","15768686600;14919446800;55204375400;57209127138;","Blogging into retirement: Using qualitative online research methods to understand leisure among baby boomers",2016,"Journal of Leisure Research","48","1",,"15","34",,9,"10.18666/JLR-2016-V48-I1-6257",2-s2.0-84957310663
"Hardaker C., McGlashan M.","36170702400;55253536700;","""Real men don't hate women"": Twitter rape threats and group identity",2016,"Journal of Pragmatics","91",,,"80","93",,34,"10.1016/j.pragma.2015.11.005",2-s2.0-84951074997
"Honeycutt C., Herring S.C.","8243864000;7005704556;","Beyond microblogging: Conversation and collaboration via twitter",2009,"Proceedings of the 42nd Annual Hawaii International Conference on System Sciences, HICSS",,, 4755499,"","",,529,"10.1109/HICSS.2009.89",2-s2.0-63349101768
"Huang J., Thornton K.M., Efthimiadis E.N.","55742390500;36186035100;7004155315;","Conversational tagging in Twitter",2010,"HT'10 - Proceedings of the 21st ACM Conference on Hypertext and Hypermedia",,,,"173","177",,157,"10.1145/1810617.1810647",2-s2.0-77954932466
"Jane E.A.","55531710200;","""Your a ugly, whorish, slut"": Understanding E-bile",2014,"Feminist Media Studies","14","4",,"531","546",,108,"10.1080/14680777.2012.741073",2-s2.0-84905367686
"Jane E.A.","55531710200;","Back to the kitchen, cunt: Speaking the unspeakable about online misogyny",2014,"Continuum","28","4",,"558","570",,74,"10.1080/10304312.2014.924479",2-s2.0-84903518885
"Jansen B.J., Zhang M., Sobel K., Chowdury A.","7202560690;55493308800;36842346900;56387465400;","Micro-blogging as online word of mouth branding",2009,"Conference on Human Factors in Computing Systems - Proceedings",,,,"3859","3864",,89,"10.1145/1520340.1520584",2-s2.0-70349188096
"Krippendorff K.","",[No title available],1980,"Content Analysis: An Introduction to Its Methodology",,,,"","",,12389,,2-s2.0-0004040339
"Laclau E., Mouffe C.","",[No title available],1985,"Hegemony and Socialist Strategy",,,,"","",,6814,,2-s2.0-0003697964
"Lasorsa D.L., Lewis S.C., Holton A.E.","6507668104;35215265400;37059078600;","NORMALIZING TWITTER: Journalism practice in an emerging communication space",2012,"Journalism Studies","13","1",,"19","36",,382,"10.1080/1461670X.2011.571825",2-s2.0-84855938746
"Leavy P.L.","","The feminist practice of content analysis",2007,"Feminist Research Practice: A Primer",,,,"223","248",,28,,2-s2.0-51249084273
"Lehto X.Y., Park O., Fu X., Lee G.","6507157583;25422533800;55354147900;12779453500;","Student life stress and leisure participation",2014,"Annals of Leisure Research","17","2",,"200","217",,4,"10.1080/11745398.2014.902293",2-s2.0-84906559589
"Luckman S.","","(En)gendering the digital body: Feminism and the Internet",1999,"Hecate","25","2",,"36","47",,11,,2-s2.0-3042751161
"Kingston Mann L.","56216205100;","What Can Feminism Learn from New Media?",2014,"Communication and Critical/ Cultural Studies","11","3",,"293","297",,10,"10.1080/14791420.2014.926244",2-s2.0-84905509635
"Mattar Y.","8053287000;","Virtual communities and hip-hop music consumers in Singapore: Interplaying global, local and subcultural identities",2003,"Leisure Studies","22","4",,"283","300",,21,"10.1080/02614360310001594168",2-s2.0-0348224652
"McKeown J.K.L., Parry D.C.","","Women's leisure as political practice: A feminist analysis of Orange Is the New Black",2016,"Leisure Sciences","21",,,"1","14",,,,2-s2.0-85067268054
"McCosker A.","9732908200;","Trolling as provocation: YouTube's agonistic publics",2014,"Convergence","20","2",,"201","217",,39,"10.1177/1354856513501413",2-s2.0-84899507354
"Menzies R.","","Virtual backlash: Representations of men's ""rights"" and feminist ""wrongs"" in cyberspace",2007,"Reaction and Resistance: Feminism, Law, and Social Change",,,,"65","97",,27,,2-s2.0-42049115000
[No author name available],[No author id available],[No title available],2017,"Merriam-Webster's 2017 Words of the Year: Feminism, dotard, gaffe, syzygy, and 6 more of the top lookups in 2017",,,,"","",,2,,2-s2.0-85055378145
"Mislove A., Lehmann S., Ahn Y.Y., Onnela J.P., Rosenquist J.N.","","Understanding the demographics of twitter users",2011,"Proceedings of the Fifth International AAAI Conference on Weblogs and Social Media",,,,"554","557",,271,,2-s2.0-84876344878
"Morris M.R., Teevan J., Panovich K.","8619759600;57207527470;36142148800;","What do people ask their social networks, and why? A survey study of status message Q&A behavior",2010,"Conference on Human Factors in Computing Systems - Proceedings","3",,,"1739","1748",,348,"10.1145/1753326.1753587",2-s2.0-77953998900
"Muldoon M., Mair H.","56419559300;12239015900;","Blogging slum tourism: A critical discourse analysis of travel blogs",2016,"Tourism Analysis","21","5",,"465","479",,5,"10.3727/108354216X14653218477525",2-s2.0-84992458929
"Munster A.","36573979300;","Is there Postlife after Postfeminism? Tropes of Technics and Life in Cyberfeminism",1999,"Australian Feminist Studies","14","29",,"119","129",,9,"10.1080/08164649993371",2-s2.0-0346543589
"Muzzaffar S.","",[No title available],2016,"What good is declaring broadband a “basic service” without regulating retail prices? CBC News, December 28",,,,"","",,,,2-s2.0-85067266566
"Nadkarni A., Hofmann S.G.","54403693900;7201530329;","Why do people use facebook?",2012,"Personality and Individual Differences","52","3",,"243","249",,467,"10.1016/j.paid.2011.11.007",2-s2.0-83555172423
"Neuendorf K.A.","",[No title available],2002,"The Content Analysis Guidebook",,,,"","",,3881,,2-s2.0-0004230731
"Nimrod G.","14013217400;","The benefits of and constraints to participation in seniors' online communities",2014,"Leisure Studies","33","3",,"247","266",,33,"10.1080/02614367.2012.697697",2-s2.0-84898549486
"Ovadia S.","24344914100;","Internet connection exploring the potential of twitter as a research tool",2009,"Behavioral and Social Sciences Librarian","28","4",,"202","205",,25,"10.1080/01639260903280888",2-s2.0-77952831453
"Parry D.C., Glover T.D., Mulcahy C.M.","7201452483;36817648800;35810989100;","From ""stroller-stalker"" to ""momancer"" courting friends through a social networking site for mothers",2013,"Journal of Leisure Research","45","1",,"23","46",,24,"10.18666/jlr-2013-v45-i1-2941",2-s2.0-84874772883
"Parry D.C., Penny Light T.","7201452483;56100638300;","Fifty shades of complexity: Exploring technologically mediated leisure and women's sexuality",2014,"Journal of Leisure Research","46","1",,"38","57",,12,,2-s2.0-84897614004
"Penny L.","","Every single female writer I know has had threats of violence and rape, along with barrages of harassment",2014,"Every. Single. One. yes all women [Tweet",,,,"","",,,,2-s2.0-85067267764
"Plant S.","",[No title available],1997,"Zeros and Ones",,,,"","",,40,,2-s2.0-0005059571
"Reed J.","",[No title available],2014,"How social media is changing language",,,,"","",,4,,2-s2.0-85024489768
"Reinharz S.","",[No title available],1992,"Feminist Methods in Social Research",,,,"","",,1908,,2-s2.0-0003581851
"Sassen S.","","Mediating practices: Women with/in cyberspace",2002,"Living with cyberspace: Technology and society in the 21st century",,,,"","",,,,2-s2.0-85067266550
"Shachaf P., Hara N.","10043876400;7201635492;","Beyond vandalism: Wikipedia trolls",2010,"Journal of Information Science","36","3",,"357","370",,101,"10.1177/0165551510365390",2-s2.0-77953009688
"Schmalz D.L., Colistra C.M., Evans K.E.","13604945100;56039684400;56519069300;","Social Media Sites as a Means of Coping with a Threatened Social Identity",2015,"Leisure Sciences","37","1",,"20","38",,12,"10.1080/01490400.2014.935835",2-s2.0-84919839116
"Sharaievska I., Stodolska M.","42962220300;6602637553;","Redefining Boundaries in Families through Social Networking Leisure",2015,"Leisure Sciences","37","5",,"431","446",,3,"10.1080/01490400.2015.1021882",2-s2.0-84944356971
"Sharpe E.K., Lashua B.D.","7003945165;12802581300;","Introduction to the special issue: Tuning in to popular leisure",2008,"Leisure/ Loisir","32","2",,"245","258",,5,"10.1080/14927713.2008.9651409",2-s2.0-84953316819
"Schwandt T.A.","",[No title available],2001,"Dictionary of Qualitative Inquiry",,,,"","",,960,,2-s2.0-0004268791
"Small T.A.","21733385600;","What the hashtag?: A content analysis of Canadian politics on Twitter",2011,"Information Communication and Society","14","6",,"872","895",,191,"10.1080/1369118X.2011.554572",2-s2.0-79961034078
"Spencer C., Paisley K.","55990755200;15128098700;","Two women, a bottle of wine, and the bachelor: Duoethnography as a means to explore experiences of femininity in a leisure setting",2013,"Journal of Leisure Research","45","5",,"695","716",,12,"10.18666/jlr-2013-v45-i5-4370",2-s2.0-84891776810
"Stanton C.","",[No title available],2011,"“Here's a project: Troll! Data! Analysis!” SuperOpinionated, February 8",,,,"","",,,,2-s2.0-85067267833
"Throsby K., Hodges S.","","Introduction: Situating technology",2009,"Women's Studies Quarterly","37","1-2",,"11","18",,6,,2-s2.0-84863823147
"Twitter","","Twitter usage/company facts",2016,"Twitter Usage/Company Facts",,,,"","",,30,,2-s2.0-84976428350
"Valtchanov B.L., Parry D.C., Glover T.D., Mulcahy C.M.","56298432200;7201452483;36817648800;35810989100;","Neighborhood at your fingertips: Transforming community online through a Canadian social networking site for mothers",2014,"Gender, Technology and Development","18","2",,"187","217",,17,"10.1177/0971852414529481",2-s2.0-84904974029
"Vinagre M.","11239716800;","Politeness strategies in collaborative e-mail exchanges",2008,"Computers and Education","50","3",,"1022","1036",,37,"10.1016/j.compedu.2006.10.002",2-s2.0-38649131030
"Warschauer M.","6603955476;","Demystifying the digital divide",2003,"Scientific American","289","2",,"42","47",,129,"10.1038/scientificamerican0803-42",2-s2.0-0041840380
"Wearing S.L., Wearing J., McDonald M., Wearing M.","7003938062;56810958200;55511015300;6602545271;","Leisure in a world of ‘com-pu-pu-pu-pu-pu-pu-pu-pu-pu-pu-puter-puter, puter games’: a father and son conversation",2015,"Annals of Leisure Research","18","2",,"219","234",,5,"10.1080/11745398.2014.996764",2-s2.0-84940497522
"Zappavigna M.","35757167600;","Searchable talk: the linguistic functions of hashtags",2015,"Social Semiotics","25","3",,"274","291",,61,"10.1080/10350330.2014.996948",2-s2.0-84928685625
"Zappavigna M.","",[No title available],2012,"Discourse of Twitter and Social Media: How We Use Language to Create Affiliation on the Web",,,,"","",,180,,2-s2.0-84861874318
"Zhao D., Rosson M.B.","23399137700;7003266859;","How and why people Twitter: The role that micro-blogging plays in informal communication at work",2009,"GROUP'09 - Proceedings of the 2009 ACM SIGCHI International Conference on Supporting Group Work",,,,"243","252",,539,"10.1145/1531674.1531710",2-s2.0-70450162300
