Authors,Author(s) ID,Title,Year,Source title,Volume,Issue,Art. No.,Page start,Page end,Page count,Cited by,DOI,EID
"Adner R.","7801600783;","Match your innovation strategy to your innovation ecosystem",2006,"Harvard Business Review","84","4",,"98","107+148",,439,,2-s2.0-33645683761
"Adner R.","55904381100;","Ecosystem as Structure: An Actionable Construct for Strategy",2016,"Journal of Management","43","1",,"39","58",,121,"10.1177/0149206316678451",2-s2.0-85004107267
"Adner R., Kapoor R.","55904381100;23027335500;","Value creation in innovation ecosystems: How the structure of technological interdependence affects firm performance in new technology generations",2010,"Strategic Management Journal","31","3",,"306","333",,658,"10.1002/smj.821",2-s2.0-77449110302
"Albino V., Berardi U., Dangelico R.M.","6603831321;35106606400;21833539400;","Smart cities: Definitions, dimensions, performance, and initiatives",2015,"Journal of Urban Technology","22","1",,"3","21",,515,"10.1080/10630732.2014.942092",2-s2.0-84928098865
"Almirall E., Wareham J.","35219712500;6701663400;","Living Labs: Arbiters of midand ground-level innovation",2011,"Technology Analysis and Strategic Management","23","1",,"87","102",,61,"10.1080/09537325.2011.537110",2-s2.0-78751614496
"Amit R., Zott C.","7004998175;6508196211;","Value creation in e-business",2001,"Strategic Management Journal","22","6-7",,"493","520",,2118,"10.1002/smj.187",2-s2.0-0000355662
"Amit R., Zott C.","7004998175;6508196211;","Crafting Business Architecture: the Antecedents of Business Model Design",2015,"Strategic Entrepreneurship Journal","9","4",,"331","350",,64,"10.1002/sej.1200",2-s2.0-84978159548
"Andries P., Debackere K.","6508217231;35511547600;","Business model innovation: Propositions on the appropriateness of different learning approaches",2013,"Creativity and Innovation Management","22","4",,"337","358",,15,"10.1111/caim.12033",2-s2.0-84900305113
"Aspara J., Lamberg J.-A., Laukia A., Tikkanen H.","35101416600;6602491912;37117076900;7004053576;","Corporate business model transformation and inter-organizational cognition: The case of nokia",2013,"Long Range Planning","46","6",,"459","474",,67,"10.1016/j.lrp.2011.06.001",2-s2.0-84887192514
"Baden-Fuller C., Haefliger S.","6602083936;16175030200;","Business Models and Technological Innovation",2013,"Long Range Planning","46","6",,"419","426",,285,"10.1016/j.lrp.2013.08.023",2-s2.0-84887196803
"Bartunek J.M., Louis M.R.","",[No title available],1996,"Insider/outsider Team Research",,,,"","",,240,,2-s2.0-0003768936
"Berends H., Smits A., Reymen I., Podoynitsyna K.","6507414239;54685157900;12760407300;23029008900;","Learning while (re)configuring: Business model innovation processes in established firms",2016,"Strategic Organization","14","3",,"181","219",,31,"10.1177/1476127016632758",2-s2.0-84979996193
"Binns A., Harreld J.B., O'reilly III C., Tushman M.L.","39760919800;34980017200;7005911757;6602681606;","The art of strategic renewal",2014,"MIT Sloan Management Review","55","2",,"21","23",,11,,2-s2.0-84893137609
"Burnett M.","","Using competitive dialogue in EU public procurement - Early trends and future developments",2009,"Eipascope",,"2",,"17","23",,11,,2-s2.0-84962868574
"Chandy R.K., Tellis G.J.","6701374916;6701809198;","The incumbent's curse? Incumbency, size, and radical product innovation",2000,"Journal of Marketing","64","3",,"1","17",,616,"10.1509/jmkg.64.3.1.18033",2-s2.0-0034388983
"Chesbrough H.W.","6603859674;","The era of open innovation",2003,"MIT Sloan Management Review","44","3",,"35","41",,1413,,2-s2.0-3843067488
"Chesbrough H.","",[No title available],2003,"Open Innovation: The New Imperative for Creating and Profiting from Technology",,,,"","",,6304,,2-s2.0-0038210300
"Chesbrough H.","6603859674;","Business model innovation: It's not just about technology anymore",2007,"Strategy and Leadership","35","6",,"12","17",,476,"10.1108/10878570710833714",2-s2.0-35548989276
"Chesbrough H.","6603859674;","Business model innovation: Opportunities and barriers",2010,"Long Range Planning","43","2-3",,"354","363",,1046,"10.1016/j.lrp.2009.07.010",2-s2.0-77952557399
"Chesbrough H., Rosenbloom R.S.","6603859674;6602248851;","The role of the business model in capturing value from innovation: Evidence from Xerox Corporation's technology spin-off companies",2002,"Industrial and Corporate Change","11","3",,"529","555",,1591,,2-s2.0-0036299320
"Cohen B., Almirall E., Chesbrough H.","7402977055;35219712500;6603859674;","The city as a lab: Open innovation meets the collaborative economy",2016,"California Management Review","59","1",,"5","13",,30,"10.1177/0008125616683951",2-s2.0-85018723494
"Demil B., Lecocq X.","28367573500;56520124100;","Business model evolution: In search of dynamic consistency",2010,"Long Range Planning","43","2-3",,"227","246",,512,"10.1016/j.lrp.2010.02.004",2-s2.0-77952561414
"Den Ouden P.H., Valkenburg R.","","Vision and Roadmap Urban Lighting Eindhoven 2030",2012,"Vision and Roadmap Urban Lighting Eindhoven 2030",,,,"1","32",,2,,2-s2.0-85058864735
"Den Ouden E., Valkenburg R., Schreurs M.A., Aarts E.","","Open innovation 2.0: Smart cities",2015,"Open Innovation 2.0 Yearbook 2015",,,,"84","95",,1,,2-s2.0-85062752383
"Desyllas P., Sako M.","23491894300;7102311394;","Profiting from business model innovation: Evidence from Pay-As-You-Drive auto insurance",2013,"Research Policy","42","1",,"101","116",,123,"10.1016/j.respol.2012.05.008",2-s2.0-84870315913
"Doganova L., Eyquem-Renault M.","34971031000;34971092800;","What do business models do?. Innovation devices in technology entrepreneurship",2009,"Research Policy","38","10",,"1559","1570",,292,"10.1016/j.respol.2009.08.002",2-s2.0-70449099321
"Doz Y.L., Kosonen M.","55951118300;24438282800;","Embedding strategic agility: A leadership agenda for accelerating business model renewal",2010,"Long Range Planning","43","2-3",,"370","382",,311,"10.1016/j.lrp.2009.07.006",2-s2.0-77952585003
"ENoLL","","Introducing ENoLL and Its Living Lab Community",2016,,,,,"","",,1,,2-s2.0-85062740816
"EPEC","","Procurement of PPP and the Use of Competitive Dialogue in Europe - A Review of Public Sector Practices Across the EU",2010,"Procurement of PPP and the Use of Competitive Dialogue in Europe: A Review of Public Sector Practices Across the EU",,,,"","",,3,,2-s2.0-85020957334
[No author name available],[No author id available],[No title available],2013,"Lighting the Cities-Accelerating the Deployment of Innovative Lighting in European Cities",,,,"","",,12,,2-s2.0-84924248692
"European Commission","","Open Innovation 2.0",2015,,,,,"","",,1,,2-s2.0-85062747160
"Frost, Sullivan","",[No title available],2014,"Frost & Sullivan: Global Smart Cities Market to Reach US1.56 Trillion by 2020",,,,"","",,5,,2-s2.0-85010215699
"Gilbert C.G.","9747741200;","Unbundling the structure of inertia: Resource versus routine rigidity",2005,"Academy of Management Journal","48","5",,"741","763",,487,"10.5465/AMJ.2005.18803920",2-s2.0-27944482717
"Graça P., Camarinha-Matos L.M.","56585829100;7004870718;","Performance indicators for collaborative business ecosystems — Literature review and trends",2017,"Technological Forecasting and Social Change","116",,,"237","255",,22,"10.1016/j.techfore.2016.10.012",2-s2.0-85028245748
"Gulati R., Puranam P., Tushman M.","7101846769;6507062428;6602681606;","Meta-organization design: Rethinking design in interorganizational and community contexts",2012,"Strategic Management Journal","33","6",,"571","586",,210,"10.1002/smj.1975",2-s2.0-84859719173
"Henderson R.M., Clark K.B.","","Architectural innovation: The reconfiguration of existing product technologies and the failure of established firms",1990,"Administrative Science Quarterly","35","1",,"9","30",,3996,,2-s2.0-0001511053
"Iansiti M., Levien R.","6602150082;6602696833;","Strategy as Ecology",2004,"Harvard Business Review","82","3",,"68","78+126",,640,,2-s2.0-1642386139
"Johnson M.W., Christensen C.M., Kagermann H.","26643304800;7201582837;24522220900;","Reinventing your business model",2008,"Harvard Business Review","86","12",,"50","59+129",,855,,2-s2.0-57549107662
"Kindström D.","24334956300;","Towards a service-based business model - Key aspects for future competitive advantage",2010,"European Management Journal","28","6",,"479","490",,181,"10.1016/j.emj.2010.07.002",2-s2.0-78049429232
"King A., Lakhani K.R.","36077637200;7003785038;","Using open innovation to identify the best ideas",2013,"MIT Sloan Management Review","55","1",,"41","48",,59,,2-s2.0-84890373838
"LUCI Association","","LUCI Charter on Urban Lighting - Promoting a Culture of Sustainability in Lighting",2015,,,,,"","",,1,,2-s2.0-85062742357
"Markides C.C., Oyon D.","6602855130;6508087089;","What to do against disruptive business models (when and how to play two games at once)",2010,"MIT Sloan Management Review","51","4",,"25","32",,50,,2-s2.0-77955975373
"Moore J.F.","",[No title available],1996,"The Death of Competition: Leadership and Strategy in the Age of Business Ecosystems",,,,"","",,755,,2-s2.0-0003756490
"Muñoz P., Cohen B.","56494242900;7402977055;","The making of the urban entrepreneur",2016,"California Management Review","59","1",,"71","91",,11,"10.1177/0008125616683953",2-s2.0-85028318325
"OECD","","OECD Regions at a Glance 2009",2009,"OECD Regions at a Glance 2013",,,,"","",,92,,2-s2.0-79957449419
"Øiestad S., Bugge M.M.","56045078700;23476771400;","Digitisation of publishing: Exploration based on existing business models",2014,"Technological Forecasting and Social Change","83","1",,"54","65",,25,"10.1016/j.techfore.2013.01.010",2-s2.0-84894431969
"Osiyevskyy O., Dewald J.","56091284000;15847960100;","Explorative versus exploitative business model change: The cognitive antecedents of firm-level responses to disruptive innovation",2015,"Strategic Entrepreneurship Journal","9","1",,"58","78",,55,"10.1002/sej.1192",2-s2.0-84924115440
"Parker G.G., Alstyne M.W.V., Choudary S.P.","","Platform Revolution: How Networked Markets Are Transforming the Economy - and How to Make Them Work for You",2016,"Platform Revolution: How Networked Markets are Transforming the Economy and How to Make Them Work for You",,,,"","",,281,,2-s2.0-84984662709
"Paroutis S., Bennett M., Heracleous L.","15835451700;57198410996;6603258106;","A strategic view on smart city technology: The case of IBM Smarter Cities during a recession",2014,"Technological Forecasting and Social Change","89",,,"262","272",,95,"10.1016/j.techfore.2013.08.041",2-s2.0-85027936305
"Porter M.E., Heppelmann J.E.","7201468200;23394953500;","How smart, connected products are transforming competition",2014,"Harvard Business Review",,"November 2014",,"","",23,567,,2-s2.0-84908338932
"Sabatier V., Mangematin V., Rousselle T.","24768379100;55904008400;6508045243;","From recipe to dinner: Business model portfolios in the european biopharmaceutical industry",2010,"Long Range Planning","43","2-3",,"431","447",,105,"10.1016/j.lrp.2010.02.001",2-s2.0-77952573164
"Santos F., Eisenhardt K.","36947013200;6701924601;","Constructing markets and shaping boundaries: Entrepreneurial power in nascent fields",2009,"Academy of Management Journal","52","4",,"643","671",,409,"10.5465/AMJ.2009.43669892",2-s2.0-67650435831
"Snow C.C., Håkonsson D.D., Obel B.","7103381160;12786268800;6603039939;","A smart city is a collaborative community: Lessons from smart Aarhus",2016,"California Management Review","59","1",,"92","108",,29,"10.1177/0008125616683954",2-s2.0-85025155369
"Sorescu A., Frambach R.T., Singh J., Rangaswamy A., Bridges C.","6603353036;6603488781;55216765800;6701897280;35799597500;","Innovations in retail business models",2011,"Journal of Retailing","87","SUPPL. 1",,"S3","S16",,178,"10.1016/j.jretai.2011.04.005",2-s2.0-79960121938
"Sosna M., Trevinyo-Rodríguez R.N., Velamuri S.R.","55808687400;35173746800;26424876400;","Business model innovation through trial-and-error learning: The naturhouse case",2010,"Long Range Planning","43","2-3",,"383","407",,344,"10.1016/j.lrp.2010.02.003",2-s2.0-77952557100
"Spieth P., Schneckenberg D., Ricart J.E.","54421191700;25961148100;7005761244;","Business model innovation - state of the art and future challenges for the field",2014,"R and D Management","44","3",,"237","247",,141,"10.1111/radm.12071",2-s2.0-84900818730
"Teece D.J.","6701775408;","Business models, business strategy and innovation",2010,"Long Range Planning","43","2-3",,"172","194",,2065,"10.1016/j.lrp.2009.07.003",2-s2.0-77952581340
"The Economist","","Empowering cities: The real story of how cities and businesses are driving smart cities",2016,,,,,"","",,2,,2-s2.0-85058387700
"Tripsas M., Gavetti G.","23988066100;10045597100;","Capabilities, cognition, and inertia: Evidence from digital imaging",2000,"Strategic Management Journal","21","10-11",,"1147","1161",,1053,,2-s2.0-0000556357
"Tsoukas H., Chia R.","6604042401;7004115711;","On organizational becoming: Rethinking organizational change",2002,"Organization Science","13","5",,"567","582",,1153,"10.1287/orsc.13.5.567.7810",2-s2.0-0036746466
[No author name available],[No author id available],[No title available],1998,"World Urbanization Prospects: The 1996 Revision",,,,"","",,3164,,2-s2.0-0003395661
"Van De Ven A.H., Poole M.S.","7006753715;7102423839;","Alternative approaches for studying organizational change",2005,"Organization Studies","26","9",,"1377","1404",,414,"10.1177/0170840605056907",2-s2.0-26844549594
"Weill P., Woerner S.L.","55956441800;23669462300;","Thriving in an Increasingly Digital Ecosystem",2015,"MIT Sloan Management Review","56","4",,"27","34",,87,,2-s2.0-84941599231
"Yin R.K.","",[No title available],1994,"Case Study Research: Design and Methods",,,,"","",,58400,,2-s2.0-0003673547
"Zott C., Amit R.","6508196211;7004998175;","Business model design and the performance of entrepreneurial firms",2007,"Organization Science","18","2",,"181","199",,504,"10.1287/orsc.1060.0232",2-s2.0-34247496884
"Zott C., Amit R.","6508196211;7004998175;","Business model design: An activity system perspective",2010,"Long Range Planning","43","2-3",,"216","226",,845,"10.1016/j.lrp.2009.07.004",2-s2.0-77952558158
"Zott C., Amit R., Massa L.","6508196211;7004998175;57127818200;","The business model: Recent developments and future research",2011,"Journal of Management","37","4",,"1019","1042",,1310,"10.1177/0149206311406265",2-s2.0-79958142685
