Authors,Author(s) ID,Title,Year,Source title,Volume,Issue,Art. No.,Page start,Page end,Page count,Cited by,DOI,EID
"Barney J.B.","","Strategic factor markets: Expectations, luck, and business strategy",1986,"Management Science","32","10",,"1231","1241",,2531,,2-s2.0-0000648913
"Barney J.","7004413102;","Firm Resources and Sustained Competitive Advantage",1991,"Journal of Management","17","1",,"99","120",,21150,"10.1177/014920639101700108",2-s2.0-84896930624
"Bromiley P.","","Testing a causal model of corporate risk taking and performance",1991,"Academy of Management Journal","34","1",,"37","59",,632,,2-s2.0-0001925832
"Castanias R.P.","6507836211;","Managerial Resources and Rents",1991,"Journal of Management","17","1",,"155","171",,526,"10.1177/014920639101700110",2-s2.0-84970264701
"Castanias R.P., Helfat C.E.","6507836211;6701800744;","The managerial rents model: Theory and empirical analysis",2001,"Journal of Management","27","6",,"661","678",,329,"10.1016/S0149-2063(01)00117-9",2-s2.0-0001395339
"Chen W.-R., Miller K.D.","56092821700;7404256375;","Situational and institutional determinants of firms' R&D search intensity",2007,"Strategic Management Journal","28","4",,"368","381",,206,"10.1002/smj.594",2-s2.0-33947420135
"Cheng J.L.C., Kesner I.F.","22955415800;6602423483;","Organizational slack and response to environmental shifts: The impact of resource allocation patterns",1997,"Journal of Management","23","1",,"1","18",,221,"10.1177/014920639702300101",2-s2.0-0031521237
"Comin D., Mulani S.","57202912413;14024795100;","A theory of growth and volatility at the aggregate and firm level",2009,"Journal of Monetary Economics","56","8",,"1023","1042",,16,"10.1016/j.jmoneco.2009.10.004",2-s2.0-73649115598
"Comin D., Mulani S.","57202912413;14024795100;","Diverging trends in aggregate and firm volatility",2006,"Review of Economics and Statistics","88","2",,"374","383",,66,"10.1162/rest.88.2.374",2-s2.0-33745476615
"Daniel F., Lohrke F.T., Fornaciari C.J., Turner Jr. R.A.","57196917747;6507249938;55901632600;55472725000;","Slack resources and firm performance: A meta-analysis",2004,"Journal of Business Research","57","6",,"565","574",,164,"10.1016/S0148-2963(02)00439-3",2-s2.0-1842449704
"Drnevich P.L., Kriauciunas A.P.","13002632500;14024539200;","Clarifying the conditions and limits of the contributions of ordinary and dynamic capabilities to relative firm performance",2011,"Strategic Management Journal","32","3",,"354","379",,198,"10.1002/smj.882",2-s2.0-78651103870
"Finkelstein S., Hambrick D.C.","","Strategic leadership: Top executives and their effects on organizations",1996,"Strategic Leadership: Top Executives and Their Effects on Organizations",,,,"","",,1493,,2-s2.0-0003789130
"Gentry R.J., Shen W.","23097495400;16043917900;","The impacts of performance relative to analyst forecasts and analyst coverage on firm R&D intensity",2013,"Strategic Management Journal","34","1",,"121","130",,52,"10.1002/smj.1997",2-s2.0-84870538221
"Greene W.H.","",[No title available],1993,"Econometric Analysis",,,,"","",,26612,,2-s2.0-0004296209
"Greve H.R.","7006597475;","Research notes and commentaries: Positional rigidity: Low performance and resource acquisition in large and small firms",2011,"Strategic Management Journal","32","1",,"103","114",,67,"10.1002/smj.875",2-s2.0-78649248304
"Kor Y.Y.","8875458000;","Direct and interaction effects of top management team and board compositions on R&D investment strategy",2006,"Strategic Management Journal","27","11",,"1081","1099",,224,"10.1002/smj.554",2-s2.0-33750091934
"Kor Y.Y., Mahoney J.T.","8875458000;7202430103;","Penrose's resource-based approach: The process and product of research creativity",2000,"Journal of Management Studies","37","1",,"109","139",,149,,2-s2.0-0033634614
"Kor Y.Y., Mahoney J.T.","8875458000;7202430103;","Edith Penrose's (1959) Contributions to the Resource-based View of Strategic Management",2004,"Journal of Management Studies","41","1",,"183","191",,144,"10.1111/j.1467-6486.2004.00427.x",2-s2.0-0442322939
"Kor Y.Y., Mahoney J.T.","8875458000;7202430103;","How dynamics, management, and governance of resource deployments influence firm-level performance",2005,"Strategic Management Journal","26","5",,"489","496",,206,"10.1002/smj.459",2-s2.0-17444427702
"Mahoney J.T.","7202430103;","The management of resources and the resource of management",1995,"Journal of Business Research","33","2",,"91","101",,395,"10.1016/0148-2963(94)00060-R",2-s2.0-0006490018
"Makadok R.","6602170183;","Toward a synthesis of the resource-based and dynamic-capability views of rent creation",2001,"Strategic Management Journal","22","5",,"387","401",,1066,"10.1002/smj.158",2-s2.0-0000359490
"Michel J.G., Hambrick D.C.","","Diversification posture and top management team characteristics",1992,"Academy of Management Journal","35","1",,"9","37",,491,,2-s2.0-0001917402
"Mishina Y., Pollock T.G., Porac J.F.","7007002202;7102609061;6601959036;","Are more resources always better for growth? Resource stickiness in market and product expansion",2004,"Strategic Management Journal","25","12",,"1179","1197",,283,"10.1002/smj.424",2-s2.0-8344248710
"Mahoney J.T., Pandian J.R.","7202430103;8233499000;","The resource‐based view within the conversation of strategic management",1992,"Strategic Management Journal","13","5",,"363","380",,1442,"10.1002/smj.4250130505",2-s2.0-84989029859
"Nohria N., Gulati R.","6602539562;7101846769;","Is slack good or bad for innovation?",1996,"Academy of Management Journal","39","5",,"1245","1264",,945,"10.2307/256998",2-s2.0-0030305353
"Penrose E.","",[No title available],1959,"The Theory of the Growth of the Firm",,,,"","",,10106,,2-s2.0-0004092009
"Rubin P.H.","","The expansion of firms",1973,"Journal of Political Economy","81","4",,"936","949",,139,,2-s2.0-0001248327
"Shen T.Y.","","Economies of scale, Penrose-effect, growth of plants and their size distribution",1970,"Journal of Political Economy","78","4",,"702","716",,27,,2-s2.0-0000925414
"Tan D., Mahoney J.T.","8285295800;7202430103;","Examining the Penrose effect in an international business context: The dynamics of Japanese firm growth in US industries",2005,"Managerial and Decision Economics","26","2",,"113","127",,60,"10.1002/mde.1212",2-s2.0-15544371960
"Teece D.J.","6701775408;","Explicating dynamic capabilities: The nature and microfoundations of (sustainable) enterprise performance",2007,"Strategic Management Journal","28","13",,"1319","1350",,3452,"10.1002/smj.640",2-s2.0-36248939699
"Teece D.J., Pisano G., Shuen A.","6701775408;7006165945;36966457000;","Dynamic capabilities and strategic management",1997,"Strategic Management Journal","18","7",,"509","533",,12276,"10.1002/(SICI)1097-0266(199708)18:7<509::AID-SMJ882>3.0.CO;2-Z",2-s2.0-0342775775
"Thompson J.D.","",[No title available],1967,"Organizations in Action: Social Science Bases of Administrative Theory",,,,"","",,9224,,2-s2.0-0003806911
"Tushman M.L., Nadler D.A.","","Information processing as an integrating concept in organizational design",1978,"Academy of Management Review","3","3",,"613","624",,1218,,2-s2.0-0000471240
"Wang H., Choi J., Wan G., Dong J.Q.","57196430443;55567908000;56725108200;57059656500;","Slack Resources and the Rent-Generating Potential of Firm-Specific Knowledge",2016,"Journal of Management","42","2",,"500","523",,26,"10.1177/0149206313484519",2-s2.0-84954443749
"Wernerfelt B.","6603555282;","A resource‐based view of the firm",1984,"Strategic Management Journal","5","2",,"171","180",,10012,"10.1002/smj.4250050207",2-s2.0-84989133012
