Authors,Author(s) ID,Title,Year,Source title,Volume,Issue,Art. No.,Page start,Page end,Page count,Cited by,DOI,EID
"Agarwal A., Thakur M.K.","57198123885;36069948900;","Sign language recognition using Microsoft Kinect",2013,"2013 6th International Conference on Contemporary Computing, IC3 2013",,, 6612186,"181","185",,36,"10.1109/IC3.2013.6612186",2-s2.0-84886557937
[No author name available],[No author id available],[No title available],2017,,,,,"","",,1,,2-s2.0-85060230499
"Al-Jarrah O., Halawani A.","6603630587;6602265138;","Recognition of gestures in Arabic sign language using neuro-fuzzy systems",2001,"Artificial Intelligence","133","1-2",,"117","138",,122,"10.1016/S0004-3702(01)00141-2",2-s2.0-0035575486
"Allen J.M., Asselin P.K., Foulds R.","55477896000;56741767200;7006705226;","American sign language finger spelling recognition system",2003,"Bioengineering, Proceedings of the Northeast Conference",,,,"285","286",,3,,2-s2.0-0043160535
"Araujo A.F., Brasil F.L., Candido L.S., Junior A.D.S.B.L., Dutra P.F.S., Batista E.C.F.C.","","Auris system: Providing vibrotactile feedback for hearing impaired population",2017,"Biomed Research International",,,,"1","9",,1,,2-s2.0-85060187161
"Bahan B.","","The visual people",2004,"Paper presented at the conference deaf studies today",,,,"","",,2,,2-s2.0-84984827306
"Bragg D., Huynh N., Ladner R.E.","43660991100;57192544579;7005099015;","A personalizable mobile sound detector app design for deaf and hard-of-hearing users",2016,"ASSETS 2016 - Proceedings of the 18th International ACM SIGACCESS Conference on Computers and Accessibility",,,,"3","13",,8,"10.1145/2982142.2982171",2-s2.0-85006784988
"Brashear H., Starner T., Lukowicz P., Junker H.","8224037400;7003469397;6701557151;7003972057;","Using multiple sensors for mobile Sign Language recognition",2003,"Proceedings - International Symposium on Wearable Computers, ISWC",,, 1241392,"45","52",,83,,2-s2.0-78649471244
[No author name available],[No author id available],[No title available],2018,,,,,"","",,1,,2-s2.0-85060246860
"Carlson D., Ehrlich N.","","Assistive technology and information technology use and need by persons with disabilities in the United States",2005,"US Dept Educ Natl Inst Disabil and Rehabil Res",,,,"","",,2,,2-s2.0-85060228765
"Sachs-Ericsson N., Verona E., Joiner T., Preacher K.J.","6602778694;10039348900;35547584300;6602519801;","Parental verbal abuse and the mediating role of self-criticism in adult internalizing disorders",2006,"Journal of Affective Disorders","93","1-3",,"71","78",,128,"10.1016/j.jad.2006.02.014",2-s2.0-33744538767
"Cavender A.C., Bigham J.P., Ladner R.E.","16238140100;16238221500;7005099015;","ClassInFocus: Enabling improved visual attention strategies for deaf and hard of hearing students",2009,"ASSETS'09 - Proceedings of the 11th International ACM SIGACCESS Conference on Computers and Accessibility",,,,"67","74",,36,"10.1145/1639642.1639656",2-s2.0-72249089986
"Cox S., Lincoln M., Tryggvason J., Nakisa M., Wells M., Tutt M., Abbott S.","7401456306;7004485595;6507478493;6507880390;57198115465;7003938325;57197208912;","TESSA, a system to aid communication with deaf people",2002,"Annual ACM Conference on Assistive Technologies, Proceedings",,,,"205","212",,84,,2-s2.0-0036368378
"Daoud M.I., Al-Ashi M., Abawi F., Khalifeh A.","57193881849;56925453000;56925336200;23004872200;","In-house alert sounds detection and direction of arrival estimation to assist people with hearing difficulties",2015,"2015 IEEE/ACIS 14th International Conference on Computer and Information Science, ICIS 2015 - Proceedings",,, 7166609,"297","302",,4,"10.1109/ICIS.2015.7166609",2-s2.0-84945303973
"Debevc M., Stjepanovič Z., Holzinger A.","56816724400;7003286032;23396282000;","Development and evaluation of an e-learning course for deaf and hard of hearing based on the advanced Adapted Pedagogical Index method",2014,"Interactive Learning Environments","22","1",,"35","50",,9,"10.1080/10494820.2011.641673",2-s2.0-84892995784
"Ditcharoen N., Naruedomkul K., Cercone N.","35746143600;6508198981;7003403956;","SignMT: An alternative language learning tool",2010,"Computers and Education","55","1",,"118","130",,26,"10.1016/j.compedu.2009.12.009",2-s2.0-77949654354
"Dolnick E.","","Hearing loss as Culture",1993,"The Atlantic Monthly",,,,"37","53",,1,,2-s2.0-85060215347
"Domingo M.C.","7005595700;","An overview of the Internet of Things for people with disabilities",2012,"Journal of Network and Computer Applications","35","2",,"584","596",,285,"10.1016/j.jnca.2011.10.015",2-s2.0-84856228761
"Drigas A.S., Vrettaros J., Kouremenos D.","","Teleeducation and e-learning services for teaching English as a second language to Deaf people, whose first language is the Sign Language",2004,"WSEAS Transactions on Information Science and Applications","1","3",,"834","842",,7,,2-s2.0-29944443805
"Drigas A.S., Kouremenos D., Kouremenos S., Vrettaros J.","8662839500;35562882800;56361566100;8662839400;","An e-learning system for the deaf people",2005,"ITHET 2005: 6th International Conference on Information Technology Based Higher Education and Training, 2005","2005",, 1560236,"T2C","17-T2C-21",,14,"10.1109/ITHET.2005.1560236",2-s2.0-33749054286
"El-Gayyar M.M., Ibrahim A.S., Wahed M.E.","25724306600;57190845405;57189342606;","Translation from Arabic speech to Arabic Sign Language based on cloud computing",2016,"Egyptian Informatics Journal","17","3",,"295","303",,4,"10.1016/j.eij.2016.04.001",2-s2.0-84969581361
"Elliott E.A., Jacobs A.M.","55121074700;7402530721;","Facial expressions, emotions, and sign languages",2013,"Frontiers in Psychology","4","MAR", 115,"","",,10,"10.3389/fpsyg.2013.00115",2-s2.0-84878778719
"Elliott R., Glauert J.R.W., Kennaway J.R., Marshall I., Safar E.","57195915142;6603327992;6602617526;36947681400;23490086000;","Linguistic modelling and language-processing technologies for Avatar-based sign language presentation",2008,"Universal Access in the Information Society","6","4",,"375","391",,64,"10.1007/s10209-007-0102-z",2-s2.0-38949121023
"Escudeiro P., Escudeiro N., Reis R., Lopes J., Norberto M., Baltasar A.B., Barbosa M., Bidarra J.","35242500400;35193768000;36603149000;56926058900;56926601100;56926473700;7102247139;6505859253;","Virtual Sign - A Real Time Bidirectional Translator of Portuguese Sign Language",2015,"Procedia Computer Science","67",,,"252","262",,7,"10.1016/j.procs.2015.09.269",2-s2.0-84962793739
"Fajardo I., Vigo M., Salmerón L.","16642578700;14523664500;8323336300;","Technology for supporting web information search and learning in Sign Language",2009,"Interacting with Computers","21","4",,"243","256",,11,"10.1016/j.intcom.2009.05.005",2-s2.0-67651101159
"Fellinger J., Holzinger D., Gerich J., Goldberg D.","","Quality of life measures in the deaf",2010,"Handbook of Disease Burdens and Quality of Life Measures",,,,"3853","3870",,2,,2-s2.0-85049144575
"Fujii M., Mandana A.K., Takakai T., Watanabe Y., Kamata K., Ito A., Murakami H., Yabe T., Haraguchi Y., Tomoyasu Y., Kakuda Y.","55738484600;51964234000;51965029800;35602116200;7201749124;36914421800;57207336635;7101727551;24474803300;24475905700;7005630359;","A study on deaf people supporting systems using cellular phone with Bluetooth in disasters",2007,"2007 IEEE International Symposium on a World of Wireless, Mobile and Multimedia Networks, WOWMOM",,, 4351699,"","",,4,"10.1109/WOWMOM.2007.4351699",2-s2.0-47749114925
"Gorman B.M.","56421738300;","VisAural: A wearable sound-localisation device for people with impaired hearing",2014,"ASSETS14 - Proceedings of the 16th International ACM SIGACCESS Conference on Computers and Accessibility",,,,"337","338",,9,"10.1145/2661334.2661410",2-s2.0-84911364649
"Hannukainen P., Hölttä-Otto K.","23094474100;15072447500;","Identifying customer needs - Disabled persons as lead users",2006,"Proceedings of the ASME Design Engineering Technical Conference","2006",,,"","",9,48,,2-s2.0-33751310135
"Harrington T.","",[No title available],2018,"Sign language of the world by name",,,,"","",,1,,2-s2.0-85060250871
"Honda T., Okamoto M.","56267274500;36018819100;","User interface design of sound tactile",2014,"Lecture Notes in Computer Science (including subseries Lecture Notes in Artificial Intelligence and Lecture Notes in Bioinformatics)","8548 LNCS","PART 2",,"382","385",,6,"10.1007/978-3-319-08599-9_57",2-s2.0-84904191657
[No author name available],[No author id available],[No title available],2017,,,,,"","",,1,,2-s2.0-85060205347
"Kennaway J.R., Glauert J.R.W., Zwitserlood I.","6602617526;6603327992;22235927100;","Providing signed content on the Internet by synthesized animation",2007,"ACM Transactions on Computer-Human Interaction","14","3", 15,"","",,54,"10.1145/1279700.1279705",2-s2.0-34948869369
"Kessler G.D., Hodges L.F., Walker N.","7102813499;7102305035;7201515530;","Evaluation of the CyberGlove as a Whole-Hand Input Device",1995,"ACM Transactions on Computer-Human Interaction (TOCHI)","2","4",,"263","283",,107,"10.1145/212430.212431",2-s2.0-84976722021
"Ketabdar H., Polzehl T.","16068489700;34969523200;","Tactile and visual alerts for deaf people by mobile phones",2009,"ASSETS'09 - Proceedings of the 11th International ACM SIGACCESS Conference on Computers and Accessibility",,,,"253","254",,8,"10.1145/1639642.1639701",2-s2.0-72249095406
"Kheir R., Way T.","19639031200;8439302400;","Inclusion of deaf students in computer science classes using real-time speech transcription",2007,"ITiCSE 2007: 12th Annual Conference on Innovation and Technology in Computer Science Education - Inclusive Education in Computer Science",,,,"261","265",,28,"10.1145/1268784.1268860",2-s2.0-34548086431
"Kim J.S., Kim C.H.","55899634400;57202876522;","A review of assistive listening device and digital wireless technology for hearing instruments",2014,"Korean Journal of Audiology","18","3",,"105","111",,12,"10.7874/kja.2014.18.3.105",2-s2.0-84920261666
"Kim K.-W., Choi J.-W., Kim Y.-H.","37086180600;55764950100;36064483100;","Detection and direction estimation of a sudden loud sound for the hearing assistive eyeglasses",2014,"INTERNOISE 2014 - 43rd International Congress on Noise Control Engineering: Improving the World Through Noise Control",,,,"","",,1,,2-s2.0-84923537844
"Kouremenos D., Fotinea S.-E., Efthimiou E., Ntalianis K.","35562882800;6507953358;22333400500;6603074197;","A prototype Greek text to Greek Sign Language conversion system",2010,"Behaviour and Information Technology","29","5",,"467","481",,6,"10.1080/01449290903420192",2-s2.0-77955569595
"Kumari P., Goel P., Reddy S.R.N.","57191617530;57191625718;36061479000;","PiCam: IoT Based Wireless Alert System for Deaf and Hard of Hearing",2016,"Proceedings - 2015 21st Annual International Conference on Advanced Computing and Communications, ADCOM 2015",,, 7529820,"39","44",,7,"10.1109/ADCOM.2015.14",2-s2.0-84992109826
"Kyle F.E., Cain K.","6603065051;35509842000;","A Comparison of Deaf and Hearing Children's Reading Comprehension Profiles",2015,"Topics in Language Disorders","35","2",,"144","156",,19,"10.1097/TLD.0000000000000053",2-s2.0-84958640518
"The Lancet","","Hearing loss: an important global health concern",2016,"The Lancet","387","10036",,"2351","",,17,"10.1016/S0140-6736(16)30777-2",2-s2.0-84992530251
"Lane H.","7102110160;","Ethnicity, ethics, and the deaf-world",2005,"Journal of Deaf Studies and Deaf Education","10","3",,"291","310",,109,"10.1093/deafed/eni030",2-s2.0-24344437914
"Lang S., Block M., Rojas R.","55218806200;24767457600;7102916764;","Sign language recognition using kinect",2012,"Lecture Notes in Computer Science (including subseries Lecture Notes in Artificial Intelligence and Lecture Notes in Bioinformatics)","7267 LNAI","PART 1",,"394","402",,49,"10.1007/978-3-642-29347-4_46",2-s2.0-84861029915
"Lee S., Kang S., Han D.K., Ko H.","55655248400;7405685477;7403219841;35069749800;","Dialogue enabling speech-to-text user assistive agent system for hearing-impaired person",2016,"Medical and Biological Engineering and Computing","54","6",,"915","926",,2,"10.1007/s11517-015-1447-8",2-s2.0-84954193404
"Li K.F., Lothrop K., Gill E., Lau S.","7404990396;57210760471;54083261500;54179426900;","A web-based sign language translator using 3D video processing",2011,"Proceedings - 2011 International Conference on Network-Based Information Systems, NBiS 2011",,, 6041939,"356","361",,30,"10.1109/NBiS.2011.60",2-s2.0-80455134730
"Li J., Yin B., Wang L., Kong D.","57192673877;8616230700;55721492600;16480742200;","Chinese Sign Language animation generation considering context",2014,"Multimedia Tools and Applications","71","2",,"469","483",,3,"10.1007/s11042-013-1541-6",2-s2.0-84903820345
"Liddell S.K.","","Review: American Sign Language Syntax",1983,"Language","59","1",,"221","224",,2,,2-s2.0-85060210922
"Maiorana-Basas M., Pagliaro C.M.","56205004100;6507573909;","Technology use among adults who are deaf and hard of hearing: A national survey",2014,"Journal of Deaf Studies and Deaf Education","19","3", enu005,"","",,29,"10.1093/deafed/enu005",2-s2.0-84902504885
"Marschark M., Harris M.","","Success and failure in learning to read: The special case (?) of deaf children",1996,"Reading Comprehension Difficulties: Processes and Intervention",,,,"279","300",,124,,2-s2.0-0002572717
"Marshall M.T., Wanderley M.M.","","Vibrotactile feedback in digital musical instruments",2006,"NIME '06: Proceedings of the 2006 conference on New interfaces for musical expression",,,,"226","229",,30,,2-s2.0-63549138457
"Matsuda A., Nakamura H., Sugaya M.","56437243800;36076721100;7004276282;","Luminous device for the deaf and hard of hearing people",2014,"HAI 2014 - Proceedings of the 2nd International Conference on Human-Agent Interaction",,,,"201","204",,3,"10.1145/2658861.2658922",2-s2.0-84914700238
"Mielke M., Bruck R.","57197513295;9639255900;","AUDIS wear: A smartwatch based assistive device for ubiquitous awareness of environmental sounds",2016,"Proceedings of the Annual International Conference of the IEEE Engineering in Medicine and Biology Society, EMBS","2016-October",, 7591934,"5343","5347",,7,"10.1109/EMBC.2016.7591934",2-s2.0-85009074602
"Mielke M., Grunewald A., Bruck R.","57197513295;55320081200;9639255900;","An assistive technology for hearing-impaired persons: Analysis, requirements and architecture",2013,"Proceedings of the Annual International Conference of the IEEE Engineering in Medicine and Biology Society, EMBS",,, 6610597,"4702","4705",,8,"10.1109/EMBC.2013.6610597",2-s2.0-84886534967
"Mirzaei M.R., Ghorshi S., Mortazavi M.","26639531800;24329242400;12783366000;","Using augmented reality and automatic speech recognition techniques to help deaf and hard of hearing people",2012,"ACM International Conference Proceeding Series",,,,"","",,4,"10.1145/2331714.2331720",2-s2.0-84865025303
"Motlhabi M., Glaser M., Parker M., Tucker W.","","SignSupport: A Limited Communication Domain Mobile Aid for a Deaf patient at the Pharmacy",2013,"Proc. SATNAC",,,,"173","178",,8,,2-s2.0-84893378173
"Nanayakkara S.C., Wyse L., Ong S.H., Taylor E.A.","23009527800;55493118100;7202336776;57198883215;","Enhancing musical experience for the hearing-impaired using visual and haptic displays",2013,"Human-Computer Interaction","28","2",,"115","160",,11,"10.1080/07370024.2012.697006",2-s2.0-84872874928
"Ng'ethe G.G., Blake E.H., Glaser M.","56896165200;7006460560;56023892800;","SignSupport: A mobile aid for deaf people learning computer literacy skills",2015,"CSEDU 2015 - 7th International Conference on Computer Supported Education, Proceedings","2",,,"501","511",,7,,2-s2.0-84943537875
"Padden C., Humphries T.","",[No title available],1988,"Deaf in America: Voices from a Culture",,,,"","",,576,,2-s2.0-0003875330
"Paredes H., Fonseca B., Cabo M., Pereira T., Fernandes F.","23398113700;34968950600;54402356900;54403580100;57191773703;","SOSPhone: A mobile application for emergency calls",2014,"Universal Access in the Information Society","13","3",,"277","290",,16,"10.1007/s10209-013-0318-z",2-s2.0-84905037103
"Parton B.S., Hancock R., DuBusde Valempré A.D.","35201554800;56247027600;36185112700;","Tangible manipulatives and digital content: The transparent link that benefits young deaf children",2010,"Proceedings of IDC2010: The 9th International Conference on Interaction Design and Children",,,,"300","303",,5,"10.1145/1810543.1810597",2-s2.0-77954893237
"Paudyal P., Banerjee A., Gupta S.K.S.","57188835249;56438567300;34975062800;","SCEPTRE: A pervasive, non-invasive, and programmable gesture recognition technology",2016,"International Conference on Intelligent User Interfaces, Proceedings IUI","07-10-March-2016",,,"282","293",,24,"10.1145/2856767.2856794",2-s2.0-84963731962
"Petry B., Illandara T., Nanayakkara S.","55533933700;57192559312;23009527800;","MuSS-Bits: Sensor-display blocks for deaf people to explore musical sounds",2016,"Proceedings of the 28th Australian Computer-Human Interaction Conference, OzCHI 2016",,,,"72","80",,5,"10.1145/3010915.3010939",2-s2.0-85011982173
"Pouris M., Fels D.I.","55331410100;56974716500;","Creating an entertaining and informative music visualization",2012,"Lecture Notes in Computer Science (including subseries Lecture Notes in Artificial Intelligence and Lecture Notes in Bioinformatics)","7382 LNCS","PART 1",,"451","458",,4,"10.1007/978-3-642-31522-0_68",2-s2.0-84864816470
"Ravid U., Cairns P.","","The design development of a mobile alert for the deaf and the hard of hearing",2008,"Doctoral dissertation",,,,"","",,1,,2-s2.0-85060198924
"Rekha K., Latha B.","56313343300;26643194000;","Mobile translation system from speech language to hand motion language",2014,"Proceedings - 2014 International Conference on Intelligent Computing Applications, ICICA 2014",,, 6965082,"411","415",,4,"10.1109/ICICA.2014.90",2-s2.0-84918497980
"Ren H., Meng M.Q.-H., Chen X.","14030501000;7102739136;36717259700;","Wireless assistive sensor networks for the deaf",2006,"IEEE International Conference on Intelligent Robots and Systems",,, 4059178,"4804","4808",,4,"10.1109/IROS.2006.282354",2-s2.0-34250659837
[No author name available],[No author id available],"Banks face massive payouts to Deaf customers",2012,"Action on Hearing Loss",,,,"","",,1,,2-s2.0-85060211030
[No author name available],[No author id available],"Statistics",2017,"Action on Hearing Loss. A national charity since 1911",,,,"","",,1,,2-s2.0-85060233291
"Romaniuk J., Suszczańska N., Szmal P.","37061818800;6507714898;34977734800;","Semantic analyzer in the thetos-3 system",2011,"Lecture Notes in Computer Science (including subseries Lecture Notes in Artificial Intelligence and Lecture Notes in Bioinformatics)","6562 LNAI",,,"234","244",,2,"10.1007/978-3-642-20095-3_22",2-s2.0-79953230083
"Romaniuk J., Suszczańska N., Szmal P.","37061818800;6507714898;34977734800;","Semantic analyzer in the thetos-3 system",2011,"Lecture Notes in Computer Science (including subseries Lecture Notes in Artificial Intelligence and Lecture Notes in Bioinformatics)","6562 LNAI",,,"234","244",,2,"10.1007/978-3-642-20095-3_22",2-s2.0-79953230083
"Şahin M.I., Sagers J.E., Stankovic K.M.","57204259220;57194129233;6603737931;","Cochlear Implantation: Vast Unmet Need to Address Deafness Globally",2017,"Otology and Neurotology","38","6",,"786","787",,3,"10.1097/MAO.0000000000001416",2-s2.0-85018846575
"Sarji D.K.","24482175900;","HandTalk: Assistive technology for the deaf",2008,"Computer","41","7",,"84","86",,16,"10.1109/MC.2008.226",2-s2.0-48249097601
"Slyper L., Kim M.K., Ko Y., Sobek I.","55749564700;57193534732;57193539688;57193537423;","LifeKey: Emergency communication tool for the deaf",2016,"Conference on Human Factors in Computing Systems - Proceedings","07-12-May-2016",,,"62","67",,4,"10.1145/2851581.2890629",2-s2.0-85014612189
"Sorgini F., Caliò R., Carrozza M.C., Oddo C.M.","57195602437;56073871800;7004407178;16176089500;","Haptic-assistive technologies for audition and vision sensory disabilities",2018,"Disability and Rehabilitation: Assistive Technology","13","4",,"394","421",,8,"10.1080/17483107.2017.1385100",2-s2.0-85043527092
"Suharjito, Anderson R., Wiryana F., Ariesta M.C., Kusuma G.P.","55390566600;57200164036;57200161564;57200169800;24474615100;","Sign Language Recognition Application Systems for Deaf-Mute People: A Review Based on Input-Process-Output",2017,"Procedia Computer Science","116",,,"441","448",,5,"10.1016/j.procs.2017.10.028",2-s2.0-85039996808
"Suszczanska N., Szmal P., Kulikow S.","","Continuous text translation using text modeling in the thetos system",2007,"International Journal of Computer, Electrical, Automation, Control and Information Engineering","1","8",,"2632","2635",,1,,2-s2.0-85060238111
"Trigueiros P., Ribeiro F., Reis L.P.","55351529400;54961672600;13907511600;","Vision-based portuguese sign language recognition system",2014,"Advances in Intelligent Systems and Computing","275 AISC","VOLUME 1",,"605","617",,11,"10.1007/978-3-319-05951-8_57",2-s2.0-84904695500
"Wauters L.N.","",[No title available],2005,"Reading comprehension in deaf children: The impact of the mode of acquisition of word meanings",,,,"","",,12,,2-s2.0-33947148685
[No author name available],[No author id available],"Hearing loss and hearing loss",2017,"World Health Organization",,,,"","",,1,,2-s2.0-85060208530
