Authors,Author(s) ID,Title,Year,Source title,Volume,Issue,Art. No.,Page start,Page end,Page count,Cited by,DOI,EID
"Mustaquim M.","",[No title available],0000,"Gaze interaction: a challenge for inclusive design",,,,"","",,1,,2-s2.0-85032300061
"Blake D.J., Bodine C.","7402494495;6505833170;","An overview of assistive technology for persons with multiple sclerosis",2002,"Journal of Rehabilitation Research and Development","39","2",,"299","312",,41,,2-s2.0-0036017503
"Chwastiak L., Ehde D.M., Gibbons L.E., Sullivan M., Bowen J.D., Kraft G.H.","12769834800;6603834909;7102699841;7401998613;57202570641;19635736700;","Depressive symptoms and severity of illness in multiple sclerosis: Epidemiologic study of a large community sample",2002,"American Journal of Psychiatry","159","11",,"1862","1868",,368,"10.1176/appi.ajp.159.11.1862",2-s2.0-0036842656
"Thompson A.J., Hobart J.C.","7404597283;7005144498;","Multiple sclerosis: Assessment of disability and disability scales",1998,"Journal of Neurology","245","4",,"189","196",,64,"10.1007/s004150050204",2-s2.0-0031899459
"Reynolds S.L., Haley W.E., Kozlenko N.","7201868609;57201601450;24490850500;","The impact of depressive symptoms and chronic diseases on active life expectancy in older Americans",2008,"American Journal of Geriatric Psychiatry","16","5",,"425","432",,65,"10.1097/JGP.0b013e31816ff32e",2-s2.0-48649100232
"Sadovnick A.D., Ebers G.C., Wilson R.W., Paty D.W.","7005523120;38561127900;56322600800;7007034249;","Life expectancy in patients attending multiple sclerosis clinics",1992,"Neurology","42","5",,"991","994",,131,,2-s2.0-0026780512
"Panitch H., Anaissie E., Cines D., DeGroot L., Dorsey F., Phillips T., Simon J., Brinar V., Demarin V., Janculjak D., Rudez J., Vladic A., Czlonkowska A., Mirowska-Guzel D., Kozubski W., Kwiecinski H., Stelmasiak Z., Szczudlik A., Boyko A., Gusev EI., Skoromets A., Stolyarov I., Yakhno N., Zavalishin I., Shawcross J., Jones J., Cox A.L., Bass A., Wenzel D., Biton V., Cascione M., Cleeremans B., Cooper J., Coyle P.K., Madigan D., Cutler B., Fox E.J., Mayer L., Tyer R., Gazda S., Glyman S., Gupta A., Harney J., Hutton G., Jacobs D., Khan O., Lisak R., Tselis A., Klapper J., Liss J., Meyer D., Rae-Grant A., Rossman H., Boudouris W., Belkin M., Pierce R., Royal W., Shubin R., Sider D., Stein M., Steingo B., Sullivan H., Twyman C., Webb R., Weinshenker B., Keegan B.M., Rauchwarter D., Wingerchuk D., Carter J., Wray S., Wynn D., Allen N., Nagar C., O'Brien D., Paskavitz J., Schaefer P., Valente W., Beardsley D., Bussel J., Goldberg M., MacMillan R., Scadden D., D'Agostino R.B., Pencina M., Gonzales G., Waldmann H., Hale G., Coles A.J., Compston D.A.S., Selmaj K.W., Lake S.L., Moran S., Margolin D.H., Norris K., Tandon P.K.","7006671894;7102970626;7006087844;7102346660;16315656700;57198364927;35395739300;7004613120;7005264877;24483410700;7801488454;6507880386;7102938849;13408786100;7003631565;7007133340;7006643397;7006879954;57202042077;57208570695;7006577975;6701371972;7004210424;7007133429;36553268600;7408058111;8230740700;8846400000;57208570759;6701562441;8846401600;8846401700;57199154225;23157884200;57208570762;57208570767;57054984600;55998821300;57208570734;8846404200;57208570735;55628527334;36663716700;7003880723;57209846973;26642956800;7102899763;6701463058;57198217560;57208570654;57199302357;6701568206;6602606457;57208570638;57208570739;57208570699;7003861548;57194482748;57208570670;57198645934;55355754400;7101994400;36151573700;36554855800;7007070762;7003390007;57208570729;6701649794;57198881750;54404006100;6701687721;57197551488;57208570607;36767402000;6505881249;57208570635;6701820593;7003414363;7006594610;35427265100;7102360734;7004848033;57208570647;9638155800;57208570639;57203030862;7102753706;7005609267;26643344000;7005132611;35938710200;36340679100;36340374100;57197134253;57197389741;","Alemtuzumab vs. interferon beta-1a in early multiple sclerosis",2008,"New England Journal of Medicine","359","17",,"1786","1801",,694,"10.1056/NEJMoa0802670",2-s2.0-54949143968
"Kemp B.J., Krause J.S.","7202002777;7202955174;","Depression and life satisfaction among people ageing with post-polio and spinal cord injury",1999,"Disability and Rehabilitation","21","5-6",,"241","249",,134,"10.1080/096382899297666",2-s2.0-0032998560
"Calvo A., Chiò A., Castellina E., Corno F., Farinetti L., Ghiglione P., Pasian V., Vignola A.","7005236400;7006225787;24723409600;7005579197;56114038800;7801588388;24725064400;24726170100;","Eye tracking impact on quality-of-life of ALS patients",2008,"Lecture Notes in Computer Science (including subseries Lecture Notes in Artificial Intelligence and Lecture Notes in Bioinformatics)","5105 LNCS",,,"70","77",,25,"10.1007/978-3-540-70540-6_9",2-s2.0-50249107796
"Bhoyar A., Sahu S., Padwekar P.","",[No title available],2015,"Eye tracking mouse: people with severe disabilities. In: Proceedings of the 20th IRF International Conference",,,,"","",,1,,2-s2.0-85032289700
"Border J.","","Exploring Empirical Guidelines for Selecting Computer Assistive Technology for People with Disabilities. M.Sc. thesis",2011,"Wright State University",,,,"","",,2,,2-s2.0-85016707834
"Johnson K.L., Bamer A.M., Yorkston K.M., Amtmann D.","35585428200;23471781900;7003785696;6603105762;","Use of cognitive aids and other assistive technology by individuals with multiple sclerosis",2009,"Disability and Rehabilitation: Assistive Technology","4","1",,"1","8",,34,"10.1080/17483100802239648",2-s2.0-65249174567
"Hafler D.A.","7101602133;","Multiple sclerosis",2004,"Journal of Clinical Investigation","113","6",,"788","794",,332,"10.1172/JCI21357",2-s2.0-2142662186
"Huntley A., Ernst E.","7005567826;36040636300;","Complementary and alternative therapies for treating multiple sclerosis symptoms: A systematic review",2000,"Complementary Therapies in Medicine","8","2",,"97","105",,49,"10.1054/ctim.2000.0366",2-s2.0-0033910890
[No author name available],[No author id available],[No title available],0000,"WebMD. Multiple sclerosis health center.",,,,"","",,1,,2-s2.0-85032306914
"Ghasemi M., Gorji Y., Ashtar F., Ghasemi M.","","A study of psychological well-being in people with multiple sclerosis and their primary caregivers",2015,"Adv Biomed Res.","4",,,"49","",,2,,2-s2.0-84987779039
"Yozbatiran N., Baskurt F., Baskurt Z., Ozakbas S., Idiman E.","7801576172;7801410778;12752389900;6602895100;6603281758;","Motor assessment of upper extremity function and its relation with fatigue, cognitive function and quality of life in multiple sclerosis patients",2006,"Journal of the Neurological Sciences","246","1-2",,"117","122",,78,"10.1016/j.jns.2006.02.018",2-s2.0-33744527610
"Stachowiak J.","","Understanding",2015,"multiple sclerosis",,,,"","",,1,,2-s2.0-85032264291
"Souza A., Kelleher A., Cooper R., Cooper R.A., Iezzoni L.I., Collins D.M.","7103402854;12140207700;35185938400;7404337543;35918007800;12140094500;","Multiple sclerosis and mobility-related assistive technology: Systematic review of literature",2010,"Journal of Rehabilitation Research and Development","47","3",,"213","224",,66,"10.1682/JRRD.2009.07.0096",2-s2.0-77954378737
"Kurtzke J.F.","7006094705;","Rating neurologic impairment in multiple sclerosis: An expanded disability status scale (EDSS)",1983,"Neurology","33","11",,"1444","1452",,9652,,2-s2.0-0021035886
[No author name available],[No author id available],[No title available],1980,"International Classification of Impairments, Disabilities and Handicaps",,,,"","",,3239,,2-s2.0-0003758543
"Alonso A., De la Rosa R., Carrera A., Bahillo A., Durn R., Fernandez P.","","A control system for robots and wheelchairs: its application for people with severe motor disability. In: Gacovski, Z. (ed.) Mobile Robots: Current Trends",2011,"Intech",,,,"","",,1,,2-s2.0-85032277078
"Ka H., Simpson R.","","Effectiveness of Morse code as an alternative control method for powered wheelchair navigation",2012,"Rehabilitation Engineering Society of North America (RESNA) Conference, June/July 2012",,,,"","",,1,,2-s2.0-85032260470
"Mani N., Sebastian A., Mathews Paul A., Chacko A., Raghunath A.","","Eye controlled electric wheelchair",2015,"International Journal of Advanced Research in Electrical, Electronics and Instrumentation Engineering","4","4",,"2494","2497",,9,,2-s2.0-84980383048
"Nelson C., Badas N.S., Saritha I.G., Thejaswini S.","","Robotic wheelchair using eye blink sensors and accelerometer provided with home appliance control",2014,"Int. Journal of Engineering Research and Applications","4","5",,"129","134",,3,,2-s2.0-84968793151
"Wei L., Hu H.","","Towards multimodal human-machine interface for hands-free control: a survey. Technical report CES-510, School of Computer Science and Electronic Engineering",2011,"University of Essex",,,,"","",,1,,2-s2.0-85032271032
"Saeed H., Nooh H., Adel M., Rabeea A., Sadiq M.","","Utilize eye tracking technique to control devices for ALS patients",2015,"Int. J. Appl. Innov. Eng. Manag.","4","5",,"381","388",,1,,2-s2.0-85032282231
"Pinheiro Jr C.G., Naves E.L.M., Pino P., Losson E., Andrade A.O., Bourhis G.","35874012300;25121715300;7007124657;6602625920;7101975915;6602834086;","Alternative communication systems for people with severe motor disabilities: A survey",2011,"BioMedical Engineering Online","10",, 31,"","",,43,"10.1186/1475-925X-10-31",2-s2.0-79954619594
"Betke M.","","Camera-based interfaces and assistive software for people with severe motion impairments. In: 3rd Workshop on AI Techniques for Ambient Intelligence",2008,"Patras",,,,"","",,1,,2-s2.0-85032265543
"Akram W., Tiberii L., Betke M.","8119176300;23398370900;7004214113;","A customizable camera-based human computer interaction system allowing people with disabilities autonomous hands-free navigation of multiple computing tasks",2007,"Lecture Notes in Computer Science (including subseries Lecture Notes in Artificial Intelligence and Lecture Notes in Bioinformatics)","4397 LNCS",,,"28","42",,13,,2-s2.0-38149052823
[No author name available],[No author id available],[No title available],2015,"SmartNav.: Hands-free ergonomic mouse",,,,"","",,1,,2-s2.0-85032300106
"Instruments O.","",[No title available],2015,"HeadMouse extreme",,,,"","",,1,,2-s2.0-85032266540
"Zhai S., Morimoto C., Ihde S.","55679986500;7102275798;6603459704;","Manual and gaze input cascaded (MAGIC) pointing",1999,"Conference on Human Factors in Computing Systems - Proceedings",,,,"246","253",,374,"10.1145/302979.303053",2-s2.0-0032662263
"Anacan R., Alcayde J., Antegra R., Luna L.","","Eye-GUIDE (eye-gaze user interface design) messaging for physically-impaired people",2013,"Int. J. Distrib. Parallel Syst. (IJDPS)","4","1",,"41","52",,2,,2-s2.0-85032286551
"Gepner D., Simonin J., Carbonell N.","23396560300;13005483800;13006846300;","Gaze as a supplementary modality for interacting with ambient intelligence environments",2007,"Lecture Notes in Computer Science (including subseries Lecture Notes in Artificial Intelligence and Lecture Notes in Bioinformatics)","4555 LNCS","PART 2",,"848","857",,9,,2-s2.0-38149029315
"Madhav S., Gaddamwar P., Chipte G.","","Eyegaze communication system",2012,"Int. J. Comput. Commun. Technol.","3","6",,"34","37",,1,,2-s2.0-85032295839
"Mauri C., Granollers T., Lorés J., García M.","","Computer vision interaction for people with severe movement restrictions",2006,"Human Technology","2","1",,"38","54",,30,,2-s2.0-34548145603
"Pissaloux E., Carbone A., Martinez F.","","Toward the design of a low cost vision-based gaze tracker for interaction skill acquisition",2011,"BIO Web Conf.","1",,,"00071","",,1,,2-s2.0-85032255257
"Prabhu V., Prasad G.","55002923600;55812562500;","Designing a virtual keyboard with multi-modal access for people with disabilities",2011,"Proceedings of the 2011 World Congress on Information and Communication Technologies, WICT 2011",,, 6141407,"1133","1138",,14,"10.1109/WICT.2011.6141407",2-s2.0-84857165848
"Van Der Kamp J., Sundstedt V.","42762639100;10240036700;","Gaze and voice controlled drawing",2011,"ACM International Conference Proceeding Series",,, 9,"","",,9,"10.1145/1983302.1983311",2-s2.0-79960188433
"Vamvakousis Z., Ramirez R.","",[No title available],2011,"The Eyeharp: A Gaze-Controlled Musical Instrument",,,,"","",,2,,2-s2.0-84979988638
"Grauman K., Betke M., Gips J., Bradski G.R.","","Communication via eye blinks - Detection and duration analysis in real time",2000,"IEEE Computer Society Conference on Computer Vision and Pattern Recognition (CVPR)",,,,"","",,5,,2-s2.0-77949524334
"Mohammed A.A., Anwer S.A.","","Efficient eye blink detection method for disabled helping domain",2014,"International Journal of Advanced Computer Science and Applications","5","5",,"202","206",,10,,2-s2.0-84969627540
"Missimer E., Betke M.","","Blink and wink detection for mouse pointer control. In: Proceedings of the 3rd International Conference on Pervasive Technologies Related to Assistive Environments (PETRA’10)",2010,"Samos",,,,"","",,1,,2-s2.0-85032286091
"Dynavox T.","",[No title available],2015,"Tobii PCEye Go",,,,"","",,1,,2-s2.0-85032289231
"Karpov A., Ronzhin A., Nechaev A., Chernakova S.","57195330987;16643978200;57208301671;55308124500;","Multimodal system for hands-free PC control",2005,"13th European Signal Processing Conference, EUSIPCO 2005",,,,"213","216",,4,,2-s2.0-70350306366
"Salnikov A.","","Natural interface to improve human-computer interaction for people with upper limb disabilities: exploring the potentials of voice input and hand gestures in application development to improve the communication possibilities of people with motor disorders. Bachelor’s thesis in Information Technologies, Lahti University of",2014,"Applied Sciences",,,,"","",,1,,2-s2.0-85032267863
"Tobii E.X.","",[No title available],2015,,,,,"","",,1,,2-s2.0-85032303629
[No author name available],[No author id available],[No title available],2015,"TeamViewer- the All-in-one software for remote support and online meetings",,,,"","",,3,,2-s2.0-85001748641
[No author name available],[No author id available],[No title available],2015,,,,,"","",,1,,2-s2.0-85032266923
"Hevner A.R., March S.T., Park J., Ram S.","7004500718;7005489136;55717035500;35608028600;","Design science in information systems research",2004,"MIS Quarterly: Management Information Systems","28","1",,"75","105",,5910,,2-s2.0-0242652022
"Kuechler W., Vaishnavi V.","55888206000;7004240197;","A framework for theory development in design science research: Multiple perspectives",2012,"Journal of the Association of Information Systems","13","6",,"395","423",,126,,2-s2.0-84863328368
"Salnikov A.","","Natural interface to improve human-computer interaction for people with upper limb disabilities: exploring the potentials of voice input and hand gestures in application development to improve the communication possibilities of people with motor disorders. Bachelor’s thesis in Information Technologies, Lahti University of",2014,"Applied Sciences",,,,"","",,1,,2-s2.0-85032267863
"Lesher G.W., Moulton B.J., Higginbotham D.J.","7003949394;7006279323;6601912621;","Optimal character arrangements for ambiguous keyboards",1998,"IEEE Transactions on Rehabilitation Engineering","6","4",,"415","423",,53,"10.1109/86.736156",2-s2.0-0032374085
"Ward D.J., MacKay D.J.C.","55464690800;56264855700;","Artificial intelligence: Fast hands-free writing by gaze direction",2002,"Nature","418","6900",,"838","",,147,"10.1038/418838a",2-s2.0-0037158688
"Arnot J.L.","","Text entry in augmentative and alternative communication",2006,"Efficient Text Entry, Dagstuhl Seminar Proceedings 05382. Internationales Begegnungs- und Forschungszentrum fur Informatik (IBFI)",,,,"","",,1,,2-s2.0-85032260381
"Bhattacharya S., Samanta D., Basu A.","56282530700;24069596900;7402166595;","Performance models for automatic evaluation of virtual scanning keyboards",2008,"IEEE Transactions on Neural Systems and Rehabilitation Engineering","16","5",,"510","519",,26,"10.1109/TNSRE.2008.2003377",2-s2.0-55749114057
"Biswas P., Langdon P.","14007579800;55781400200;","A new interaction technique involving eye gaze tracker and scanning system",2013,"ACM International Conference Proceeding Series",,,,"67","70",,9,"10.1145/2509315.2509322",2-s2.0-84883862198
"Bates R., Istance H., Bates R.","57195086305;6602493995;57195086305;","Towards eye based virtual environment interaction for users with high-level motor disabilities",2005,"International Journal on Disability and Human Development","4","3",,"217","224",,1,"10.1515/IJDHD.2005.4.3.217",2-s2.0-85025251393
