Authors,Author(s) ID,Title,Year,Source title,Volume,Issue,Art. No.,Page start,Page end,Page count,Cited by,DOI,EID
"Adner R.","",[No title available],2012,"The Wide Lens",,,,"","",,12,,2-s2.0-84878667470
"Adner R., Kapoor R.","55904381100;23027335500;","Value creation in innovation ecosystems: How the structure of technological interdependence affects firm performance in new technology generations",2010,"Strategic Management Journal","31","3",,"306","333",,658,"10.1002/smj.821",2-s2.0-77449110302
"Andreessen M.","","Why software is eating the world",2011,"Wall Street Journal",,,,"","",,18,,2-s2.0-84873951871
"Arthur W.B.","7005300390;","The second economy",2011,"McKinsey Quarterly",,"4",,"91","99",,40,,2-s2.0-83455203420
"Baldwin C.Y., Woodard C.J.","7201893924;35114158500;","The architecture of platforms: A unified view",2009,"Platforms, Markets and Innovation",,,,"19","44",,202,,2-s2.0-71949126345
"Boudreau K.","36439037700;","Open platform strategies and innovation: Granting access vs. devolving control",2010,"Management Science","56","10",,"1849","1872",,259,"10.1287/mnsc.1100.1215",2-s2.0-77958033399
"Chui M., Löffler M., Roberts R.","36711463000;36106992700;23568646500;","The internet of things",2010,"McKinsey Quarterly",,"2",,"70","79",,191,,2-s2.0-77953346932
"De Weck O.L., Roos D., Magee C.L.","","Engineering Systems: Meeting Human Needs in a Complex Technological World",2011,"Engineering Systems: Meeting Human Needs in a Complex Technological World",,,,"","",,162,,2-s2.0-80053182449
"Dougherty D., Dunne D.D.","7101912657;27067641800;","Organizing ecologies of complex innovation",2011,"Organization Science","22","5",,"1214","1223",,99,"10.1287/orsc.1100.0605",2-s2.0-82255167603
[No author name available],[No author id available],"Bigger and better than Wi-Fi",2010,"Economist","397","8712",,"","",,1,,2-s2.0-79952088135
[No author name available],[No author id available],"Power from thin air",2010,"Economist","395","8686",,"","",,2,,2-s2.0-77955906917
[No author name available],[No author id available],"Make your own angry birds",2012,"Economist",,,,"55","",,1,,2-s2.0-84903660691
[No author name available],[No author id available],"Outsourcing is so last year",2012,"Economist",,,,"","",,1,,2-s2.0-84903658837
"Eisenmann T., Parker G., Van Alstyne M.W.","6603030219;8858334600;8960223000;","Strategies for two-sided markets",2006,"Harvard Business Review","84","10",,"92","101+149",,528,,2-s2.0-33749685216
"Evans D.S., Schmalensee R.","",[No title available],2007,"Catalyst Code",,,,"","",,7,,2-s2.0-80051973996
"Evans D.S., Hagiu A., Schmalensee R.","",[No title available],2006,"Invisible Engines: How Software Platforms Drive Innovation and Transform Industries",,,,"","",,243,,2-s2.0-34248371447
"Fichman R.G.","6701846129;","Real options and IT platform adoption: Implications for theory and practice",2004,"Information Systems Research","15","2",,"132","154+211",,275,"10.1287/isre.1040.0021",2-s2.0-4043130906
"Iansiti M., Levien R.","",[No title available],2004,"The Keystone Advantage: What the New Dynamics of Business Ecosystems Mean for Strategy, Innovation, and Sustainability",,,,"","",,596,,2-s2.0-27444432184
"Jackson N.","","Infographic: the Internet of things",2011,"Atlantic",,,,"","",,1,,2-s2.0-84903656623
"Katz M.L., Shapiro C.","","Systems competition and network effects",1994,"Journal of Economic Perspectives","8","2",,"93","115",,1102,,2-s2.0-0002981164
"Messerschmitt D.G., Szyperski C.","",[No title available],2003,"Software Ecosystem",,,,"","",,24,,2-s2.0-35148869731
"Prentice C.","","The washers and dryers that talk back",2010,"BusinessWeek",,,,"23","24",,1,,2-s2.0-84903651060
"Simon H.A.","","The architecture of complexity",1962,"Proceedings of the American Philosophical Society","106","6",,"467","482",,2836,,2-s2.0-0000790263
"Thompson A.","","Good morning, this is your coffeemaker calling",2010,"BusinessWeek",,,,"41","42",,1,,2-s2.0-84903659233
"Tiwana A., Konsynski B., Bush A.A.","6701805181;7003815617;7201882734;","Platform evolution: Coevolution of platform architecture, governance, and environmental dynamics",2010,"Information Systems Research","21","4",,"675","687",,428,"10.1287/isre.1100.0323",2-s2.0-78650659690
"Williamson P.J., De Meyer A.","7203003456;6701335113;","Ecosystem advantage: How to successfully harness the power of partners",2012,"California Management Review","55","1",,"24","46",,82,"10.1525/cmr.2012.55.1.24",2-s2.0-84868346825
"Adner R., Levinthal D.","7801600783;7003966546;","Demand heterogeneity and technology evolution: Implications for product and process innovation",2001,"Management Science","47","5",,"611","628",,357,"10.1287/mnsc.47.5.611.10482",2-s2.0-0035351895
"Anderson P., Tushman M.L.","","Technological discontinuities and dominant designs: A cyclical model of technological change",1990,"Administrative Science Quarterly","35","4",,"604","633",,1498,,2-s2.0-34748827706
"Armstrong M.","7202399733;","Competition in two-sided markets",2006,"RAND Journal of Economics","37","3",,"668","691",,873,"10.1111/j.1756-2171.2006.tb00037.x",2-s2.0-33745596723
"Armstrong M., Wright J.","7202399733;7601528615;","Two-sided markets, competitive bottlenecks and exclusive contracts",2007,"Economic Theory","32","2",,"353","380",,156,"10.1007/s00199-006-0114-6",2-s2.0-34249697043
"Barnett W.P., Hansen M.T.","7102771669;7401874259;","The red queen in organizational evolution",1996,"Strategic Management Journal","17","SUPPL. SUMMER",,"137","157",,278,,2-s2.0-0030375607
"Caillaud B., Jullien B.","55938405900;6603074966;","Chicken & egg: Competition among intermediation service providers",2003,"RAND Journal of Economics","34","2",,"309","328",,534,"10.2307/1593720",2-s2.0-0043246466
"Farrell J., Saloner G.","","Installed base and compatibility: Innovation, product preannouncements, and predation",1986,"American Economic Review","76","5",,"940","955",,837,,2-s2.0-0000150059
"Hoetker G.","6507674687;","Do modular products lead to modular organizations?",2006,"Strategic Management Journal","27","6",,"501","518",,176,"10.1002/smj.528",2-s2.0-33646563769
"Meadows D.H.","","Thinking in Systems",2008,"Thinking in Systems",,,,"","",,132,,2-s2.0-70349411708
"Monteverde K., Teece D.J.","","Supplier switching costs and vertical integration in the automobile industry",1982,"Bell Journal of Economics","13","1",,"206","213",,636,,2-s2.0-0001202233
"Rogers E.M.","",[No title available],1995,"Diffusion of Innovations",,,,"","",,36442,,2-s2.0-0003584083
"Rohlfs J.","",[No title available],2001,"Bandwagon Effects in High-Technology Industries",,,,"","",,147,,2-s2.0-0141613334
"Saloner G., Shepard A.","","Adoption of technologies with network effects: An empirical examination of the adoption of automated teller machines",1995,"RAND Journal of Economics","26","3",,"479","501",,218,,2-s2.0-21844523617
"Sanchez R.","7401636867;","Strategic flexibility in product competition",1995,"Strategic Management Journal","16","1 S",,"135","159",,759,"10.1002/smj.4250160921",2-s2.0-84989078094
"Sanchez R., Mahoney J.T.","7401636867;7202430103;","Modularity, flexibility, and knowledge management in product and organization design",1996,"Strategic Management Journal","17","SUPPL. WINTER",,"63","76",,1312,,2-s2.0-3142519738
"Tiwana A., Konsynski B.","6701805181;7003815617;","Complementarities between organizational IT architecture and governance structure",2010,"Information Systems Research","21","2",,"288","304",,140,"10.1287/isre.1080.0206",2-s2.0-77957356995
"Utterback J.M.","",[No title available],1994,"Mastering the Dynamics of Innovation",,,,"","",,2362,,2-s2.0-0003503061
"Van Schewick B.","",[No title available],2010,"Internet Architecture and Innovation",,,,"","",,98,,2-s2.0-79952162967
"Gawer A., Cusumano M.A.","6506170616;7003834648;","How companies become platform leaders",2008,"MIT Sloan Management Review","49","2",,"28","35",,261,,2-s2.0-59649085930
"Rysman M.","7801555346;","The economics of two-sided markets",2009,"Journal of Economic Perspectives","23","3",,"125","143",,300,"10.1257/jep.23.3.125",2-s2.0-75749090789
"Schilling M.A.","7201756153;","Toward a general modular systems theory and its application to interfirm product modularity",2000,"Academy of Management Review","25","2",,"312","334",,699,"10.5465/AMR.2000.3312918",2-s2.0-0034343095
"Meyer M.H., Seliger R.","","Product platforms in software development",1998,"Sloan Management Review","40","1",,"61","74",,74,,2-s2.0-0002385620
"Rochet J.-C., Tirole J.","7003964548;13805189500;","Two-sided markets: A progress report",2006,"RAND Journal of Economics","37","3",,"645","667",,798,"10.1111/j.1756-2171.2006.tb00036.x",2-s2.0-34248324442
"Williamson O.E.","","Comparative economic organization: The analysis of discrete structural alternatives",1991,"Administrative Science Quarterly","36","2",,"269","296",,3223,,2-s2.0-84936824407
"Ang S., Straub D.W.","7102365520;7005859153;","Production and transaction economies and IS outsourcing: A study of the U.S. banking industry",1998,"MIS Quarterly: Management Information Systems","22","4",,"535","548",,441,,2-s2.0-0000403739
"Baldwin C.Y.","7201893924;","Where do transactions come from? Modularity, transactions, and the boundaries of firms",2008,"Industrial and Corporate Change","17","1",,"155","195",,213,"10.1093/icc/dtm036",2-s2.0-38549134498
"Baldwin C.Y., Clark K.B.","",[No title available],2000,"Design Rules: The Power of Modularity",,,,"","",,1992,,2-s2.0-0003501595
"Baldwin C.Y., Clark K.B.","7201893924;7402415378;","The architecture of participation: Does code architecture mitigate free riding in the open source development model?",2006,"Management Science","52","7",,"1116","1127",,202,"10.1287/mnsc.1060.0546",2-s2.0-33745599879
"Dougherty D.","7101912657;","A practice‐centered model of organizational renewal through product innovation",1992,"Strategic Management Journal","13","1 S",,"77","92",,301,"10.1002/smj.4250131007",2-s2.0-84911301663
"Ethiraj S.K., Levinthal D.","6602870795;7003966546;","Bounded rationality and the search for organizational architecture: An evolutionary perspective on the design of organizations and their evolvability",2004,"Administrative Science Quarterly","49","3",,"404","437",,143,,2-s2.0-14944368949
"Ethiraj S.K., Levinthal D.","6602870795;7003966546;","Modularity and Innovation in Complex Systems",2004,"Management Science","50","2",,"159","173",,375,"10.1287/mnsc.1030.0145",2-s2.0-1642361663
"Ethiraj S.K., Levinthal D., Roy R.R.","6602870795;7003966546;26321938600;","The dual role of modularity: Innovation and imitation",2008,"Management Science","54","5",,"939","955",,106,"10.1287/mnsc.1070.0775",2-s2.0-47749089914
"Farrell J., Saloner G.","","Standardization, compatibility, and innovation",1985,"Rand Journal of Economics","16","1",,"70","83",,1148,,2-s2.0-0002642594
"Farrell J., Saloner G.","","Converters, compatibility, and the control of interfaces",1992,"Journal of Industrial Economics","40","1",,"9","35",,194,,2-s2.0-0002411768
"Gamba A., Fusari N.","56897305900;25937249400;","Valuing modularity as a real option",2009,"Management Science","55","11",,"1877","1896",,31,"10.1287/mnsc.1090.1070",2-s2.0-73249140114
"Gulati R., Singh H.","7101846769;55452702900;","The architecture of cooperation: Managing coordination costs and appropriation concerns in strategic alliances",1998,"Administrative Science Quarterly","43","4",,"781","814",,1250,"10.2307/2393616",2-s2.0-0032218715
"Henderson R.M., Clark K.B.","","Architectural innovation: The reconfiguration of existing product technologies and the failure of established firms",1990,"Administrative Science Quarterly","35","1",,"9","30",,3996,,2-s2.0-0001511053
"Langlois R.N.","7005549496;","Modularity in technology and organization",2002,"Journal of Economic Behavior and Organization","49","1",,"19","37",,424,"10.1016/S0167-2681(02)00056-2",2-s2.0-0036101597
"Langlois R.N., Garzarelli G.","7005549496;21933452300;","Of hackers and hairdressers: Modularity and the organizational economics of open-source collaboration",2008,"Industry and Innovation","15","2",,"125","143",,37,"10.1080/13662710801954559",2-s2.0-43049148345
"Ostrovsky M., Schwarz M.","15760758400;55696881000;","Adoption of standards under uncertainty",2005,"RAND Journal of Economics","36","4",,"816","832",,12,,2-s2.0-33744762417
"Parnas D.L.","7006616905;","On the criteria to be used in decomposing systems into modules",1972,"Communications of the ACM","15","12",,"1053","1058",,2413,"10.1145/361598.361623",2-s2.0-0015482049
"Parnas D.L., Weiss D.M.","7006616905;7401453469;","The Modular Structure of Complex Systems",1985,"IEEE Transactions on Software Engineering","SE-11","3",,"259","266",,157,"10.1109/TSE.1985.232209",2-s2.0-0021390213
"Pil F.K., Cohen S.K.","6603308671;55484135500;","Modularity: Implications for imitation, innovation, and sustained advantage",2006,"Academy of Management Review","31","4",,"995","1011",,158,"10.5465/AMR.2006.22528166",2-s2.0-33750394136
"Tiwana A.","6701805181;","Does interfirm modularity complement ignorance? A field study of software outsourcing alliances",2008,"Strategic Management Journal","29","11",,"1241","1252",,60,"10.1002/smj.694",2-s2.0-55349139344
"Tiwana A.","6701805181;","Does technological modularity substitute for control? A study of alliance performance in software outsourcing",2008,"Strategic Management Journal","29","7",,"769","780",,109,"10.1002/smj.673",2-s2.0-45849132750
"Tiwana A., Bush A.A.","6701805181;7201882734;","A comparison of transaction cost, agency, and knowledge-based theory predictors of IT outsourcing decisions: A U.S.-Japan cross-cultural field study",2007,"Journal of Management Information Systems","24","1",,"259","300",,108,"10.2753/MIS0742-1222240108",2-s2.0-38349112024
"Williamson O.E.","",[No title available],1985,"The Economic Institutions of Capitalism",,,,"","",,16071,,2-s2.0-0003531998
"Williamson O.E.","7004261204;","Strategy research: Governance and competence perspectives",1999,"Strategic Management Journal","20","12",,"1087","1108",,782,"10.1002/(SICI)1097-0266(199912)20:12<1087::AID-SMJ71>3.0.CO;2-Z",2-s2.0-0000400312
"Williamson O.E.","7004261204;","Transaction cost economics: The natural progression",2010,"American Economic Review","100","3",,"673","690",,123,"10.1257/aer.100.3.673",2-s2.0-77956134489
"Young-Ybarra C., Wiersema M.","6508217619;7005349360;","Strategic Flexibility in Information Technology Alliances: The Influence of Transaction Cost Economics and Social Exchange Theory",1999,"Organization Science","10","4",,"439","459",,390,"10.1287/orsc.10.4.439",2-s2.0-0033420984
"Zweben S.H., Edwards S.H., Weide B.W., Hollingsworth J.E.","7006473417;7401520439;7003366941;7102185035;","The Effects of Layering and Encapsulation on Software Development Cost and Quality",1995,"IEEE Transactions on Software Engineering","21","3",,"200","208",,28,"10.1109/32.372147",2-s2.0-0029267836
"Anderson S.W., Dekker H.C.","7404216309;7006227398;","Management control for market transactions: The relation between transaction characteristics, incomplete contract design, and subsequent performance",2005,"Management Science","51","12",,"1734","1752",,185,"10.1287/mnsc.1050.0456",2-s2.0-29144482523
"Athey S., Roberts J.","6603691303;56925834500;","Organizational economics: Organizational design: Decision rights and incentive contracts",2001,"American Economic Review","91","2",,"200","205",,52,"10.1257/aer.91.2.200",2-s2.0-0040483380
"Bernheim B.D., Whinston M.D.","6701894742;6603457527;","Incomplete Contracts and Strategic Ambiguity",1998,"American Economic Review","88","4",,"902","932",,234,,2-s2.0-0042578958
