Authors,Author(s) ID,Title,Year,Source title,Volume,Issue,Art. No.,Page start,Page end,Page count,Cited by,DOI,EID
"Adler P.S., Kwon S.-W.","7202767531;7402624567;","Social capital: Prospects for a new concept",2002,"Academy of Management Review","27","1",,"17","40",,4122,"10.5465/AMR.2002.5922314",2-s2.0-0036001864
"Agrawal A., Catalini C., Goldfarb A.","36169100800;35336093100;7101785996;","Some simple economics of crowdfunding",2014,"Innovation Policy and the Economy","14","1",,"63","97",,188,"10.1086/674021",2-s2.0-84902959218
"Bagozzi R.P., Yi Y., Phillips L.W.","","Assessing construct validity in organizational research",1991,"Administrative Science Quarterly","36","3",,"421","458",,2731,,2-s2.0-84936824236
"Baldwin C., von Hippel E.","7201893924;6701699615;","Modeling a paradigm shift: From producer innovation to user and open collaborative innovation",2011,"Organization Science","22","6",,"1399","1417",,365,"10.1287/orsc.1100.0618",2-s2.0-79959828986
"Bartelt D., Kreßner T.","","About Startnext [WWW Document]",2018,,,,,"","",,1,,2-s2.0-85063033396
"Bittner P.","","Karma Chakhs Werden Karma Classics [WWW Document]",2016,,,,,"","",,1,,2-s2.0-85063037348
"Blazevic V., Lievens A.","6602848336;6602626496;","Learning during the new financial service innovation process - Antecedents and performance effects",2004,"Journal of Business Research","57","4",,"374","391",,123,"10.1016/S0148-2963(02)00272-2",2-s2.0-1242328549
"Bolino M.C., Turnley W.H., Bloodgood J.M.","6701369361;6701400328;6701449546;","Citizenship behavior and the creation of social capital in organizations",2002,"Academy of Management Review","27","4",,"505","522",,534,"10.5465/AMR.2002.7566023",2-s2.0-0036804948
"Bruton G., Khavul S., Siegel D., Wright M.","6603867202;13006745800;7202706325;7401558861;","New financial alternatives in seeding entrepreneurship: Microfinance, crowdfunding, and peer-to-peer innovations",2015,"Entrepreneurship: Theory and Practice","39","1",,"9","26",,174,"10.1111/etap.12143",2-s2.0-84920747088
"Burt R.S.","",[No title available],1992,"Structural Holes: The Social Structure of Competition",,,,"","",,8361,,2-s2.0-0003468139
"Butticè V., Colombo M.G., Wright M.","57193211090;7203013774;7401558861;","Serial Crowdfunding, Social Capital, and Project Success",2017,"Entrepreneurship: Theory and Practice","41","2",,"183","207",,54,"10.1111/etap.12271",2-s2.0-85011715981
"Capaldo A.","16303222900;","Network structure and innovation: The leveraging of a dual network as a distinctive relational capability",2007,"Strategic Management Journal","28","6",,"585","608",,440,"10.1002/smj.621",2-s2.0-34248154339
"Carbonell P., Rodríguez-Escudero A.I., Pujari D.","7004209533;6504006811;6602427236;","Customer involvement in new service development: An examination of antecedents and outcomes",2009,"Journal of Product Innovation Management","26","5",,"536","550",,208,"10.1111/j.1540-5885.2009.00679.x",2-s2.0-67650760063
"CB Insights","","The Top 20 Reasons Startups Fail [WWW Document]",2018,,,,,"","",,1,,2-s2.0-85063045521
"Chan C.S.R., Parhankangas A.","55248116700;6506008561;","Crowdfunding Innovative Ideas: How Incremental and Radical Innovativeness Influence Funding Outcomes",2017,"Entrepreneurship: Theory and Practice","41","2",,"237","263",,40,"10.1111/etap.12268",2-s2.0-85012892083
"Chang H.H., Chuang S.-S.","13309983900;57139590400;","Social capital and individual motivations on knowledge sharing: Participant involvement as a moderator",2011,"Information and Management","48","1",,"9","18",,348,"10.1016/j.im.2010.11.001",2-s2.0-79951580981
"Chang W., Taylor S.A.","56196406600;55628531450;","The effectiveness of customer participation in new product development: A meta-analysis",2016,"Journal of Marketing","80","1",,"47","64",,95,"10.1509/jm.14.0057",2-s2.0-84955616456
"Chatterji A.K., Fabrizio K.R.","7006166418;20433260000;","Using users: When does external knowledge enhance corporate product innovation?",2014,"Strategic Management Journal","35","10",,"1427","1445",,82,"10.1002/smj.2168",2-s2.0-84906778798
"Chen R., Sharma S.K., Raghav Rao H.","35725168900;34974810800;6602129275;","Members’ site use continuance on Facebook: Examining the role of relational capital",2016,"Decision Support Systems","90",,,"86","98",,11,"10.1016/j.dss.2016.07.001",2-s2.0-84992188026
"Chiu C.-M., Hsu M.-H., Wang E.T.G.","7402303944;7202371155;7403414376;","Understanding knowledge sharing in virtual communities: An integration of social capital and social cognitive theories",2006,"Decision Support Systems","42","3",,"1872","1888",,1536,"10.1016/j.dss.2006.04.001",2-s2.0-33750439144
"Cholakova M., Clarysse B.","","Does the possibility to make equity investments in crowdfunding projects crowd out reward-based investments?",2015,"Entrepreneurship Theory and Practice","39","1",,"145","172",,125,,2-s2.0-84934283953
"Cohen W.M., Levinthal D.A.","","Absorptive capacity: A new perspective on learning and innovation",1990,"Administrative Science Quarterly","35","1",,"128","152",,13653,,2-s2.0-84936166194
"Colombo M.G., Franzoni C., Rossi-Lamastra C.","7203013774;15755284200;57197758938;","Internal social capital and the attraction of early contributions in crowdfunding",2015,"Entrepreneurship: Theory and Practice","39","1",,"75","100",,238,"10.1111/etap.12118",2-s2.0-84905784948
"Courtney C., Dutta S., Li Y.","57192695520;56970420200;23097692500;","Resolving Information Asymmetry: Signaling, Endorsement, and Crowdfunding Success",2017,"Entrepreneurship: Theory and Practice","41","2",,"265","290",,58,"10.1111/etap.12267",2-s2.0-85007422262
"Coviello N.E., Joseph R.M.","8750738700;55958262800;","Creating major innovations with customers: Insights from small and young technology firms",2012,"Journal of Marketing","76","6",,"87","104",,125,"10.1509/jm.10.0418",2-s2.0-84869110087
"Criscuolo P., Nicolaou N., Salter A.","9235921800;23486488500;7005775452;","The elixir (or burden) of youth? Exploring differences in innovation between start-ups and established firms",2012,"Research Policy","41","2",,"319","333",,43,"10.1016/j.respol.2011.12.001",2-s2.0-84855927121
"Crosetto P., Regner T.","36801257300;55911725700;","It's never too late: Funding dynamics and self pledges in reward-based crowdfunding",2018,"Research Policy","47","8",,"1463","1477",,9,"10.1016/j.respol.2018.04.020",2-s2.0-85046675138
"Cuevas-Rodríguez G., Cabello-Medina C., Carmona-Lavado A.","24079561100;56449081700;13610389200;","Internal and external social capital for radical product innovation: Do they always work well together?",2014,"British Journal of Management","25","2",,"266","284",,57,"10.1111/1467-8551.12002",2-s2.0-84897963200
"Cui A.S., Wu F.","36969185500;55767116300;","Utilizing customer knowledge in innovation: antecedents and impact of customer involvement on new product performance",2016,"Journal of the Academy of Marketing Science","44","4",,"516","538",,98,"10.1007/s11747-015-0433-x",2-s2.0-84924559393
"Cui A.S., Wu F.","36969185500;55767116300;","The Impact of Customer Involvement on New Product Development: Contingent and Substitutive Effects",2017,"Journal of Product Innovation Management","34","1",,"60","80",,24,"10.1111/jpim.12326",2-s2.0-84994682498
"Danish Ministry of Business and Growth","","Crowdfunding in Denmark. Copenhagen",2015,,,,,"","",,1,,2-s2.0-85063057938
"Di Pietro F., Prencipe A., Majchrzak A.","57200379477;6603066973;7004097019;","Crowd equity investors: An underutilized asset for open innovation in startups",2018,"California Management Review","60","2",,"43","70",,9,"10.1177/0008125617738260",2-s2.0-85041037434
"European Union","","Luchtsingel [WWW Document]. Mies Van Der Rohe Award 2017",2017,,,,,"","",,1,,2-s2.0-85063066358
"Fang E.","16309368100;","Customer participation and the trade-off between new product innovativeness and speed to market",2008,"Journal of Marketing","72","4",,"90","104",,286,"10.1509/jmkg.72.4.90",2-s2.0-47849101911
"Fornell C., Larcker D.F.","","Evaluating structural equation models with unobservable variables and measurement error",1981,"Journal of Marketing Research","18","FEBRUARY",,"39","50",,27866,,2-s2.0-0000009769
"Foss N.J., Laursen K., Pedersen T.","7005282199;7004965066;7202189812;","Linking customer interaction and innovation: The mediating role of new organizational practices",2011,"Organization Science","22","4",,"980","999",,231,"10.1287/orsc.1100.0584",2-s2.0-79960854993
"Gedajlovic E., Honig B., Moore C.B., Payne G.T., Wright M.","6602398805;56248556200;15822236900;55666762200;7401558861;","Social Capital and Entrepreneurship: A Schema and Research Agenda",2013,"Entrepreneurship: Theory and Practice","37","3",,"455","478",,167,"10.1111/etap.12042",2-s2.0-84876437426
"Gemser G., Perks H.","6602349235;6603023204;","Co-Creation with Customers: An Evolving Innovation Research Field",2015,"Journal of Product Innovation Management","32","5",,"660","665",,39,"10.1111/jpim.12279",2-s2.0-84937888253
"Gerber E.M., Hui J.","36084552700;56012523400;","Crowdfunding: Motivations and deterrents for participation",2013,"ACM Transactions on Computer-Human Interaction","20","6", 34,"","",,204,"10.1145/2530540",2-s2.0-84892899806
"Giudici G., Guerini M., Rossi-Lamastra C.","22984678100;57201976747;57197758938;","Reward-based crowdfunding of entrepreneurial projects: the effect of local altruism and localized social capital on proponents’ success",2018,"Small Business Economics","50","2",,"307","324",,32,"10.1007/s11187-016-9830-x",2-s2.0-85008477666
"Griffin A., Hauser J.R.","","The voice of the customer",1993,"Marketing Science","12","1",,"1","27",,1057,,2-s2.0-0004816858
"Gruner K.E., Homburg C.","6701592260;35611075400;","Does customer interaction enhance new product success?",2000,"Journal of Business Research","49","1",,"1","14",,376,"10.1016/S0148-2963(99)00013-2",2-s2.0-0034216472
"Hair J.F., Anderson R.E., Tatham R.L., Black W.C.","",[No title available],1995,"Multivariate Data Analysis",,,,"","",,48174,,2-s2.0-0003506109
"Haudum P., Schmied M., Fuchs G., Aufschnaiter C., Bürtlmair H.","","Nuapua Campaign [WWW Document]",2015,,,,,"","",,1,,2-s2.0-85063036051
"Hoffmann S., Jehia A., Schmidt N., Listabarth J.","","Karma Classics Philosophy [WWW Document]",2017,,,,,"","",,1,,2-s2.0-85063043714
"Hoyer W.D., Chandy R., Dorotic M., Krafft M., Singh S.S.","7006517906;6701374916;36343330700;7006041194;23478562300;","Consumer cocreation in new product development",2010,"Journal of Service Research","13","3",,"283","296",,500,"10.1177/1094670510375604",2-s2.0-77955637589
"Hsu M.-H., Chang C.-M.","7202371155;14031274700;","Examining interpersonal trust as a facilitator and uncertainty as an inhibitor of intra-organisational knowledge sharing",2014,"Information Systems Journal","24","2",,"119","142",,51,"10.1111/isj.12000",2-s2.0-84892853374
"Im S., Workman Jr. J.P.","7201624964;7101955380;","Market Orientation, Creativity, and New Product Performance in High-Technology Firms",2004,"Journal of Marketing","68","2",,"114","132",,500,"10.1509/jmkg.68.2.114.27788",2-s2.0-2142805831
"Inkpen A.C., Tsang E.W.K.","6603865734;7004402536;","Social capital networks, and knowledge transfer",2005,"Academy of Management Review","30","1",,"146","165",,1761,"10.5465/AMR.2005.15281445",2-s2.0-11344265322
"Kang L., Jiang Q., Tan C.-H.","56245385900;55067369800;13008646400;","Remarkable advocates: An investigation of geographic distance and social capital for crowdfunding",2017,"Information and Management","54","3",,"336","348",,25,"10.1016/j.im.2016.09.001",2-s2.0-85009164804
"Kleinbaum D.G., Kupper L.L., Muller K.E.","",[No title available],1988,"Applied Regression Analysis and Other Multivariable Methods",,,,"","",,7652,,2-s2.0-0003431468
"Korunka C., Frank H., Lueger M., Mugler J.","","The entrepreneurial personality in the context of resources, environment, and the startup process - A configurational approach",2003,"Entrepreneurship Theory and Practice","28","1",,"23","42",,185,,2-s2.0-20344377471
"Landeros R., Monczka R.M.","","Cooperative buyer/seller relationships and a firm's competitive posture",1989,"Journal of Purchasing and Materials Management","25","3",,"9","18",,162,,2-s2.0-0002368155
"Lehner O.M.","37088962700;","The formation and interplay of social capital in crowdfunded social ventures",2014,"Entrepreneurship and Regional Development","26","5-6",,"478","499",,41,"10.1080/08985626.2014.922623",2-s2.0-84904418567
"Lüthje C., Herstatt C.","57204481720;6508325339;","The Lead User method: An outline of empirical findings and issues for future research",2004,"R and D Management","34","5",,"553","568",,245,"10.1111/j.1467-9310.2004.00362.x",2-s2.0-8644265252
"Lynch P., O'Toole T., Biemans W.","56100496900;7006733254;6507141253;","Measuring Involvement of a Network of Customers in NPD",2016,"Journal of Product Innovation Management","33","2",,"166","180",,13,"10.1111/jpim.12293",2-s2.0-84955196886
"Mahr D., Lievens A., Blazevic V.","36727950100;6602626496;6602848336;","The value of customer cocreated knowledge during the innovation process",2014,"Journal of Product Innovation Management","31","3",,"599","615",,114,"10.1111/jpim.12116",2-s2.0-84897977776
"Malhotra N.K., Kim S.S., Patil A.","55947666500;9243964900;15521148400;","Common method variance in IS research: A comparison of alternative approaches and a reanalysis of past research",2006,"Management Science","52","12",,"1865","1883",,1246,"10.1287/mnsc.1060.0597",2-s2.0-33845547851
"Mathwick C., Wiertz C., De Ruyter K.","6506992791;6507731920;7004664517;","Social capital production in a virtual P3 community",2008,"Journal of Consumer Research","34","6",,"832","849",,300,"10.1086/523291",2-s2.0-42549162920
"Mollick E.","8683215400;","The dynamics of crowdfunding: An exploratory study",2014,"Journal of Business Venturing","29","1",,"1","16",,908,"10.1016/j.jbusvent.2013.06.005",2-s2.0-84887164772
"Mollick E., Robb A.","8683215400;15846784700;","Democratizing innovation and capital access: The role of crowdfunding",2016,"California Management Review","58","2",,"72","87",,48,"10.1525/cmr.2016.58.2.72",2-s2.0-84961933246
"Moorman C.","","Organizational market information processes: Cultural antecedents and new product outcomes",1995,"Journal of Marketing Research","32","AUGUST",,"318","335",,597,,2-s2.0-0006475012
"Moorman C., Zaltman G., Deshpande R.","","Relationships between providers and users of market research: The dynamics of trust within and between organizations",1992,"Journal of Marketing Research","29","AUGUST",,"314","328",,2015,,2-s2.0-0001154055
"Moran P.","8910926400;","Structural vs. relational embeddedness: Social capital and managerial performance",2005,"Strategic Management Journal","26","12",,"1129","1151",,554,"10.1002/smj.486",2-s2.0-27544446016
"Nahapiet J., Ghoshal S.","24394168400;7006765666;","Social capital, intellectual capital, and the organizational advantage",1998,"Academy of Management Review","23","2",,"242","266",,7689,"10.5465/AMR.1998.533225",2-s2.0-0032375624
"Nambisan S.","55946896600;","Designing virtual customer environments for new product development: Toward a theory",2002,"Academy of Management Review","27","3",,"392","413",,545,"10.5465/AMR.2002.7389914",2-s2.0-0036637960
"Nambisan S.","55946896600;","Digital Entrepreneurship: Toward a Digital Technology Perspective of Entrepreneurship",2017,"Entrepreneurship: Theory and Practice","41","6",,"1029","1055",,98,"10.1111/etap.12254",2-s2.0-84999622321
"Nambisan S., Lyytinen K., Majchrzak A., Song M.","","Digital innovation management: Reinventing innovation management research in a digital world",2017,"MIS Quarterly","41","1",,"223","238",,160,,2-s2.0-85016248484
"Nucciarelli A., Li F., Fernandes K.J., Goumagias N., Cabras I., Devlin S., Kudenko D., Cowling P.","23983021000;36071633100;7004063674;54924337500;24069922500;37107376400;6603157921;7004182371;","From value chains to technological platforms: The effects of crowdfunding in the digital game industry",2017,"Journal of Business Research","78",,,"341","352",,19,"10.1016/j.jbusres.2016.12.030",2-s2.0-85014165304
"Pavlou P.A., Gefen D.","6507186334;6601945888;","Building effective online marketplaces with institution-based trust",2004,"Information Systems Research","15","1",,"37","59+108",,1156,,2-s2.0-2442676514
"Pavlou P.A., Huigang L., Yajiong X.","6507186334;7402854012;7402270439;","Understanding and mitigating uncertainty in online exchange relationships: A principal-agent perspective",2007,"MIS Quarterly: Management Information Systems","31","1",,"105","135",,1051,,2-s2.0-33847764616
"Pérez-Luño A., Cabello Medina C., Carmona Lavado A., Cuevas Rodríguez G.","24071687500;56449081700;13610389200;24079561100;","How social capital and knowledge affect innovation",2011,"Journal of Business Research","64","12",,"1369","1376",,102,"10.1016/j.jbusres.2011.01.014",2-s2.0-80052894225
"Podsakoff P.M., Organ D.W.","6603818084;7004704776;","Self-Reports in Organizational Research: Problems and Prospects",1986,"Journal of Management","12","4",,"531","544",,7972,"10.1177/014920638601200408",2-s2.0-84970235764
"Podsakoff P.M., MacKenzie S.B., Podsakoff N.P.","6603818084;7102357879;8738236500;","Sources of method bias in social science research and recommendations on how to control it",2012,"Annual Review of Psychology","63",,,"539","569",,2556,"10.1146/annurev-psych-120710-100452",2-s2.0-82955240674
"Preacher K.J., Hayes A.F.","6602519801;7201978687;","SPSS and SAS procedures for estimating indirect effects in simple mediation models",2004,"Behavior Research Methods, Instruments, and Computers","36","4",,"717","731",,7848,"10.3758/BF03206553",2-s2.0-13844271275
"Randhawa K., Wilden R., Hohberger J.","55523208900;24072600100;54420008700;","A Bibliometric Review of Open Innovation: Setting a Research Agenda",2016,"Journal of Product Innovation Management","33","6",,"750","772",,109,"10.1111/jpim.12312",2-s2.0-84959514229
"Ridings C.M., Gefen D., Arinze B.","6506092713;6601945888;6601998205;","Some antecedents and effects of trust in virtual communities",2002,"Journal of Strategic Information Systems","11","3-4",,"271","295",,767,"10.1016/S0963-8687(02)00021-5",2-s2.0-84867962905
"Risterucci F.","","The ten commandments of crowdfunding",2016,"Eds.), Crowdfunding in Europe",,,,"241","248",,2,,2-s2.0-85063038188
"Roma P., Messeni Petruzzelli A., Perrone G.","35316537000;21743792400;7006216642;","From the crowd to the market: The role of reward-based crowdfunding performance in attracting professional investors",2017,"Research Policy","46","9",,"1606","1628",,17,"10.1016/j.respol.2017.07.012",2-s2.0-85027525354
"Roma P., Gal-Or E., Chen R.R.","35316537000;6603634202;36023260400;","Reward-based crowdfunding campaigns: Informational value and access to venture capital",2018,"Information Systems Research","29","3",,"679","697",,10,"10.1287/isre.2018.0777",2-s2.0-85055251892
