Authors,Author(s) ID,Title,Year,Source title,Volume,Issue,Art. No.,Page start,Page end,Page count,Cited by,DOI,EID
"Suárez Candel R.","","Digitalizing terrestrial broadcasting: Public policy and public service issues",2010,"Communication, Politics and Culture","43","2",,"99","117",,5,,2-s2.0-84857841227
"Lowe G.F.","","Beyond altruism. Why public participation in public service media matters",2010,"The Public in Public Service Media",,,,"9","35",,14,,2-s2.0-84899452834
"Nissen C.S.","","Public service media in the information society",2006,"Report Prepared For the Council of Europe's Group of Specialists On Public Service Broadcasting In the Information Society (MC-S-PSB)",,,,"","",,5,,2-s2.0-84906045219
"Trappel J.","26036603400;","Online media within the public service realm?: Reasons to include online into the public service mission",2008,"Convergence","14","3",,"313","322",,24,"10.1177/1354856508091083",2-s2.0-61049124069
"Suárez Candel R.","","Adapting Public Service to the Multiplatform Scenario: Challenges, Opportunities and Risks",2012,"Working Papers of the Hans-Bredow-Institut","25",,,"","",,4,,2-s2.0-84954512588
"Jakubowicz K.","",[No title available],2007,"Public Service Broadcasting: A New Beginning, Or the Beginning of the End?",,,,"","",,10,,2-s2.0-77957307402
[No author name available],[No author id available],[No title available],2014,"PSM Values Review. the Tool",,,,"","",,9,,2-s2.0-84961638534
