Authors,Author(s) ID,Title,Year,Source title,Volume,Issue,Art. No.,Page start,Page end,Page count,Cited by,DOI,EID
"Abbot A.","","The system of professions: An essay on the division of expert labor",1988,"Business History Review","80",,,"","",,1,,2-s2.0-85049025363
"Achtenhagen L., Raviola E.","24330658500;35174894000;","Balancing tensions during convergence: Duality management in a newspaper company",2009,"JMM International Journal on Media Management","11","1",,"32","41",,35,"10.1080/14241270802518505",2-s2.0-70449657434
"Aitamurto T., Lewis S.C.","55613354000;35215265400;","Open innovation in digital journalism: Examining the impact of Open APIs at four news organizations",2013,"New Media and Society","15","2",,"314","331",,40,"10.1177/1461444812450682",2-s2.0-84874572832
"Battilana J., Dorado S.","14119410800;12767713600;","Building sustainable hybrid organizations: The case of commercial microfinance organizations",2010,"Academy of Management Journal","53","6",,"1419","1440",,814,"10.5465/amj.2010.57318391",2-s2.0-77955687685
"Benkler Y.","6602418669;","The wealth of networks: How social production transforms markets and freedom",2006,"The Wealth of Networks: How Social Production Transforms Markets and Freedom",,,,"1","515",,3181,,2-s2.0-84881815286
"Berente N., Yoo Y.","23666390000;7201926488;","Institutional contradictions and loose coupling: Postimplementation of NASA's enterprise information system",2012,"Information Systems Research","23","2",,"376","396",,84,"10.1287/isre.1110.0373",2-s2.0-84871272136
"Brunsson N.","",[No title available],1989,"The Organization of Hypocrisy: Talk, Decisions and Actions in Organizations",,,,"","",,815,,2-s2.0-0003491580
"Carlsson U., Facht U.","",[No title available],2010,"MedieSverige 2010. Statistik och analys",,,,"","",,12,,2-s2.0-80052164495
"Charmaz K.","",[No title available],2006,"Constructing Grounded Theory: A Practical Guide Through Qualitative Analysis",,,,"","",,14741,,2-s2.0-33745634212
"Chesbrough H., Vanhaverbeke W., West J.","","New Frontiers in Open Innovation",2014,"New Frontiers in Open Innovation",,,,"","",,94,,2-s2.0-84908035484
"Cloutier C., Langley A.","55842152900;7006761979;","The Logic of Institutional Logics: Insights From French Pragmatist Sociology",2013,"Journal of Management Inquiry","22","4",,"360","380",,78,"10.1177/1056492612469057",2-s2.0-84883315769
"Coase R.H.","6506602060;","The Nature of the Firm",1937,"Economica","4","16",,"386","405",,10158,"10.1111/j.1468-0335.1937.tb00002.x",2-s2.0-84979188687
"Cooren F.","6603548062;","Communication Theory at the Center: Ventriloquism and the Communicative Constitution of Reality",2012,"Journal of Communication","62","1",,"1","20",,110,"10.1111/j.1460-2466.2011.01622.x",2-s2.0-84856557156
"Cooren F., Matte F., Benoit-Barné C., Brummans B.H.J.M.","6603548062;55825814000;16686503800;6507462558;","Communication as Ventriloquism: A Grounded-in-Action Approach to the Study of Organizational Tensions",2013,"Communication Monographs","80","3",,"255","277",,41,"10.1080/03637751.2013.788255",2-s2.0-84882257501
"Deephouse D.L., Suchman M.","","Legitimacy in organizational institutionalism",2008,"The Sage Handbook of Organizational Institutionalism",,,,"49","77",,562,,2-s2.0-57649118484
"Doty D.H., Glick W.H.","","Typologies as a unique form of theory building: Toward improved understanding and modeling",1994,"Academy of Management Review","19","2",,"230","251",,740,,2-s2.0-21344483530
"Dyck B.","7003433957;","Understanding configuration and transformation through a multiple rationalities approach",1997,"Journal of Management Studies","34","5",,"792","823",,24,,2-s2.0-0038873522
"Evetts J.","7101659371;","A new professionalism? challenges and opportunities",2011,"Current Sociology","59","4",,"406","422",,227,"10.1177/0011392111402585",2-s2.0-79959704976
"Facht U., Hellingwerf K.","",[No title available],2011,"Nordicom-Sveriges Internetbarometer 2010",,,,"","",,5,,2-s2.0-84878787196
"Fichman R.G., Dos Santos B.L., Zheng Z.","6701846129;7003452285;36792438800;","Digital innovation as a fundamental and powerful concept in the information systems curriculum",2014,"MIS Quarterly: Management Information Systems","38","2",,"329","353",,178,,2-s2.0-84923459614
"Findahl O.","","Swedes and the Internet",2013,"Swedes and the Internet",,,,"","",,30,,2-s2.0-84901441728
"Fournier V.","7006988320;","The appeal to 'professionalism' as a disciplinary mechanism",1999,"Sociological Review","47","2",,"X","307",,378,"10.1111/1467-954X.00173",2-s2.0-0033130091
"Freidson E.","",[No title available],2001,"Professionalism: The Third Logic",,,,"","",,1881,,2-s2.0-0003663923
"Frey C.B., Osborne M.A.","","The future of employment: how susceptible are jobs to computerization?",2013,"The Future of Employment: How Susceptible Are Jobs to Computerisation?",,,,"","",,669,,2-s2.0-84909987944
"Friedland R., Alford R.R.","","Bringing society back in: Symbols, practices, and institutional contradictions",1991,"The New Institutionalism in Organizational Analysis",,,,"232","263",,2093,,2-s2.0-0002464333
"Gawer A., Phillips N.","6506170616;7201973206;","Institutional Work as Logics Shift: The Case of Intel's Transformation to Platform Leader",2013,"Organization Studies","34","8",,"1035","1071",,74,"10.1177/0170840613492071",2-s2.0-84881133557
"Glynn M.A., Lounsbury M.","35876625400;6603381168;","From the critics corner: Logic blending, discursive change and authenticity in a cultural production system",2005,"Journal of Management Studies","42","5",,"1031","1055",,176,"10.1111/j.1467-6486.2005.00531.x",2-s2.0-22544485097
"Glynn M.A.","","Patricia Thornton, William Ocasio, and Michael Lounsbury: The Institutional Logics Perspective: A New Approach to Culture, Structure, and Process",2013,"Administrative Science Quarterly","58","3",,"493","495",,6,,2-s2.0-85016381817
"Goodrick E., Reay T.","6507672434;6602884395;","Constellations of institutional logics: Changes in the professional work of pharmacists",2011,"Work and Occupations","38","3",,"372","416",,175,"10.1177/0730888411406824",2-s2.0-79961079511
"Greenstein S., Lerner J., Stern S.","7005620197;7101861907;36187349000;","Digitization, innovation, and copyright: What is the agenda?",2013,"Strategic Organization","11","1",,"110","121",,10,"10.1177/1476127012460940",2-s2.0-84872909962
"Greenwood R., Díaz A.M., Li S.X., Lorente J.C.","7202083866;57204102668;22938515700;6507121427;","The multiplicity of institutional logics and the heterogeneity of organizational responses",2010,"Organization Science","21","2",,"521","539",,372,"10.1287/orsc.1090.0453",2-s2.0-77957004287
"Greenwood R., Raynard M., Kodeih F., Micelotta E.R., Lounsbury M.","7202083866;44462056100;44461535000;55508650800;6603381168;","Institutional complexity and organizational responses",2011,"Academy of Management Annals","5","1",,"317","371",,863,"10.1080/19416520.2011.590299",2-s2.0-79960761920
"Gustafsson K.E., Hadenius S.","",[No title available],1976,"Swedish Press Policy",,,,"","",,13,,2-s2.0-70349528038
"Hadenius S.","57189585770;","The rise and possible fall of the swedish party press",1983,"Communication Research","10","3",,"287","310",,6,"10.1177/009365083010003002",2-s2.0-84973192614
"Hesse-Biber S., Dupuis P., Kinder T.S.","6602782716;7006494916;8979308000;","HyperRESEARCH: A computer program for the analysis of qualitative data with an emphasis on hypothesis testing and multimedia analysis",1991,"Qualitative Sociology","14","4",,"289","306",,36,"10.1007/BF00989642",2-s2.0-0000801779
"Johnson T.","","Professions and power",1972,"Professions and Power",,,,"","",,1267,,2-s2.0-0003496072
"Keith S.","","Shifting circles: Reconceptualizing Shoemaker and Reese's theory of a hierarchy of influences on media content for a newer media era",2011,"Web Journal of Mass Communication Research","29","1",,"","",,9,,2-s2.0-85024835568
"Kemppainen P.","57196618509;","The role of public service in digitization of radio",2012,"Journal of Media Business Studies","9","1",,"71","83",,1,"10.1080/16522354.2012.11073537",2-s2.0-84877086658
"Kent M.L., Taylor M.","36243713500;55248559300;","Building dialogic relationships through the World Wide Web",1998,"Public Relations Review","24","3",,"321","334",,459,"10.1016/S0363-8111(99)80143-X",2-s2.0-0032164127
"Kodeih F., Greenwood R.","44461535000;7202083866;","Responding to Institutional Complexity: The Role of Identity",2014,"Organization Studies","35","1",,"7","39",,82,"10.1177/0170840613495333",2-s2.0-84891669636
"Kraatz M.S., Block E.S.","","Organizational implications of institutional pluralism",2008,"The Handbook of Organizational Institutionalism",,,,"243","275",,558,,2-s2.0-50649112047
"Krumsvik A.H.","55445782700;","Newspaper Ownership And The Prioritization Of Digital Competences",2015,"Digital Journalism","3","5",,"777","790",,1,"10.1080/21670811.2014.941234",2-s2.0-84977538417
"Larson M.S.","",[No title available],1977,"The Rise of Professionalism: A Sociological Analysis",,,,"","",,2152,,2-s2.0-0003444684
"Larson M.","","Professionalism: The third logic",2003,"Perspectives in Biology and Medicine","46","3",,"458","462",,6,,2-s2.0-79960019994
"Lee M.-D.P., Lounsbury M.","23568288200;6603381168;","Filtering institutional logics: Community logic variation and differential responses to the institutional complexity of toxic waste",2015,"Organization Science","26","3",,"847","866",,52,"10.1287/orsc.2014.0959",2-s2.0-84930420773
"Levitt T.","","Marketing myopia",1960,"Harvard Business Review","38","4",,"45","56",,1149,,2-s2.0-0002288096
"Lounsbury M.","6603381168;","A tale of two cities: Competing logics and practice variation in the professionalizing of mutual funds",2007,"Academy of Management Journal","50","2",,"289","307",,605,"10.5465/AMJ.2007.24634436",2-s2.0-34248562991
"Lowrey W.","10641020100;","Institutionalism, news organizations and innovation",2011,"Journalism Studies","12","1",,"64","79",,45,"10.1080/1461670X.2010.511954",2-s2.0-79551479293
"Lowrey W.","10641020100;","Journalism Innovation and the Ecology of News Production: Institutional Tendencies",2012,"Journalism and Communication Monographs","14","4",,"214","287",,37,"10.1177/1522637912463207",2-s2.0-84896771504
"Marquis C., Lounsbury M.","11142165800;6603381168;","Vive la résistance: Competing logics and the consolidation of U.S. community banking",2007,"Academy of Management Journal","50","4",,"799","820",,335,"10.5465/AMJ.2007.26279172",2-s2.0-34548783195
"McPherson C.M., Sauder M.","55922215000;12445981200;","Logics in Action: Managing Institutional Complexity in a Drug Court",2013,"Administrative Science Quarterly","58","2",,"165","196",,205,"10.1177/0001839213486447",2-s2.0-84887302638
"Miles M.B., Huberman A.M.","",[No title available],1994,"Qualitative Data Analysis",,,,"","",,37948,,2-s2.0-0003784156
"Ohlsson J.","","De första tidningsledarna",2009,"Ledarskap i framgångsrika tidningsföretag",,,,"43","112",,1,,2-s2.0-85049041182
"Ohlsson J.","","The Practice of Newspaper Ownership: fifty years of control and influence in the Swedish local press",2012,"The practice of newspaper ownership: Fifty years of control and influence in the Swedish local press",,,,"","",,10,,2-s2.0-84871300145
"O'Reilly T.","","What is Web 2.0?",2005,"What Is Web 2.0",,,,"","",,4003,,2-s2.0-33645830920
"Pache A.-C., Santos F.","36020328900;36947013200;","When worlds collide: The internal dynamics of organizational responses to conflicting institutional demands",2010,"Academy of Management Review","35","3",,"455","476",,581,"10.5465/AMR.2010.51142368",2-s2.0-77953352743
"Pache A.-C., Santos F.","36020328900;36947013200;","Inside the hybrid organization: Selective coupling as a response to competing institutional logics",2013,"Academy of Management Journal","56","4",,"972","1001",,532,"10.5465/amj.2011.0405",2-s2.0-84885006005
"Picard R.G.","7005583412;","Economics of print media",2014,"Handbook on the Economics of the Media",,,,"151","164",,5,"10.4337/9780857938893.00014",2-s2.0-84958116074
"Powell W.W.","","Neither market nor hierarchy: Network forms of organization",1990,"Research in Organizational Behavior","12",,,"295","336",,3697,,2-s2.0-0000820455
"Purdy J.M., Gray B.","7101718295;7202782596;","Conflicting logics, mechanisms of diffusion, and multilevel dynamics in emerging institutional fields",2009,"Academy of Management Journal","52","2",,"355","380",,208,"10.5465/AMJ.2009.37308255",2-s2.0-65249110505
"Reay T., Hinings C.R.","6602884395;6602709061;","Managing the rivalry of competing institutional logics",2009,"Organization Studies","30","6",,"629","652",,621,"10.1177/0170840609104803",2-s2.0-70449580641
"Rogers J.","",[No title available],2013,"The Death and Life of the Music Industry in the Digital Age",,,,"","",,34,,2-s2.0-84897058920
"Rolandsson B.","6507536597;","Partnerships with the police – logics and strategies of justification",2015,"Qualitative Research in Organizations and Management: An International Journal","10","1",,"2","20",,3,"10.1108/QROM-08-2013-1172",2-s2.0-84994324003
"Rolandsson B., Bergquist M., Ljungberg J.","6507536597;26424554300;6701375617;","Open source in the firm: Opening up professional practices of software development",2011,"Research Policy","40","4",,"576","587",,49,"10.1016/j.respol.2010.11.003",2-s2.0-79953242714
"Rothmann W., Koch J.","55629234000;34870129300;","Creativity in strategic lock-ins: The newspaper industry and the digital revolution",2014,"Technological Forecasting and Social Change","83","1",,"66","83",,28,"10.1016/j.techfore.2013.03.005",2-s2.0-84894448710
"Scott W.R.","",[No title available],1995,"Institutions and Organizations",,,,"","",,8022,,2-s2.0-0004168045
"Shoemaker P.J., Reese S.D.","",[No title available],1996,"Mediating the Message: Theories of Influences on Mass Media Content",,,,"","",,1691,,2-s2.0-0004132898
"Siggelkow N., Levinthal D.A.","6602903062;7003966546;","Escaping real (non-benign) competency traps: Linking the dynamics of organizational structure to the dynamics of search",2005,"Strategic Organization","3","1",,"85","115",,58,"10.1177/1476127005050521",2-s2.0-84993698805
"Siggelkow N., Rivkin J.W.","6602903062;6602506505;","When exploration backfires: Unintended consequences of multilevel organizational search",2006,"Academy of Management Journal","49","4",,"779","795",,121,"10.5465/AMJ.2006.22083053",2-s2.0-33749010108
"Siles I., Boczkowski P.J.","50362167000;6506539791;","Making sense of the newspaper crisis: A critical assessment of existing research and an agenda for future work",2012,"New Media and Society","14","8",,"1375","1394",,95,"10.1177/1461444812455148",2-s2.0-84870030630
"Singer J.B.","7402620138;","Who are these guys?: The online challenge to the notion of journalistic professionalism",2003,"Journalism","4","2",,"139","163",,199,"10.1177/1464884903004002021",2-s2.0-21344465483
"Singer J.B., Ashman I.","","Comment is free, but facts are sacred: User-generated content and ethical constructs at the Guardian",2009,"Journal of Mass Media Ethics","24","1",,"3","21",,118,,2-s2.0-70349644377
"Singer J.B., Hermida A., Domingo D., Heinonen A., Paulussen S., Quandt T., Reich Z., Vujnovic M.","",[No title available],2011,"Participatory Journalism: Guarding Open Gates at Online Newspapers",,,,"","",,177,,2-s2.0-80655148429
"Soloski J.","57189171341;","News reporting and professionalism: Some constraints on the reporting of the news",1989,"Media, Culture & Society","11","2",,"207","228",,173,"10.1177/016344389011002005",2-s2.0-84970378134
"Thorén C., Ågerfalk P.J., Edenius M.","35204118100;7801582709;6602394932;","Through the printing press: An account of open practices in the Swedish newspaper industry",2014,"Journal of the Association of Information Systems","15","11",,"779","804",,13,,2-s2.0-84911904242
"Thornton P.H.","7101791790;","The rise of the corporation in a craft industry: Conflict and conformity in institutional logics",2002,"Academy of Management Journal","45","1",,"81","101",,357,"10.2307/3069286",2-s2.0-0036003217
"Thornton P.H.","",[No title available],2004,"Markets from Culture: Institutional Logics and Organizational Decisions in Higher Education Publishing",,,,"","",,392,,2-s2.0-33645948019
"Thornton P.H., Jones C., Kury K.","7101791790;13004980400;12902719100;","Institutional Logics and Institutional Change in Organizations: Transformation in Accounting, Architecture, and Publishing",2005,"Research in the Sociology of Organizations","23",,,"125","170",,166,"10.1016/S0733-558X(05)23004-5",2-s2.0-33645924372
"Thornton P.H., Ocasio W.","7101791790;6603423569;","Institutional logics and the historical contingency of power in organizations: Executive succession in the higher education publishing industry, 1958-1990",1999,"American Journal of Sociology","105","3",,"801","843",,999,"10.1086/210361",2-s2.0-0040249021
"Thornton P.H., Ocasio W.","","Institutional logics",2008,"The Sage Handbook of Organizational Institutionalism",,,,"99","129",,954,,2-s2.0-49949096991
