Authors,Author(s) ID,Title,Year,Source title,Volume,Issue,Art. No.,Page start,Page end,Page count,Cited by,DOI,EID
"Abdelkafi N., Makhotin S., Posselt T.","6505544275;55629418600;11241551500;","Business model innovations for electric mobility-what can be learned from existing business model patterns?",2013,"International Journal of Innovation Management","17","1", 1340003,"","",,89,"10.1142/S1363919613400033",2-s2.0-84875290100
"Achtenhagen L., Melin L., Naldi L.","24330658500;7004720022;36061156100;","Dynamics of business models - strategizing, critical capabilities and activities for sustained value creation",2013,"Long Range Planning","46","6",,"427","442",,115,"10.1016/j.lrp.2013.04.002",2-s2.0-84887192772
"Amit R., Zott C.","7004998175;6508196211;","Value creation in e-business",2001,"Strategic Management Journal","22","6-7",,"493","520",,2117,"10.1002/smj.187",2-s2.0-0000355662
"Amit R., Zott C.","7004998175;6508196211;","Creating value through business model innovation",2012,"MIT Sloan Management Review","53","3",,"41","49",,353,,2-s2.0-84860491094
"Anderson J., Kupp M.","55731016600;55955497100;","Serving the poor: Drivers of business model innovation in mobile",2008,"info","10","1",,"5","12",,18,"10.1108/14636690810850120",2-s2.0-38549133886
"Andries P., Debackere K.","6508217231;35511547600;","Business model innovation: Propositions on the appropriateness of different learning approaches",2013,"Creativity and Innovation Management","22","4",,"337","358",,15,"10.1111/caim.12033",2-s2.0-84900305113
"Aspara J., Hietanen J., Tikkanen H.","35101416600;25654892800;7004053576;","Business model innovation vs replication: Financial performance implications of strategic emphases",2010,"Journal of Strategic Marketing","18","1",,"39","56",,64,"10.1080/09652540903511290",2-s2.0-77951529120
"Aspara J., Lamberg J.-A., Laukia A., Tikkanen H.","35101416600;6602491912;37117076900;7004053576;","Corporate business model transformation and inter-organizational cognition: The case of nokia",2013,"Long Range Planning","46","6",,"459","474",,67,"10.1016/j.lrp.2011.06.001",2-s2.0-84887192514
"Baden-Fuller C., Morgan M.S.","6602083936;7403025703;","Business models as models",2010,"Long Range Planning","43","2-3",,"156","171",,446,"10.1016/j.lrp.2010.02.005",2-s2.0-77952564431
"Baines T.S., Lightfoot H.W., Benedettini O., Kay J.M.","7004171985;23397401400;24536968400;7201938575;","The servitization of manufacturing: A review of literature and reflection on future challenges",2009,"Journal of Manufacturing Technology Management","20","5",,"547","567",,646,"10.1108/17410380910960984",2-s2.0-70349213748
"Barney J.","7004413102;","Firm Resources and Sustained Competitive Advantage",1991,"Journal of Management","17","1",,"99","120",,21150,"10.1177/014920639101700108",2-s2.0-84896930624
"Bellman R., Clark C.E., Malcolm D.G., Craft C.J., Ricciardi F.M.","","On the construction of a multi-stage, multi-person business game",1957,"Operations Research","5","4",,"469","503",,81,,2-s2.0-34147183724
"Berglund H., Sandström C.","9233992900;35118164800;","Business model innovation from an open systems perspective: Structural challenges and managerial solutions",2013,"International Journal of Product Development","18","3-4",,"274","285",,34,"10.1504/IJPD.2013.055011",2-s2.0-84879823743
"Berman S.J.","9276685000;","Digital transformation: Opportunities to create new business models",2012,"Strategy and Leadership","40","2",,"16","24",,90,"10.1108/10878571211209314",2-s2.0-84857671100
"Bock A.J., Opsahl T., George G., Gann D.M.","36808976300;25630767400;57201570526;7101878435;","The Effects of Culture and Structure on Strategic Flexibility during Business Model Innovation",2012,"Journal of Management Studies","49","2",,"279","305",,135,"10.1111/j.1467-6486.2011.01030.x",2-s2.0-84856757950
"Bocken N.M.P.","24328581100;","Sustainable venture capital - Catalyst for sustainable start-up success?",2015,"Journal of Cleaner Production","108",,,"647","658",,55,"10.1016/j.jclepro.2015.05.079",2-s2.0-84946478983
"Bocken N.M.P., Short S.W., Rana P., Evans S.","24328581100;55873715100;55873257200;57203513331;","A literature and practice review to develop sustainable business model archetypes",2014,"Journal of Cleaner Production","65",,,"42","56",,626,"10.1016/j.jclepro.2013.11.039",2-s2.0-84893788213
"Bohnsack R., Pinkse J., Kolk A.","55117132300;55881688400;22985485300;","Business models for sustainable technologies: Exploring business model evolution in the case of electric vehicles",2014,"Research Policy","43","2",,"284","300",,160,"10.1016/j.respol.2013.10.014",2-s2.0-84891829502
"Bucherer E., Eisert U., Gassmann O.","23972535200;16202672000;6602442967;","Towards Systematic Business Model Innovation: Lessons from Product Innovation Management",2012,"Creativity and Innovation Management","21","2",,"183","198",,112,"10.1111/j.1467-8691.2012.00637.x",2-s2.0-84876418451
"Casadesus-Masanell R., Zhu F.","6507426720;35749187800;","Business model innovation and competitive imitation: The case of sponsor-based business models",2013,"Strategic Management Journal","34","4",,"464","482",,190,"10.1002/smj.2022",2-s2.0-84874476136
"Cavalcante S.A.","49963009000;","Preparing for business model change: The ""pre-stage"" finding",2014,"Journal of Management and Governance","18","2",,"449","469",,12,"10.1007/s10997-012-9232-7",2-s2.0-84897402023
"Cavalcante S., Kesting P., Ulhøi J.","49963009000;55993481900;6603612816;","Business model dynamics and innovation: (re)establishing the missing linkages",2011,"Management Decision","49","8",,"1327","1342",,192,"10.1108/00251741111163142",2-s2.0-80052583897
"Chesbrough H.","6603859674;","Business model innovation: Opportunities and barriers",2010,"Long Range Planning","43","2-3",,"354","363",,1045,"10.1016/j.lrp.2009.07.010",2-s2.0-77952557399
"Chesbrough H., Crowther A.K.","6603859674;13905724400;","Beyond high tech: Early adopters of open innovation in other industries",2006,"R and D Management","36","3",,"229","236",,836,"10.1111/j.1467-9310.2006.00428.x",2-s2.0-33744773489
"Cucculelli M., Bettinelli C.","23096968700;39060976900;","Business models, intangibles and firm performance: evidence on corporate entrepreneurship from Italian manufacturing SMEs",2015,"Small Business Economics","45","2",,"329","350",,40,"10.1007/s11187-015-9631-7",2-s2.0-84933679384
"Dahlin K.B., Behrens D.M.","8449410500;57197440662;","When is an invention really radical?: Defining and measuring technological radicalness",2005,"Research Policy","34","5",,"717","737",,208,"10.1016/j.respol.2005.03.009",2-s2.0-20444480242
"Damanpour F.","6602364830;","Organizational complexity and innovation: Developing and testing multiple contingency models",1996,"Management Science","42","5",,"693","716",,587,"10.1287/mnsc.42.5.693",2-s2.0-0001036918
"De Reuver M., Bouwman H., Haaker T.","35776955900;7004140817;6603003633;","Business model roadmapping: A practical approach to come from an existing to a desired business model",2013,"International Journal of Innovation Management","17","1", 1340006,"","",,54,"10.1142/S1363919613400069",2-s2.0-84875310143
"De Reuver M., Bouwman H., MacInnes I.","","Business models dynamics for start-ups and innovating e-businesses",2009,"International Journal of Electronic Business","7","3",,"269","286",,20,,2-s2.0-84855354930
"Demil B., Lecocq X.","28367573500;56520124100;","Business model evolution: In search of dynamic consistency",2010,"Long Range Planning","43","2-3",,"227","246",,511,"10.1016/j.lrp.2010.02.004",2-s2.0-77952561414
"Denicolai S., Ramirez M., Tidd J.","16834471700;7201568218;6602639296;","Creating and capturing value from external knowledge: The moderating role of knowledge intensity",2014,"R and D Management","44","3",,"248","264",,36,"10.1111/radm.12065",2-s2.0-84900825106
"Deshler R., Smith K.","","Making business model innovation stick",2011,"People & Strategy","34","4",,"18","23",,8,,2-s2.0-84866661151
"Dmitriev V., Simmons G., Truong Y., Palmer M., Schneckenberg D.","57194195431;35739266200;27468022200;8338593100;25961148100;","An exploration of business model development in the commercialization of technology innovations",2014,"R and D Management","44","3",,"306","321",,31,"10.1111/radm.12066",2-s2.0-84900821308
"Doz Y.L., Kosonen M.","55951118300;24438282800;","Embedding strategic agility: A leadership agenda for accelerating business model renewal",2010,"Long Range Planning","43","2-3",,"370","382",,309,"10.1016/j.lrp.2009.07.006",2-s2.0-77952585003
"Dubin R.","",[No title available],1978,"Theory Building",,,,"","",,735,,2-s2.0-0004070238
"Dunford R., Palmer I., Benveniste Jodie J.","7005247956;56534804300;55666488400;","Business model replication for early and rapid internationalisation. The ING direct experience",2010,"Long Range Planning","43","5-6",,"655","674",,43,"10.1016/j.lrp.2010.06.004",2-s2.0-78049255739
"Borzo J.","",[No title available],2005,"Business 2010: Embracing the Challenge of Change",,,,"","",,29,,2-s2.0-84869139553
"Ennen E., Richter A.","35298989100;23486562500;","The whole is more than the sum of its parts- or is it? A review of the empirical literature on complementarities in organizations",2010,"Journal of Management","36","1",,"207","233",,182,"10.1177/0149206309350083",2-s2.0-73949138404
"Enkel E., Mezger F.","8373660100;35181692700;","Imitation processes and their application for business model innovation: An explorative study",2013,"International Journal of Innovation Management","17","1", 1340005,"","",,38,"10.1142/S1363919613400057",2-s2.0-84875352495
"Eppler M.J., Hoffmann F.","8548428700;54420069200;","Does method matter? An experiment on collaborative business model idea generation in teams",2012,"Innovation: Management, Policy and Practice","14","3",,"388","403",,14,"10.5172/impp.2012.14.3.388",2-s2.0-84871235148
"Eppler M.J., Hoffmann F., Bresciani S.","8548428700;54420069200;24778262500;","New business models through collaborative idea generation",2011,"International Journal of Innovation Management","15","6",,"1323","1341",,59,"10.1142/S1363919611003751",2-s2.0-82955194487
"Evans J.D., Johnson R.O.","57197523498;55848708100;","Tools for managing early-stage business model innovation",2013,"Research Technology Management","56","5",,"52","56",,9,"10.5437/08956308X5605007",2-s2.0-84883739248
"Ferreira F.N.H., Proença J.F., Spencer R., Cova B.","55907920000;24778742300;57193529951;6602541397;","The transition from products to solutions: External business model fit and dynamics",2013,"Industrial Marketing Management","42","7",,"1093","1101",,32,"10.1016/j.indmarman.2013.07.010",2-s2.0-84886717348
"Fleming L.","57203215454;","Recombinant uncertainty in technological search",2001,"Management Science","47","1",,"117","132",,949,"10.1287/mnsc.47.1.117.10671",2-s2.0-0035239264
"Foss N.J., Laursen K., Pedersen T.","7005282199;7004965066;7202189812;","Linking customer interaction and innovation: The mediating role of new organizational practices",2011,"Organization Science","22","4",,"980","999",,231,"10.1287/orsc.1100.0584",2-s2.0-79960854993
"Foss N.J., Pedersen T., Pyndt J., Schultz M.","",[No title available],2012,"Management Innovation",,,,"","",,3,,2-s2.0-84962250944
"Foss N.J., Saebi T.","","Business models and business model innovation: Bringing organization into the field",2015,"Business Model Innovation: The Organizational Dimension",,,,"1","23",,11,,2-s2.0-85003981596
"Foss N.J., Saebi T., Stieglitz N.","","Why Business Models are important in Entrepreneurship Research: what we have learned and where do we go from here?",2016,"Why business models are important in entrepreneurship research: What we have learned and where do we go from here?",,,,"1","45",,3,,2-s2.0-85003982451
"Foss N.J., Saebi T.","","Business model innovation: the role of leadership",2015,"Business Model Innovation: The Organizational Dimension",,,,"","",,26,,2-s2.0-84929293732
"Frankenberger K., Weiblen T., Csik M., Gassmann O.","36348424600;55350818300;55785500700;6602442967;","The 4I-framework of business model innovation: A structured view on process phases and challenges",2013,"International Journal of Product Development","18","3-4",,"249","273",,82,"10.1504/IJPD.2013.055012",2-s2.0-84879827834
"Fry L.W., Smith D.A.","","Congruence, contingency, and theory building",1987,"Academy of Management Review","12","1",,"117","132",,118,,2-s2.0-0000813037
"Gambardella A., McGahan A.M.","54984906100;6602186334;","Business-model innovation: General purpose technologies and their implications for industry structure",2010,"Long Range Planning","43","2-3",,"262","271",,223,"10.1016/j.lrp.2009.07.009",2-s2.0-77952584831
"George G., Bock A.J.","57201570526;36808976300;","The Business Model in Practice and its Implications for Entrepreneurship Research",2011,"Entrepreneurship: Theory and Practice","35","1",,"83","111",,308,"10.1111/j.1540-6520.2010.00424.x",2-s2.0-78751539206
"Giesen E., Berman S.J., Bell R., Blitz A.","22940496100;9276685000;22940099100;23134730300;","Three ways to successfully innovate your business model",2007,"Strategy and Leadership","35","6",,"27","33",,94,"10.1108/10878570710833732",2-s2.0-35548986199
"Girotra K., Netessine S.","23477156000;6506418938;","Business model innovation for sustainability",2013,"Manufacturing and Service Operations Management","15","4",,"537","544",,43,"10.1287/msom.2013.0451",2-s2.0-84885964963
"Girotra K., Netessine S.","23477156000;6506418938;","Four paths to business model innovation",2014,"Harvard Business Review",,"JUL-AUG 2014",,"","",,24,,2-s2.0-84903184603
"Günzel F., Holm A.B.","35362143200;35317210000;","One size does not fit all-understanding the front-end and back-end of business model innovation",2013,"International Journal of Innovation Management","17","1", 1340002,"","",,46,"10.1142/S1363919613400021",2-s2.0-84874932544
"Heath C., Knez M., Camerer C.","56234033500;6603476139;6603895625;","The strategic management of the entitlement process in the employment relationship",1993,"Strategic Management Journal","14","2 S",,"75","93",,42,"10.1002/smj.4250141008",2-s2.0-84989096047
"Henderson R.M., Clark K.B.","","Architectural innovation: The reconfiguration of existing product technologies and the failure of established firms",1990,"Administrative Science Quarterly","35","1",,"9","30",,3995,,2-s2.0-0001511053
"Holm A.B., Günzel F., Ulhøi J.P.","35317210000;35362143200;6603612816;","Openness in innovation and business models: Lessons from the newspaper industry",2013,"International Journal of Technology Management","61","3-4",,"324","348",,31,"10.1504/IJTM.2013.052674",2-s2.0-84875637215
"Huang H.-C., Lai M.-C., Kao M.-C., Chen Y.-C.","16033134700;36542871300;36998358400;41961065300;","Target costing, business model innovation, and firm performance: An empirical analysis of Chinese firms",2012,"Canadian Journal of Administrative Sciences","29","4",,"322","335",,15,"10.1002/CJAS.1229",2-s2.0-84873683866
"Huang H.-C., Lai M.-C., Lin L.-H., Chen C.-T.","16033134700;36542871300;25121290400;55874509400;","Overcoming organizational inertia to strengthen business model innovation: An open innovation perspective",2013,"Journal of Organizational Change Management","26","6",,"977","1002",,35,"10.1108/JOCM-04-2012-0047",2-s2.0-84885077172
"IBM","",[No title available],2006,"Expanding the Innovation Horizon: The Global CEO Study 2006",,,,"","",,101,,2-s2.0-34548311502
"Johnson M.W.","","The time has come for business model innovation",2010,"Leader to Leader","57","57",,"6","10",,8,,2-s2.0-84988424148
"Johnson M.W., Christensen C.M., Kagermann H.","26643304800;7201582837;24522220900;","Reinventing your business model",2008,"Harvard Business Review","86","12",,"50","59+129",,854,,2-s2.0-57549107662
"Karimi J., Walter Z.","6701604704;7004223156;","Corporate Entrepreneurship, Disruptive Business Model Innovation Adoption, and Its Performance: The Case of the Newspaper Industry",2016,"Long Range Planning","49","3",,"342","360",,33,"10.1016/j.lrp.2015.09.004",2-s2.0-84968904042
"Karpen I.O., Bove L.L., Lukas B.A.","53979853400;8091566500;7004682347;","Linking Service-Dominant Logic and Strategic Business Practice: A Conceptual Model of a Service-Dominant Orientation",2012,"Journal of Service Research","15","1",,"21","38",,139,"10.1177/1094670511425697",2-s2.0-84857407220
"Khanagha S., Volberda H., Oshri I.","55628632400;6701307964;55893717500;","Business model renewal and ambidexterity: Structural alteration and strategy formation process during transition to a Cloud business model",2014,"R and D Management","44","3",,"322","340",,60,"10.1111/radm.12070",2-s2.0-84900807075
"Kim S.K., Min S.","51561776100;12144354300;","Business model innovation performance: When does adding a new business model benefit an incumbent?",2015,"Strategic Entrepreneurship Journal","9","1",,"34","57",,51,"10.1002/sej.1193",2-s2.0-84924137571
"Kindström D.","24334956300;","Towards a service-based business model - Key aspects for future competitive advantage",2010,"European Management Journal","28","6",,"479","490",,181,"10.1016/j.emj.2010.07.002",2-s2.0-78049429232
"Koen P.A., Bertels H.M.J., Elsum I.R.","56580122700;36665696400;36699404300;","The three faces of Business model innovation: Challenges for established firms",2011,"Research Technology Management","54","3",,"52","59",,44,"10.5437/08953608X5403009",2-s2.0-83155168500
"Lakatos I.","","Falsification and the methodology of scientific research programmes",1970,"Criticism and the Growth of Knowledge",,,,"91","195",,14,,2-s2.0-84992829548
"Lambert S.C., Davidson R.A.","23486228600;36124755400;","Applications of the business model in studies of enterprise success, innovation and classification: An analysis of empirical research from 1996 to 2010",2013,"European Management Journal","31","6",,"668","681",,111,"10.1016/j.emj.2012.07.007",2-s2.0-84887825737
"Laursen K., Salter A.","7004965066;7005775452;","Open for innovation: The role of openness in explaining innovation performance among U.K. manufacturing firms",2006,"Strategic Management Journal","27","2",,"131","150",,2421,"10.1002/smj.507",2-s2.0-31944450165
"Levinthal D.A.","7003966546;","Adaptation on rugged landscapes",1997,"Management Science","43","7",,"934","950",,962,"10.1287/mnsc.43.7.934",2-s2.0-0031176451
"Lindgardt Z., Reeves M., Stalk G., Deimler M.S.","","Business model innovation. When the game gets tough, change the game",2009,"Business Model Innovation: When the Game Gets Tough, Change the Game",,,,"","",,88,,2-s2.0-81055126452
"Magretta J.","6506453670;","Why business models matter",2002,"Harvard Business Review","80","5",,"86","87",,1058,,2-s2.0-0036580233
"Maier M.W., Emery D., Hilliard R.","7201526497;7101761532;7003707641;","Software architecture: Introducing IEEE standard 1471",2001,"Computer","34","4",,"107","109",,65,"10.1109/2.917550",2-s2.0-0035311483
"Malhotra Y.","6603708721;","Knowledge Management and New Organization Forms: A Framework for Business Model Innovation",2000,"Information Resources Management Journal (IRMJ)","13","1",,"5","14",,103,"10.4018/irmj.2000010101",2-s2.0-85001575087
"Markides C.","6602855130;","Disruptive innovation: In need of better theory",2006,"Journal of Product Innovation Management","23","1",,"19","25",,416,"10.1111/j.1540-5885.2005.00177.x",2-s2.0-33645162309
